Learning to Extract API Mentions from Informal Natural Language Discussions.	Deheng Ye, Zhenchang Xing, Chee Yong Foo, Jing Li, Nachiket Kapre	icsme2016	When discussing programming issues on social platforms (e.g, Stack Overflow, Twitter), developers often mention APIs in natural language texts. Extracting API mentions in natural language texts is a prerequisite for effective indexing and searching for API-related information in software engineering social content. However, the informal nature of social discussions creates two fundamental challenges for API extraction: common-word polysemy and sentence-format variations. Common-word polysemy refers to the ambiguity between the API sense of a common word and the normal sense of the word (e.g., append, apply and merge). Sentence-format variations refer to the lack of consistent sentence writing format for inferring API mentions. Existing API extraction techniques fall short to address these two challenges, because they assume distinct API naming conventions (e.g., camel case, underscore) or structured sentence format (e.g., code-like phrase, API annotation, or full API name). In this paper, we propose a semi-supervised machine-learning approach that exploits name synonyms and rich semantic context of API mentions to extract API mentions in informal social text. The key innovation of our approach is to exploit two complementary unsupervised language models learned from the abundant unlabeled text to model sentence-format variations and to train a robust model with a small set of labeled data and an iterative self-training process. The evaluation of 1,205 API mentions of the three libraries (Pandas, Numpy, and Matplotlib) in Stack Overflow texts shows that our approach significantly outperforms existing API extraction techniques based on language-convention and sentence-format heuristics and our earlier machine-learning based method for named-entity recognition.
On the Vocabulary Agreement in Software Issue Descriptions.	Oscar Chaparro, Juan Manuel Florez, Andrian Marcus	icsme2016	Many software comprehension tasks depend on how stakeholders textually describe their problems. These textual descriptions are leveraged by Text Retrieval (TR)-based solutions to more than 20 software engineering tasks, such as duplicate issue detection. The common assumption of such methods is that text describing the same issue in multiple places will have a common vocabulary. This paper presents an empirical study aimed at verifying this assumption and discusses the impact of the common vocabulary on duplicate issue detection. The study investigated 13K+ pairs of duplicate bug reports and Stack Overflow (SO) questions. We found that on average, more than 12.2% of the duplicate pairs do not have common terms. The other duplicate issue descriptions share, on average, 30% of their vocabulary. The good news is that these duplicates have significantly more terms in common than the non-duplicates. We also found that the difference between the lexical agreement of duplicate and non-duplicate pairs is a good predictor for the performance of TR-based duplicate detection.
Mining Stack Overflow for discovering error patterns in SQL queries.	Csaba Nagy, Anthony Cleve	icsme2015	Constructing complex queries in SQL sometimes necessitates the use of language constructs and the invocation of internal functions which inexperienced developers find hard to comprehend or which are unknown to them. In the worst case, bad usage of these constructs might lead to errors, to ineffective queries, or hamper developers in their tasks. This paper presents a mining technique for Stack Overflow to identify error-prone patterns in SQL queries. Identifying such patterns can help developers to avoid the use of error-prone constructs, or if they have to use such constructs, the Stack Overflow posts can help them to properly utilize the language. Hence, our purpose is to provide the initial steps towards a recommendation system that supports developers in constructing SQL queries. Our current implementation supports the MySQL dialect, and Stack Overflow has over 300,000 questions tagged with the MySQL flag in its database. It provides a huge knowledge base where developers can ask questions about real problems. Our initial results indicate that our technique is indeed able to identify patterns among them.
Choosing your weapons: On sentiment analysis tools for software engineering research.	Robbert Jongeling, Subhajit Datta, Alexander Serebrenik	icsme2015	Recent years have seen an increasing attention to social aspects of software engineering, including studies of emotions and sentiments experienced and expressed by the software developers. Most of these studies reuse existing sentiment analysis tools such as SentiStrength and NLTK. However, these tools have been trained on product reviews and movie reviews and, therefore, their results might not be applicable in the software engineering domain. In this paper we study whether the sentiment analysis tools agree with the sentiment recognized by human evaluators (as reported in an earlier study) as well as with each other. Furthermore, we evaluate the impact of the choice of a sentiment analysis tool on software engineering studies by conducting a simple study of differences in issue resolution times for positive, negative and neutral texts. We repeat the study for seven datasets (issue trackers and Stack Overflow questions) and different sentiment analysis tools and observe that the disagreement between the tools can lead to contradictory conclusions.
SODA: the stack overflow dataset almanac.	Nicolas Latorre, Roberto Minelli, Andrea Mocci, Luca Ponzanelli, Michele Lanza	mud2015	Stack Overflow has become a fundamental resource for developers, becoming the de facto Question and Answer (Q&A) website, and one of the standard unstructured data sources for software engineering research to mine knowledge about development. We present SODA, the Stack Overflow Dataset Almanac, a tool that helps researchers and developers to better understand the trends of discussion topics in Stack Overflow, based on the available tagging system. SODA provides an effective visualization to support the analysis of topics in different time intervals and frames, leveraging single or co-occurrent tags. We show, through simple usage scenarios, how SODA can be used to find interesting peculiar moments in the evolution of Stack Overflow discussions that closely match specific recent events in the area of software development. SODA is available at http://rio.inf.usi.ch/soda/.
EnTagRec: An Enhanced Tag Recommendation System for Software Information Sites.	Shaowei Wang, David Lo, Bogdan Vasilescu, Alexander Serebrenik	icsme2014	Software engineers share experiences with modern technologies by means of software information sites, such as Stack Overflow. These sites allow developers to label posted content, referred to as software objects, with short descriptions, known as tags. However, tags assigned to objects tend to be noisy and some objects are not well tagged. To improve the quality of tags in software information sites, we propose EnTagRec, an automatic tag recommender based on historical tag assignments to software objects and we evaluate its performance on four software information sites, Stack Overflow, Ask Ubuntu, Ask Different, and Free code. We observe that that EnTagRec achieves Recall@5 scores of 0.805, 0.815, 0.88 and 0.64, and Recall@10 scores of 0.868, 0.876, 0.944 and 0.753, on Stack Overflow, Ask Ubuntu, Ask Different, and Free code, respectively. In terms of Recall@5 and Recall@10, averaging across the 4 datasets, EnTagRec improves Tag Combine, which is the state of the art approach, by 27.3% and 12.9% respectively.
A Manual Categorization of Android App Development Issues on Stack Overflow.	Stefanie Beyer, Martin Pinzger	icsme2014	While many tutorials, code examples, and documentation about Android APIs exist, developers still face various problems with the implementation of Android Apps. Many of these issues are discussed on Q&A-sites, such as Stack Overflow. In this paper we present a manual categorization of 450 Android related posts of Stack Overflow concerning their question and problem types. The idea is to find dependencies between certain problems and question types to get better insights into issues of Android App development. The categorization is developed using card sorting with three experienced Android App developers. An initial approach to automate the classification of Stack Overflow posts using Lucene is also presented. The study highlights that the most common question types are 'How to?' and 'What is the problem?'. The problems that are discussed most often are related to 'User Interface' and 'Core Elements'. In particular, the problem category 'Layout' is often related to 'What is the problem?' and 'Frameworks' issues often come with 'Is it possible?' questions.
Improving Low Quality Stack Overflow Post Detection.	Luca Ponzanelli, Andrea Mocci, Alberto Bacchelli, Michele Lanza, David Fullerton	icsme2014	Stack Overflow is a popular questions and answers (Q&A) website among software developers. It counts more than two millions of users who actively contribute by asking and answering thousands of questions daily. Identifying and reviewing low quality posts preserves the quality of site's contents and it is crucial to maintain a good user experience. In Stack Overflow the identification of poor quality posts is performed by selected users manually. The system also uses an automated identification system based on textual features. Low quality posts automatically enter a review queue maintained by experienced users. We present an approach to improve the automated system in use at Stack Overflow. It analyzes both the content of a post (e.g., simple textual features and complex readability metrics) and community-related aspects (e.g., popularity of a user in the community). Our approach reduces the size of the review queue effectively and removes misclassified good quality posts.
Prompter: A Self-Confident Recommender System.	Luca Ponzanelli, Gabriele Bavota, Massimiliano Di Penta, Rocco Oliveto, Michele Lanza	icsme2014	Developers often consult different sources of information like Application Programming Interfaces (API) documentation, forums, Q&A websites, etc. With the aim of gathering additional knowledge for the programming task at hand. The process of searching and identifying valuable pieces of information requires developers to spend time and energy in formulating the right queries, assessing the returned results, and integrating the obtained knowledge into the code base. All of this is often done manually. We present Prompter, a plug-in for the Eclipse IDE which automatically searches and identifies relevant Stack Overflow discussions, evaluates their relevance given the code context in the IDE, and notifies the developer if and only if a user-defined confidence threshold is surpassed.
Towards a Weighted Voting System for Q&A Sites.	Daniele Romano, Martin Pinzger	icsm2013	Version: Accepted for publication in the Proceedings of the International Conference on Software Maintenance (ICSM), 2013, IEEE Computer Society. Doi: http://dx.doi.org/10.1109/ICSM.2013.49 Q&A sites have become popular to share and look for valuable knowledge. Users can easily and quickly access high quality answers to common questions. The main mechanism to label good answers is to count the votes per answer. This mechanism, however, does not consider whether other answers were present at the time when a vote is given. Consequently, good answers that were given later are likely to receive less votes than they would have received if given earlier. In this paper we present a Weighted Votes (WV) metric that gives different weights to the votes depending on how many answers were present when the vote is performed. The idea behind WV is to emphasize the answer that receives most of the votes when most of the answers were already posted. Mining the Stack Overflow data dump we show that the WV metric is able to highlight between 4.07% and 10.82% answers that differ from the most voted ones.
On the Personality Traits of StackOverflow Users.	Blerina Bazelli, Abram Hindle, Eleni Stroulia	icsm2013	In the last decade, developers have been increasingly sharing their questions with each other through Question and Answer (Q&A) websites. As a result, these websites have become valuable knowledge repositories, covering a wealth of topics related to particular programming languages. This knowledge is even more useful as the developer community evaluates both questions and answers through a voting mechanism. As votes accumulate, the developer community recognizes reputed members and further trusts their answers. In this paper, we analyze the community's questions and answers to determine the developers' personality traits, using the Linguistic Inquiry and Word Count (LIWC). We explore the personality traits of Stack Overflow authors by categorizing them into different categories based on their reputation. Through textual analysis of Stack Overflow posts, we found that the top reputed authors are more extroverted compared to medium and low reputed users. Moreover, authors of up-voted posts express significantly less negative emotions than authors of down-voted posts.
E-Xplore: Enterprise API Explorer.	Allahbaksh M. Asadullah, Basavaraju M., Nikita Jain	icsm2013	Plenty of open source libraries and frameworks are available for developers these days for reuse in their projects. However the difficulty in finding and reusing the correct API among the hundreds of available APIs far outweighs the advantage of saving time. The problem is acute in enterprise code base. Online forums like Stack Overflow are no help for enterprise source code as they are closed in nature. We have developed a tool called E-Xplore that addresses this issue by letting the programmers search in large source code base and browse them effectively. The tool also provides related artifacts in the form of result clustering. We evaluated E-Xplore with other tools via user study with developers working on an enterprise banking system with more than 10 million lines of code. A set of common tasks was given to the developers with and without the tool. We observed that the tool offered appreciable time and effort benefits in large scale software system development and maintenance. In this paper we describe the tool and its features which help develop and maintain source code effectively.
What makes a good code example?: A study of programming Q&A in StackOverflow.	Seyed Mehdi Nasehi, Jonathan Sillito, Frank Maurer, Chris Burns	icsm2012	Programmers learning how to use an API or a programming language often rely on code examples to support their learning activities. However, what makes for an effective ode example remains an open question. Finding the haracteristics of the effective examples is essential in improving the appropriateness of these learning aids. To help answer this question we have onducted a qualitative analysis of the questions and answers posted to a programming Q&A web site called StackOverflow. On StackOverflow answers can be voted on, indicating which answers were found helpful by users of the site. By analyzing these well-received answers we identified haracteristics of effective examples. We found that the explanations acompanying examples are as important as the examples themselves. Our findings have implications for the way the API documentation and example set should be developed and evolved as well as the design of the tools assisting the development of these materials.
