Deploying Deep Reinforcement Learning Systems: A Taxonomy of Challenges.	Ahmed Haj Yahmed, Altaf Allah Abbassi, Amin Nikanjam, Heng Li, Foutse Khomh	icsme2023	Deep reinforcement learning (DRL), leveraging Deep Learning (DL) in reinforcement learning, has shown significant potential in achieving human-level autonomy in a wide range of domains, including robotics, computer vision, and computer games. This potential justifies the enthusiasm and growing interest in DRL in both academia and industry. However, the community currently focuses mostly on the development phase of DRL systems, with little attention devoted to DRL deployment. In this paper, we propose an empirical study on Stack Overflow (SO), the most popular Q&A forum for developers, to uncover and understand the challenges practitioners faced when deploying DRL systems. Specifically, we categorized relevant SO posts by deployment platforms: server/cloud, mobile/embedded system, browser, and game engine. After filtering and manual analysis, we examined 357 SO posts about DRL deployment, investigated the current state, and identified the challenges related to deploying DRL systems. Then, we investigate the prevalence and difficulty of these challenges. Results show that the general interest in DRL deployment is growing, confirming the study’s relevance and importance. Results also show that DRL deployment is more difficult than other DRL issues. Additionally, we built a taxonomy of 31 unique challenges in deploying DRL to different platforms. On all platforms, RL environment-related challenges are the most popular, and communication-related challenges are the most difficult among practitioners. We hope our study inspires future research and helps the community overcome the most common and difficult challenges practitioners face when deploying DRL systems.
Knowledge Graph based Explainable Question Retrieval for Programming Tasks.	Mingwei Liu, Simin Yu, Xin Peng, Xueying Du, Tianyong Yang, Huanjun Xu, Gaoyang Zhang	icsme2023	Developers often seek solutions for their programming problems by retrieving existing questions on technical Q&A sites such as Stack Overflow. In many cases, they fail to find relevant questions due to the knowledge gap between the questions and the queries or feel it hard to choose the desired questions from the returned results due to the lack of explanations about the relevance. In this paper, we propose KGXQR, a knowledge graph based explainable question retrieval approach for programming tasks. It uses BERT-based sentence similarity to retrieve candidate Stack Overflow questions that are relevant to a given query. To bridge the knowledge gap and enhance the performance of question retrieval, it constructs a software development related concept knowledge graph and trains a question relevance prediction model to re-rank the candidate questions. The model is trained based on a combined sentence representation of BERT-based sentence embedding and graph-based concept embedding. To help understand the relevance of the returned Stack Overflow questions, KGXQR further generates explanations based on the association paths between the concepts involved in the query and the Stack Overflow questions. The evaluation shows that KGXQR outperforms the baselines in terms of accuracy, recall, MRR, and MAP and the generated explanations help the users to find the desired questions faster and more accurately.
Aligning Documentation and Q&A Forum through Constrained Decoding with Weak Supervision.	Rohith Pudari, Shiyuan Zhou, Iftekhar Ahmed, Zhuyun Dai, Shurui Zhou	icsme2023	Stack Overflow (SO) is a widely used question-and-answer (Q&A) forum dedicated to software development. It plays a supplementary role to official documentation (DOC for short) by offering practical examples and resolving uncertainties. However, the process of simultaneously consulting both the documentation and SO posts can be challenging and time-consuming due to their disconnected nature. In this study, we propose DOSA, a novel approach to automatically align SO and DOC, which inject domain-specific knowledge about the DOC structure into large language models (LLMs) through weak supervision and constrained decoding, thereby enhancing knowledge retrieval and streamlining task completion during the software development procedure. Our preliminary experiments find that DOSA outperforms various widely-used baselines, showing the promise of using generative retrieval models to perform low-resource software engineering tasks.
Developers Struggle with Authentication in Blazor WebAssembly.	Pascal Marc André, Quentin Stiévenart, Mohammad Ghafari	icsme2022	WebAssembly is a growing technology to build cross-platform applications. We aim to understand the security issues that developers encounter when adopting WebAssembly. We mined WebAssembly questions on Stack Overflow and identified 359 security-related posts. We classified these posts into 8 themes, reflecting developer intentions, and 19 topics, representing developer issues in this domain. We found that the most prevalent themes are related to bug fix support, requests for how to implement particular features, clarification questions, and setup or configuration issues. We noted that the topmost issues attribute to authentication in Blazor WebAssembly. We discuss six of them and provide our suggestions to clear these issues in practice.
LiFUSO: A Tool for Library Feature Unveiling based on Stack Overflow Posts.	Camilo Velázquez-Rodríguez, Eleni Constantinou, Coen De Roover	icsme2022	Selecting a library from a vast ecosystem can be a daunting task. The libraries are not only numerous, but they also lack an enumeration of the features they offer. A feature enumeration for each library in an ecosystem would help developers select the most appropriate library for the task at hand. Within this enumeration, a library feature could take the form of a brief description together with the API references through which the feature can be reused. This paper presents LiFUSO, a tool that leverages Stack Overflow posts to compute a list of such features for a given library. Each feature corresponds to a cluster of related API references based on the similarity of the Stack Overflow posts in which they occur. Once LiFUSO has extracted such a cluster of posts, it applies natural language processing to describe the corresponding feature. We describe the engineering aspects of the tool, and illustrate its usage through a preliminary case study in which we compare the features uncovered for two competing libraries within the same domain. An executable version of the tool is available at https://github.com/softwarelanguageslab/lifuso and its demonstration video is accessible at https://youtu.be/tDE1LWa86cA.
Understanding Quantum Software Engineering Challenges An Empirical Study on Stack Exchange Forums and GitHub Issues.	Mohamed Raed El aoun, Heng Li, Foutse Khomh, Moses Openja	icsme2021	With the advance of quantum computing, quantum software becomes critical for exploring the full potential of quantum computing systems. Recently, quantum software engineering (QSE) becomes an emerging area attracting more and more attention. However, it is not clear what are the challenges and opportunities of quantum computing facing the software engineering community. This work aims to understand the QSE-related challenges perceived by developers. We perform an empirical study on Stack Exchange forums where developers post-QSE-related questions & answers and Github issue reports where developers raise QSE-related issues in practical quantum computing projects. Based on an existing taxonomy of question types on Stack Overflow, we first perform a qualitative analysis of the types of QSE-related questions asked on Stack Exchange forums. We then use automated topic modeling to uncover the topics in QSE-related Stack Exchange posts and GitHub issue reports. Our study highlights some particularly challenging areas of QSE that are different from that of traditional software engineering, such as explaining the theory behind quantum computing code, interpreting quantum program outputs, and bridging the knowledge gap between quantum computing and classical computing, as well as their associated opportunities.
Assessing Generalizability of CodeBERT.	Xin Zhou, DongGyun Han, David Lo	icsme2021	Pre-trained models like BERT have achieved strong improvements on many natural language processing (NLP) tasks, showing their great generalizability. The success of pre-trained models in NLP inspires pre-trained models for programming language. Recently, CodeBERT, a model for both natural language (NL) and programming language (PL), pre-trained on code search dataset, is proposed. Although promising, CodeBERT has not been evaluated beyond its pre-trained dataset for NL-PL tasks. Also, it has only been shown effective on two tasks that are close in nature to its pre-trained data. This raises two questions: Can CodeBERT generalize beyond its pre-trained data? Can it generalize to various software engineering tasks involving NL and PL? Our work answers these questions by performing an empirical investigation into the generalizability of CodeBERT. First, we assess the generalizability of CodeBERT to datasets other than its pre-training data. Specifically, considering the code search task, we conduct experiments on another dataset containing Python code snippets and their corresponding documentation. We also consider yet another dataset of questions and answers collected from Stack Overflow about Python programming. Second, to assess the generalizability of CodeBERT to various software engineering tasks, we apply CodeBERT to the just-in-time defect prediction task. Our empirical results support the generalizability of CodeBERT on the additional data and task. CodeBERT-based solutions can achieve higher or comparable performance than specialized solutions designed for the code search and just-in-time defect prediction tasks. However, the superior performance of the CodeBERT requires a tradeoff; for example, it requires much more computation resources as compared to specialized code search approaches.
Task-Oriented API Usage Examples Prompting Powered By Programming Task Knowledge Graph.	Jiamou Sun, Zhenchang Xing, Xin Peng, Xiwei Xu, Liming Zhu	icsme2021	Programming tutorials demonstrate programming tasks with code examples. However, our study of Stack Overflow questions reveals the low utilization of high-quality programming tutorials, which is caused task description mismatch and code information overload. Neither document search nor recently proposed activity-centric search can address these two barriers. In this work, we enrich the programming task knowledge graph with actions extracted from comments in code examples and more forms of activity sentences. To overcome the task description mismatch problem, we use code matching based task search method to find relevant programming tasks and code examples to the code under development. We integrate our knowledge graph and task search method in the IDE, and develop an observe-push based tool to prompt developers with API usage examples in explicit task contexts. To alleviate the code information overload problem, our tool highlights programming task and API information in the prompted tutorial excerpts and code examples based on the underlying knowledge graph. Our evaluation confirms the high quality of the constructed knowledge graph, and show that our code matching based task search can recommend effective code solutions to programming issues asked on Stack Overflow. Through an user study, we demonstrate that our tool is useful for assisting developers in finding and using relevant programming tutorials in their programming tasks.
Is reputation on Stack Overflow always a good indicator for users' expertise? No!	Shaowei Wang, Daniel M. Germán, Tse-Hsun Chen, Yuan Tian, Ahmed E. Hassan	icsme2021	Stack Overflow (SO) users are recognized by reputation points. The reputation points are often a great avenue for users to build their career profile and demonstrate their expertise in some domains. Prior studies used users' reputation as a proxy to estimate their experience and expertise. However, there are various ways for a user to earn reputation points that do not require much expertise, such as asking high-quality questions. Therefore, it is important to understand the meaning of a high-reputation point and if the reputation could be used as a good indicator for users' expertise and experience on Stack Overflow. In this study, we explore how users earn reputation points on Stack Overflow by mining their reputation-related activities (e.g., asking questions, answering questions, and editing posts). We study the reputation-related activities of 93,053 high-reputation users that have at least 1,000 reputation points. We find that 1) 13.8% of the studied users earn their majority reputation points through asking questions rather than answering questions. 2) In general, most of the posted answers received no or very few reputation points with users gaining their points from a very small proportion of highly-voted answers. 12% of users' entire reputation comes from one single answer. We suggest future research and Stack Overflow introduce a new metric (i.e., vindex) to evaluate the expertise of a user.
Hurdles for Developers in Cryptography.	Mohammadreza Hazhirpasand, Oscar Nierstrasz, Mohammadhossein Shabani, Mohammad Ghafari	icsme2021	Prior research has shown that cryptography is hard to use for developers. We aim to understand what cryptography issues developers face in practice. We clustered 91 954 cryptography-related questions on the Stack Overflow website, and manually analyzed a significant sample (i.e., 383) of the questions to comprehend the crypto challenges developers commonly face in this domain. We found that either developers have a distinct lack of knowledge in understanding the fundamental concepts, e.g., OpenSSL, public-key cryptography or password hashing, or the usability of crypto libraries undermined developer performance to correctly realize a crypto scenario. This is alarming and indicates the need for dedicated research to improve the design of crypto APIs.
Contrasting Third-Party Package Management User Experience.	Syful Islam, Raula Gaikovina Kula, Christoph Treude, Bodin Chinthanet, Takashi Ishio, Kenichi Matsumoto	icsme2021	The management of third-party package dependencies is crucial to most technology stacks, with package managers acting as brokers to ensure that a verified package is correctly installed, configured, or removed from an application. Diversity in technology stacks has led to dozens of package ecosystems with their own management features. While recent studies have shown that developers struggle to migrate their dependencies, the common assumption is that package ecosystems are used without any issue. In this study, we explore 13 package ecosystems to understand whether their features correlate with the experience of their users. By studying experience through the questions that developers ask on the question-and-answer site Stack Overflow, we find that developer questions are grouped into three themes (i.e., Package management, Input-Output, and Package Usage). Our preliminary analysis indicates that specific features are correlated with the user experience. Our work lays out future directions to investigate the trade-offs involved in designing the ideal package ecosystem.
Disambiguating Mentions of API Methods in Stack Overflow via Type Scoping.	Kien Luong, Ferdian Thung, David Lo	icsme2021	Stack Overflow is one of the most popular venues for developers to find answers to their API-related questions. However, API mentions in informal text content of Stack Overflow are often ambiguous and thus it could be difficult to find the APIs and learn their usages. Disambiguating these API mentions is not trivial, as an API mention can match with names of APIs from different libraries or even the same one. In this paper, we propose an approach called DATYS to disambiguate API mentions in informal text content of Stack Overflow using type scoping. With type scoping, we consider API methods whose type (i.e. class or interface) appear in more parts (i.e., scopes) of a Stack Overflow thread as more likely to be the API method that the mention refers to. We have evaluated our approach on a dataset of 807 API mentions from 380 threads containing discussions of API methods from four popular third-party Java libraries. Our experiment shows that our approach beats the state-of-the-art by 42.86% in terms of F1-score.
Haste Makes Waste: An Empirical Study of Fast Answers in Stack Overflow.	Yao Lu, Xinjun Mao, Minghui Zhou, Yang Zhang, Tao Wang, Zude Li	icsme2020	Modern programming question & answer (Q&A) sites such as Stack Overflow (SO) employ gamified mechanisms to stimulate volunteers' contributions. To maximize the chances of winning gamification rewards such as reputation and badges, a portion of users race to post answers as quickly as possible (i.e., fast answers or FAs), which makes SO the fastest Q&A site; however, this behavior may affect the contribution quality as well. In this paper, we report on a large-scale, mixed-methods empirical study of the gamification-influenced FA phenomenon in SO. We first quantitatively investigate the popularity of the phenomenon and user behaviors regarding FAs. Then, we study the quality of FAs by using regression modeling and qualitatively analyzing 300 instances of FAs. Our main findings reveal that more than 70% and 90% of FAs are not edited by the answerers and other users, respectively, and that later incoming answers have lower chances of being voted on and accepted. Notably, we find that the answer length, code snippets length, and readability of FAs are significantly lower than those of non-fast answers. Although FAs have higher crowd assessment scores, they have no relationship with acceptance from the perspective of asker assessment, and a considerable portion of FAs solve the problem by interacting with the asker in the comments. These results help us better understand the effects of reward-based gamification on crowdsourced software engineering communitites and provide implications for designers of gamified systems.
Sentiment Analysis for Software Engineering: How Far Can Pre-trained Transformer Models Go?	Ting Zhang, Bowen Xu, Ferdian Thung, Stefanus Agus Haryono, David Lo, Lingxiao Jiang	icsme2020	Extensive research has been conducted on sentiment analysis for software engineering (SA4SE). Researchers have invested much effort in developing customized tools (e.g., SentiStrength-SE, SentiCR) to classify the sentiment polarity for Software Engineering (SE) specific contents (e.g., discussions in Stack Overflow and code review comments). Even so, there is still much room for improvement. Recently, pre-trained Transformer-based models (e.g., BERT, XLNet) have brought considerable breakthroughs in the field of natural language processing (NLP). In this work, we conducted a systematic evaluation of five existing SA4SE tools and variants of four state-of-the-art pre-trained Transformer-based models on six SE datasets. Our work is the first to fine-tune pre-trained Transformer-based models for the SA4SE task. Empirically, across all six datasets, our fine-tuned pre-trained Transformer-based models outperform the existing SA4SE tools by 6.5-35.6% in terms of macro/micro-averaged F1 scores.
Analysis of Modern Release Engineering Topics : - A Large-Scale Study using StackOverflow -.	Moses Openja, Bram Adams, Foutse Khomh	icsme2020	"Release engineers are continuously required to de-liver high-quality software products to the end-user. As a result, modern software companies are proposing new changes in their delivery process that adapt to new technologies such as continuous deployment and Infrastructure-as-Code. However, developers and release engineers still find these practices challenging, and resort to question and answer websites such as StackOverflow to find answers. This paper presents the results of our empirical study on release engineering questions in StackOverflow, to understand the modern release engineering topics of interest and their difficulty. Using topic modeling techniques, we find that (i) developers discuss on a broader range of 38 release engineering topics covering all the six phases of modern release engineering, (ii) the topics Merge Conflict, Branching & Remote Upstream are more popular, while topics Code review, Web deployment, MobileApp Debugging & Deployment, Continuous Deployment are less popular yet more complicated, (iii)-Particularly, the release engineering topic ""security"" is both popular and difficult according to data collected from StackOverflow."
Achieving Reliable Sentiment Analysis in the Software Engineering Domain using BERT.	Eeshita Biswas, Mehmet Efruz Karabulut, Lori L. Pollock, K. Vijay-Shanker	icsme2020	Researchers have shown that sentiment analysis of software artifacts can potentially improve various software engineering tools, including API and library recommendation systems, code suggestion tools, and tools for improving communication among software developers. However, sentiment analysis techniques applied to software artifacts still have not yet yielded very high accuracy. Recent adaptations of sentiment analysis tools to the software domain have reported some improvements, but the f-measures for the positive and negative sentences still remain in the 0.4-0.64 range, which deters their practical usefulness for software engineering tools.In this paper, we explore the potential effectiveness of customizing BERT, a language representation model, which has recently achieved very good results on various Natural Language Processing tasks on English texts, for the task of sentiment analysis of software artifacts. We describe our application of BERT to analyzing sentiments of sentences in Stack Overflow posts and compare the impact of a BERT sentiment classifier to state-of-the-art sentiment analysis techniques when used on a domain-specific data set created from Stack Overflow posts. We also investigate how the performance of sentiment analysis changes when using a much (3 times) larger data set than previous studies. Our results show that the BERT classifier achieves reliable performance for sentiment analysis of software engineering texts. BERT combined with the larger data set achieves an overall f-measure of 0.87, with the f-measures for the negative and positive sentences reaching 0.91 and 0.78 respectively, a significant improvement over the state-of-the-art.
Studying Software Developer Expertise and Contributions in Stack Overflow and GitHub.	Sri Lakshmi Vadlamani, Olga Baysal	icsme2020	"Knowledge and experience are touted as both the necessary and sufficient conditions to make a person an expert. This paper attempts to investigate this issue in the context of software development by studying software developer’s expertise based on their activity and experience on GitHub and Stack Overflow platforms. We study how developers themselves define the notion of an ""expert"", as well as why or why not developers contribute to online collaborative platforms. We conducted an exploratory survey with 73 software developers and applied a mixed methods approach to analyze the survey results. The results provided deeper insights into how an expert in the field could be defined. Further, the study provides a better understanding of the underlying factors that drive developers to contribute to GitHub and Stack Overflow, and the challenges they face when participating on either platform.The quantitative analysis showed that JavaScript remains a popular language, while knowledge and experience are the key factors driving expertise. On the other hand, qualitative analysis showed that soft skills such as effective and clear communication, analytical thinking are key factors defining an expert. We found that both knowledge and experience are only necessary but not sufficient conditions for a developer to become an expert, and an expert would necessarily have to possess adequate soft skills. Lastly, an expert’s contribution to GitHub seems to be driven by personal factors, while contribution to Stack Overflow is motivated more by professional drivers (i.e., skills and expertise). Moreover, developers seem to prefer contributing to GitHub as they face greater challenges while contributing to Stack Overflow."
