Characterizing Task-Relevant Information in Natural Language Software Artifacts.	Arthur Marques, Nick C. Bradley, Gail C. Murphy	icsme2020	To complete a software development task, a software developer often consults artifacts which mostly consist of natural language text, such as API documentation, bug reports, and Q&A forums. Not all information within these artifacts is relevant to a developer’s current task, forcing them to filter through large amounts of irrelevant information, a frustrating and time-consuming activity. Since failing to locate relevant information may lead developers to incorrect or incomplete solutions, many approaches attempt to automatically extract relevant information from natural language artifacts. However, existing approaches are able to identify relevant text only for certain types of tasks and artifacts. To explore how these limitations could be relaxed, we conducted a controlled experiment in which we asked 20 software developers to examine 20 natural language artifacts consisting of 1,874 sentences and highlight the text they considered relevant to six software development tasks. Although the 2,463 distinct highlights participants created indicate variability in the perceived relevance of the text, the information considered key to completing the tasks was consistent. We observe consistency in the text using frame semantics, an approach that captures the key meaning of sentences, suggesting that frame semantics can be used in the future to automatically identify task-relevant information in natural language artifacts.
Automatic Identification of Rollback Edit with Reasons in Stack Overflow Q&A Site.	Saikat Mondal, Gias Uddin, Chanchal K. Roy	icsme2020	Crowd-sourced developer forums, such as Stack Overflow (SO), rely on edits from users to improve the quality of the shared knowledge. Unfortunately, suggested edits in SO are frequently rejected by rollbacks due to undesired edits or violation of editing guidelines. Such rollbacks could frustrate and demotivate users to provide future suggestions. We thus need to warn a user of a potential rollback so that he can improve the suggested edit and thus increase its likelihood of acceptance. This study proposes to help users with an automated machine learning classification model that can warn them of potential rollbacks to their suggested edits. We present the conceptual design of EditEx, an online tool that can guide SO users during their editing by highlighting the potential causes of rollback. We offer details of an empirical study to assess the accuracy of the classifiers and a user study to evaluate the effectiveness of EditEx.
Can Everyone use my app? An Empirical Study on Accessibility in Android Apps.	Christopher Vendome, Diana Solano, Santiago Liñán, Mario Linares-Vásquez	icsme2019	Universal design principles aim to improve accessibility by ensuring product designs consider all users, including those with certain disabilities (e.g., visual impairments). In the case of mobile apps, accessibility is mostly provided by existing features in mobile devices, like TalkBack on Android that reads information to users. However, it is not clear to what extent developers actually implement universal design principles or utilize these technologies to support accessibility of their applications. By performing a mining-based pilot study, we observed developers seldom use Accessibility APIs and there is a limited usage of assistive descriptions. Then, we focused on understanding the perspective of developers through an investigation of posts from StackOverflow. We identified the aspects of accessibility that developers implemented as well as experienced difficulty (or lack of understanding). We performed a formal open-coding of 366 discussions threads with multi-author agreement to create a taxonomy regarding the aspects discussed by developers with respect to accessibility in Android. From the qualitative analysis, we distilled lessons to guide further research and actions in aiding developers with supporting users that require assistive features.
Know-How in Programming Tasks: From Textual Tutorials to Task-Oriented Knowledge Graph.	Jiamou Sun, Zhenchang Xing, Rui Chu, Heilai Bai, Jinshui Wang, Xin Peng	icsme2019	Accomplishing a program task usually involves performing multiple activities in a logical order. Task-solving activities may have different relationships, such as subactivityof, precede-follow, and different attributes, such as location, condition, API, code. We refer to task-solving activities and their relationships and attributes as know-how knowledge. Programming task know-how knowledge is commonly documented in semi-structured textual tutorials. A formative study of the 20 top-viewed Android-tagged how-to questions on Stack Overflow suggests that developers are faced with three information barriers (incoherent modeling of task intent, tutorial information overload and unstructured task activity description) for effectively discovering and understanding task-solving knowledge in textual tutorials. Knowledge graph has been shown to be effective in representing relational knowledge and supporting knowledge search in a structured way. Unfortunately, existing knowledge graphs extract only know-what information (e.g., APIs, API caveats and API dependencies) from software documentation. In this paper, we devise open information extraction (OpenIE) techniques to extract candidates for task activities, activity attributes and activity relationships from programming task tutorials. The resulting knowledge graph, TaskKG, includes a hierarchical taxonomy of activities, three types of activities relationships and five types of activity attributes, and enables activity-centric knowledge search. As a proof-of-concept, we apply our approach to Android Developer Guide. A comprehensive evaluation of TaskKG shows high accuracy of our OpenIE techniques. A user study shows that TaskKG is promising in helping developers finding correct answers to programming how-to questions.
Estimating Software Task Effort in Crowds.	Mohammed Alhamed, Tim Storer	icsme2019	A key task during software maintenance is the refinement and elaboration of emerging software issues, such as feature implementations and bug resolution. It includes the annotation of software tasks with additional information, such as criticality, assignee and estimated cost of resolution. This paper reports on a first study to investigate the feasibility of using crowd workers supplied with limited information about an issue and project to provide comparably accurate estimates using planning poker. The paper describes our adaptation of planning poker to crowdsourcing and our initial trials. The results demonstrate the feasibility and potential efficiency of using crowds to deliver estimates. We also review the additional benefit that asking crowds for an estimate brings, in terms of further elaboration of the details of an issue. Finally, we outline our plans for a more extensive evaluation of planning poker in crowds.
Syntax and Stack Overflow: A Methodology for Extracting a Corpus of Syntax Errors and Fixes.	Alexander William Wong, Amir Salimi, Shaiful Alam Chowdhury, Abram Hindle	icsme2019	One problem when studying how to find and fix syntax errors is how to get natural and representative examples of syntax errors. Most syntax error datasets are not free, open, and public, or they are extracted from novice programmers and do not represent syntax errors that the general population of developers would make. Programmers of all skill levels post questions and answers to Stack Overflow which may contain snippets of source code along with corresponding text and tags. Many snippets do not parse, thus they are ripe for forming a corpus of syntax errors and corrections. Our primary contribution is an approach for extracting natural syntax errors and their corresponding human made fixes to help syntax error research. A Python abstract syntax tree parser is used to determine preliminary errors and corrections on code blocks extracted from the SOTorrent data set. We further analyzed our code by executing the corrections in a Python interpreter. We applied our methodology to produce a public data set of 62,965 Python Stack Overflow code snippets with corresponding tags, errors, and stack traces. We found that errors made by Stack Overflow users do not match errors made by student developers or random mutations, implying there is a serious representativeness risk within the field. Finally we share our dataset openly so that future researchers can re-use and extend our syntax errors and fixes.
What Do Developers Discuss about Biometric APIs?	Zhe Jin, Kong-Yik Chee, Xin Xia	icsme2019	With the emergence of biometric technology in various applications, such as access control (e.g. mobile lock/unlock), financial transaction (e.g. Alibaba smile-to-pay) and time attendance, the development of biometric system attracts increasingly interest to the developers. Despite a sound biometric system gains the security assurance and great usability, it is a rather challenging task to develop an effective biometric system. For instance, many public available biometric APIs do not provide sufficient instructions / precise documentations on the usage of biometric APIs. Many developers are struggling in implementing these APIs in various tasks. Moreover, quick update on biometric-based algorithms (e.g. feature extraction and matching) may propagate to APIs, which leads to potential confusion to the system developers. Hence, we conduct an empirical study to the problems that the developers currently encountered while implementing the biometric APIs as well as the issues that need to be addressed when developing biometric systems using these APIs. We manually analyzed a total of 500 biometric API-related posts from various online media such as Stack Overflow and Neurotechnology. We reveal that 1) most of the problems encountered are related to the lack of precise documentation on the biometric APIs; 2) the incompatibility of biometric APIs cross multiple implementation environments.
Synthesizing Program Execution Time Discrepancies in Julia Used for Scientific Software.	Effat Farhana, Nasif Imtiaz, Akond Rahman	icsme2019	Scientific software is defined as software that is used to analyze data to investigate unanswered research questions in the scientific community. Developers use programming languages such as Julia to build scientific software. When programming with Julia, developers experience program execution time discrepancy i.e. not obtaining desired program execution time, which hinders them to efficiently complete their tasks. The goal of this paper is to help developers in achieving desired program execution time for Julia by identifying the causes of why program execution time discrepancies happen with an empirical study of Stack Overflow posts. We conduct an empirical study with 263 Julia-related posts collected from Stack Overflow, and apply qualitative analysis on the collected 263 posts. We identify 9 categories of program execution time discrepancies for Julia, which include discrepancies related to data structures usage such as, arrays and dictionaries. We also identify 10 causes that explain why the program execution time discrepancies happen. For example, we identify program execution time discrepancy to happen when developers unnecessarily allocate memory by using array comprehension.
A Large-Scale Empirical Study on Linguistic Antipatterns Affecting APIs.	Emad Aghajani, Csaba Nagy, Gabriele Bavota, Michele Lanza	icsme2018	The concept of monolithic stand-alone software systems developed completely from scratch has become obsolete, as modern systems nowadays leverage the abundant presence of Application Programming Interfaces (APIs) developed by third parties, which leads on the one hand to accelerated development, but on the other hand introduces potentially fragile dependencies on external resources. In this context, the design of any API strongly influences how developers write code utilizing it. A wrong design decision like a poorly chosen method name can lead to a steeper learning curve, due to misunderstandings, misuse and eventually bug-prone code in the client projects using the API. It is not unfrequent to find APIs with poorly expressive or misleading names, possibly lacking appropriate documentation. Such issues can manifest in what have been defined in the literature as Linguistic Antipatterns (LAs), i.e., inconsistencies among the naming, documentation, and implementation of a code entity. While previous studies showed the relevance of LAs for software developers, their impact on (developers of) client projects using APIs affected by LAs has not been investigated. This paper fills this gap by presenting a large-scale study conducted on 1.6k releases of popular Maven libraries, 14k open-source Java projects using these libraries, and 4.4k questions related to the investigated APIs asked on Stack Overflow. In particular, we investigate whether developers of client projects have higher chances of introducing bugs when using APIs affected by LAs and if these trigger more questions on Stack Overflow as compared to non-affected APIs.
Improving API Caveats Accessibility by Mining API Caveats Knowledge Graph.	Hongwei Li, Sirui Li, Jiamou Sun, Zhenchang Xing, Xin Peng, Mingwei Liu, Xuejiao Zhao	icsme2018	API documentation provides important knowledge about the functionality and usage of APIs. In this paper, we focus on API caveats that developers should be aware of in order to avoid unintended use of an API. Our formative study of Stack Overflow questions suggests that API caveats are often scattered in multiple API documents, and are buried in lengthy textual descriptions. These characteristics make the API caveats less discoverable. When developers fail to notice API caveats, it is very likely to cause some unexpected programming errors. In this paper, we propose natural language processing(NLP) techniques to extract ten subcategories of API caveat sentences from API documentation and link these sentences to API entities in an API caveats knowledge graph. The API caveats knowledge graph can support information retrieval based or entity-centric search of API caveats. As a proof-of-concept, we construct an API caveats knowledge graph for Android APIs from the API documentation on the Android Developers website. We study the abundance of different subcategories of API caveats and use a sampling method to manually evaluate the quality of the API caveats knowledge graph. We also conduct a user study to validate whether and how the API caveats knowledge graph may improve the accessibility of API caveats in API documentation.
Statistical Translation of English Texts to API Code Templates.	Anh Tuan Nguyen, Peter C. Rigby, Thanh Nguyen, Dharani Palani, Mark Karanfil, Tien N. Nguyen	icsme2018	We develop T2API, a context-sensitive, graph-based statistical translation approach that takes as input an English description of a programming task and synthesizes the corresponding API code template for the task. We train T2API to statistically learn the alignments between English and API elements and determine the relevant API elements. The training is done on StackOverflow, a bilingual corpus on which developers discuss programming problems in two types of language: English and programming language. T2API considers both the context of the words in the input query and the context of API elements that often go together in the corpus. The derived API elements with their relevance scores are assembled into an API usage by GraSyn, a novel graph-based API synthesis algorithm that generates a graph representing an API usage from a large code corpus. Importantly, it is capable of generating new API usages from previously seen sub-usages. We curate a test benchmark of 250 real-world StackOverflow posts. Across the benchmark, T2API's synthesized snippets have the correct API elements with a median top-1 precision and recall of 67% and 100%, respectively. Four professional developers and five graduate students judged that 77% of our top synthesized API code templates are useful to solve the problem presented in the StackOverflow posts.
Effective Reformulation of Query for Code Search Using Crowdsourced Knowledge and Extra-Large Data Analytics.	Mohammad Masudur Rahman, Chanchal K. Roy	icsme2018	Software developers frequently issue generic natural language queries for code search while using code search engines (e.g., GitHub native search, Krugle). Such queries often do not lead to any relevant results due to vocabulary mismatch problems. In this paper, we propose a novel technique that automatically identifies relevant and specific API classes from Stack Overflow Q & A site for a programming task written as a natural language query, and then reformulates the query for improved code search. We first collect candidate API classes from Stack Overflow using pseudo-relevance feedback and two term weighting algorithms, and then rank the candidates using Borda count and semantic proximity between query keywords and the API classes. The semantic proximity has been determined by an analysis of 1.3 million questions and answers of Stack Overflow. Experiments using 310 code search queries report that our technique suggests relevant API classes with 48% precision and 58% recall which are 32% and 48% higher respectively than those of the state-of-the-art. Comparisons with two state-of-the-art studies and three popular search engines (e.g., Google, Stack Overflow, and GitHub native search) report that our reformulated queries (1) outperform the queries of the state-of-the-art, and (2) significantly improve the code search results provided by these contemporary search engines.
Two Datasets for Sentiment Analysis in Software Engineering.	Bin Lin, Fiorella Zampetti, Rocco Oliveto, Massimiliano Di Penta, Michele Lanza, Gabriele Bavota	icsme2018	Software engineering researchers have used sentiment analysis for various purposes, such as analyzing app reviews and detecting developers' emotions. However, most existing sentiment analysis tools do not achieve satisfactory performance when used in software-related contexts, and there are not many ready-to-use datasets in this domain. To facilitate the emergence of better tools and sufficient validation of sentiment analysis techniques, we present two datasets with labeled sentiments, which are extracted from mobile app reviews and Stack Overflow discussions, respectively. The web app we created to support the labeling of the Stack Overflow dataset is also provided.
NLP2API: Query Reformulation for Code Search Using Crowdsourced Knowledge and Extra-Large Data Analytics.	Mohammad Masudur Rahman, Chanchal K. Roy	icsme2018	Software developers frequently issue generic natural language (NL) queries for code search. Unfortunately, such queries often do not lead to any relevant results with contemporary code (or web) search engines due to vocabulary mismatch problems. In our technical research paper (accepted at ICSME 2018), we propose a technique–NLP2API–that reformulates such NL queries using crowdsourced knowledge and extra-large data analytics derived from Stack Overflow Q & A site. In this paper, we discuss all the artifacts produced by our work, and provide necessary details for downloading and verifying them.
Context-Aware Software Documentation.	Emad Aghajani	icsme2018	"Software developers often do not possess the knowledge needed to understand a piece of code at hand, and the lack of code comments and outdated documentation exacerbates the problem. Asking for the help of colleagues, browsing the official documentation, or accessing online resources, such as Stack Overflow, can clearly help in this ""code comprehension"" activity that, however, still remains highly time-consuming and is not always successful. Enhancing this process has been addressed in different studies under the subject of automatic documentation of software artifacts. For example, ""recommender systems"" have been designed with the goal of retrieving and suggesting relevant pieces of information (e.g., Stack Overflow discussions) for a given piece of code inspected in an IDE. However, these techniques rely on limited contextual information, mainly solely source code. Our goal is to build a context-aware proactive recommender system supporting the code comprehension process. The system must be able to understand the context, consider the developer's profile, and help her by generating pieces of documentation at whatever granularity is required, e.g., going from summarizing the responsibilities implemented in a subsystem, to explaining how two classes collaborate to implement a functionality, down to documenting a single line of code. Generated documentation will be tailored for the current context (e.g., the task at hand, the developer's background knowledge, the history of interactions). In this paper we present our first steps toward our goal by introducing the ADANA project, a framework which generates fine-grained code comments for a given piece of code."
Understanding Stack Overflow Code Fragments.	Christoph Treude, Martin P. Robillard	icsme2017	Code fragments posted in answers on Q&A forums can form an important source of developer knowledge. However, effective reuse of code fragments found online often requires information other than the code fragment alone. We report on the results of a survey-based study to investigate to what extent developers perceive Stack Overflow code fragments to be self-explanatory. As part of the study, we also investigated the types of information missing from fragments that were not self-explanatory. We find that less than half of the Stack Overflow code fragments in our sample are considered to be self-explanatory by the 321 participants who answered our survey, and that the main issues that negatively affect code fragment understandability include incomplete fragments, code quality, missing rationale, code organization, clutter, naming issues, and missing domain information. This study is a step towards understanding developers' information needs as they relate to code fragments, and how these needs can be addressed.
TechLand: Assisting Technology Landscape Inquiries with Insights from Stack Overflow.	Chunyang Chen, Zhenchang Xing, Lei Han	icsme2016	Understanding the technology landscape is crucial for the success of the software-engineering project or organization. However, it can be difficult, even for experienced developers, due to the proliferation of similar technologies, the complex and often implicit dependencies among technologies, and the rapid development in which technology landscape evolves. Developers currently rely on online documents such as tutorials and blogs to find out best available technologies, technology correlations, and technology trends. Although helpful, online documents often lack objective, consistent summary of the technology landscape. In this paper, we present the TechLand system for assisting technology landscape inquiries with categorical, relational and trending knowledge of technologies that is aggregated from millions of Stack Overflow questions mentioning the relevant technologies. We implement the TechLand system and evaluate the usefulness of the system against the community answers to 100 technology questions on Stack Overflow and by field deployment and a lab study. Our evaluation shows that the TechLand system can assist developers in technology landscape inquiries by providing direct, objective, and aggregated information about available technologies, technology correlations and technology trends. Developers currently rely on online documents such as tutorials and blogs to find out best available technologies, technology correlations, and technology trends. Although helpful, online documents often lack objective, consistent summary of the technology landscape. In this paper, we present the TechLand system for assisting technology landscape inquiries with categorical, relational and trending knowledge of technologies that is aggregated from millions of Stack Overflow questions mentioning the relevant technologies. We implement the TechLand system and evaluate the usefulness of the system against the community answers to 100 technology questions on Stack Overflow and by field deployment and a lab study. Our evaluation shows that the TechLand system can assist developers in technology landscape inquiries by providing direct, objective, and aggregated information about available technologies, technology correlations and technology trends.
