Improved Cross-Lingual Question Retrieval for Community Question Answering.	Andreas Rücklé, Krishnkant Swarnkar, Iryna Gurevych	www2019	We perform cross-lingual question retrieval in community question answering (cQA), i.e., we retrieve similar questions for queries that are given in another language. The standard approach to cross-lingual information retrieval, which is to automatically translate the query to the target language and continue with a monolingual retrieval model, typically falls short in cQA due to translation errors. This is even more the case for specialized domains such as in technical cQA, which we explore in this work. To remedy, we propose two extensions to this approach that improve cross-lingual question retrieval: (1) we enhance an NMT model with monolingual cQA data to improve the translation quality, and (2) we improve the robustness of a state-of-the-art neural question retrieval model to common translation errors by adding back-translations during training. Our results show that we achieve substantial improvements over the baseline approach and considerably close the gap to a setup where we have access to an external commercial machine translation service (i.e., Google Translate), which is often not the case in many practical scenarios. Our source code and data is publicly available.1
Focusing Attention Network for Answer Ranking.	Yufei Xie, Shuchun Liu, Tangren Yao, Yao Peng, Zhao Lu	www2019	Answer ranking is an important task in Community Question Answering (CQA), by which “Good” answers should be ranked in the front of “Bad” or “Potentially Useful” answers. The state of the art is the attention-based classification framework that learns the mapping between the questions and the answers. However, we observe that existing attention-based methods perform poorly on complicated question-answer pairs. One major reason is that existing methods cannot get accurate alignments between questions and answers for such pairs. We call the phenomenon “attention divergence”. In this paper, we propose a new attention mechanism, called Focusing Attention Network(FAN), which can automatically draw back the divergent attention by adding the semantic, and metadata features. Our Model can focus on the most important part of the sentence and therefore improve the answer ranking performance. Experimental results on the CQA dataset of SemEval-2016 and SemEval-2017 demonstrate that our method respectively attains 79.38 and 88.72 on MAP and outperforms the Top-1 system in the shared task by 0.19 and 0.29.
FdGars: Fraudster Detection via Graph Convolutional Networks in Online App Review System.	Jianyu Wang, Rui Wen, Chunming Wu, Yu Huang, Jian Xiong	www2019c	Online review system enables users to submit reviews about the products. However, the openness of Internet and monetary rewards for crowdsourcing tasks stimulate a large number of fraudulent users to write fake reviews and post advertisements to interfere the rank of apps. Existing methods for detecting spam reviews have been successful but they usually aims at e-commerce (e.g. Amazon, eBay) and recommendation (e.g. Yelp, Dianping) systems. Since the behaviors of fraudulent users are complexity and varying across different review platforms, existing methods are not suitable for fraudster detection in online app review system. To shed light on this question, we are among the first to analyze the intentions of fraudulent users from different review platforms and categorize them by utilizing characteristics of contents (similarity, special symbols) and behaviors (timestamps, device, login status). With a comprehensive analysis of spamming activities and relationships between normal and malicious users, we design and present FdGars, the first graph convolutional network approach for fraudster detection in online app review system. Then we evaluate FdGars on real-world large-scale dataset (with 82,542 nodes and 42,433,134 edges) from Tencent App Store. The result demonstrates that F1-score of FdGars can achieve 0.938+, which outperforms several baselines and state-of-art fraudsters detecting methods. Moreover, we deploy FdGars on Tencent Beacon Anti-Fraud Platform to show its effectiveness and scalability. To the best of our knowledge, this is the first work to use graph convolutional networks for fraudster detection in the large-scale online app review system. It is worth to mention that FdGars can uncover malicious accounts even the data lack of labels in anti-spam tasks.
Contextual Compositionality Detection with External Knowledge Bases and Word Embeddings.	Dongsheng Wang, Qiuchi Li, Lucas Chaves Lima, Jakob Grue Simonsen, Christina Lioma	www2019c	When the meaning of a phrase cannot be inferred from the individual meanings of its words (e.g., hot dog), that phrase is said to be non-compositional. Automatic compositionality detection in multi-word phrases is critical in any application of semantic processing, such as search engines [9]; failing to detect non-compositional phrases can hurt system effectiveness notably. Existing research treats phrases as either compositional or non-compositional in a deterministic manner. In this paper, we operationalize the viewpoint that compositionality is contextual rather than deterministic, i.e., that whether a phrase is compositional or non-compositional depends on its context. For example, the phrase “green card” is compositional when referring to a green colored card, whereas it is non-compositional when meaning permanent residence authorization. We address the challenge of detecting this type of contextual compositionality as follows: given a multi-word phrase, we enrich the word embedding representing its semantics with evidence about its global context (terms it often collocates with) as well as its local context (narratives where that phrase is used, which we call usage scenarios). We further extend this representation with information extracted from external knowledge bases. The resulting representation incorporates both localized context and more general usage of the phrase and allows to detect its compositionality in a non-deterministic and contextual way. Empirical evaluation of our model on a dataset of phrase compositionality1, manually collected by crowdsourcing contextual compositionality assessments, shows that our model outperforms state-of-the-art baselines notably on detecting phrase compositionality.
Algorithms for Fair Team Formation in Online Labour Marketplaces✱.	Giorgio Barnabò, Adriano Fazzone, Stefano Leonardi, Chris Schwiegelshohn	www2019c	As freelancing work keeps on growing almost everywhere due to a sharp decrease in communication costs and to the widespread of Internet-based labour marketplaces (e.g., guru.com, feelancer.com, mturk.com, upwork.com), many researchers and practitioners have started exploring the benefits of outsourcing and crowdsourcing [13, 14, 16, 23, 25, 29]. Since employers often use these platforms to find a group of workers to complete a specific task, researchers have focused their efforts on the study of team formation and matching algorithms and on the design of effective incentive schemes [2, 3, 4, 17]. Nevertheless, just recently, several concerns have been raised on possibly unfair biases introduced through the algorithms used to carry out these selection and matching procedures. For this reason, researchers have started studying the fairness of algorithms related to these online marketplaces [8, 19], looking for intelligent ways to overcome the algorithmic bias that frequently arises. Broadly speaking, the aim is to guarantee that, for example, the process of hiring workers through the use of machine learning and algorithmic data analysis tools does not discriminate, even unintentionally, on grounds of nationality or gender. In this short paper, we define the Fair Team Formation problem in the following way: given an online labour marketplace where each worker possesses one or more skills, and where all workers are divided into two or more not overlapping classes (for examples, men and women), we want to design an algorithm that is able to find a team with all the skills needed to complete a given task, and that has the same number of people from all classes. We provide inapproximability results for the Fair Team Formation problem together with four algorithms for the problem itself. We also tested the effectiveness of our algorithmic solutions by performing experiments using real data from an online labor marketplace.
Implicit Bias in Crowdsourced Knowledge Graphs.	Gianluca Demartini	www2019c	Collaborative creation of knowledge is an approach which has been successfully demonstrated by crowdsourcing project like Wikipedia. Similar techniques have recently been adopted for the creation of collaboratively generated Knowledge Graphs like, for example, Wikidata. While such an approach enables the creation of high quality structured content, it also comes with the challenge of introducing contributors’ implicit bias in the generated Knowledge Graph. In this paper, we investigate how paid crowdsourcing can be used to understand contributor bias for controversial facts to be included into collaborative Knowledge Graphs. We propose methods to trace the provenance of crowdsourced fact checking thus enabling bias transparency rather than aiming at eliminating bias from the Knowledge Graph.
Examining the Roles of Automation, Crowds and Professionals Towards Sustainable Fact-checking.	Naeemul Hassan, Mohammad Yousuf, Md Mahfuzul Haque, Javier A. Suarez Rivas, Md Khadimul Islam	www2019c	This study explores an online fact-checking community called politicalfactchecking on reddit.com that relies on crowdsourcing to find and verify check-worthy facts relating to U.S. politics. The community embodies a network journalism model in which the process of finding and verifying check-worthy facts through crowdsourcing is coordinated by a team of moderators. Applying the concepts of connective journalism, this study analyzed the posts (N = 543) and comments (N = 10, 221) on the community’s Reddit page to understand differences in roles of the community members and the moderators. A mixed-method approach was used to analyze the data. The authors also developed an automated argument classification model to analyze the contents and identify ways to automate parts of the process. The findings suggest that a model consisting of crowds, professionals, and computer-assisted analysis could increase efficiency and decrease costs in news organizations that involve fact-checking.
User Donations in a User Generated Video System.	Adele Lu Jia, Xiaoxue Shen, Siqi Shen, Yongquan Fu, Liwen Peng	www2019c	User generated video systems like YouTube and Twitch.tv have been a major internet phenomenon. They have attracted a vast user base with their many and varied contents provided by their users, and a series of social features tailored for online viewing. In hoping for building a more lively community and encouraging the content creators to share more, recently many such systems have introduced crowdsourcing mechanisms wherein creators get tangible rewards through user donations. User donation is a very special form of user relationships. It influences user engagement in the community, and has a great impact on the success of these systems. However, user donations and donation relationships remain trade secrets for most enterprises and to date are still unexplored. It is not clear at what scale are the donations or how users donate in these systems. In this work, we attempt to fill this gap. We obtain and provide a publicly available dataset on user donations in BiliBili, a popular user generated video system in China with 76.4 million average monthly active users. Based on detailed information on over 5 million videos, over 700 thousand content creators, and over 1.5 million user donations, we quantitatively reveal the characteristics of user donations, we examine their correlations with the upload behavior and content popularity of the creators, and we adopt machine-learned classifiers to accurately predict the creators who will receive donations and who will donate in the future.
What we talk about when we talk about crowdsourcing.	Maria Stone	www2019c	To understand why and how subjectivity and disagreement in label collection matters or doesn't matter I examine the history of systems evaluations and measurement performed by humans and trace the roots of human computation/crowdsourcing and the context in which it arose. Before we can begin fruitful discussions about subjectivity and disagreement we need to ask ourselves what/who it is that human raters are supposed to represent. I offer multiple different perspectives and scenarios that showcase just how varied and ill-defined the role of a human rater can be. I will conclude with some practical recommendations with respect to the questions researchers and practitioners ought to ask themselves before employing human raters, and some challenges with both methodology of such data collection and subsequent analysis of such data.
Crowdsourcing Subjective Tasks: The Case Study of Understanding Toxicity in Online Discussions.	Lora Aroyo, Lucas Dixon, Nithum Thain, Olivia Redfield, Rachel Rosen	www2019c	Discussing things you care about can be difficult, especially via online platforms, where sharing your opinion leaves you open to the real and immediate threats of abuse and harassment. Due to these threats, people stop expressing themselves and give up on seeking different opinions. Recent research efforts focus on examining the strengths and weaknesses (e.g. potential unintended biases) of using machine learning as a support tool to facilitate safe space for online discussions; for example, through detecting various types of negative online behaviors such as hate speech, online harassment, or cyberbullying. Typically, these efforts build upon sentiment analysis or spam detection in text. However, the toxicity of the language could be a strong indicator for the intensity of the negative behavior. In this paper, we study the topic of toxicity in online conversations by addressing the problems of subjectivity, bias, and ambiguity inherent in this task. We start with an analysis of the characteristics of subjective assessment tasks (e.g. relevance judgment, toxicity judgment, sentiment assessment, etc). Whether we perceive something as relevant or as toxic can be influenced by almost infinite amounts of prior or current context, e.g. culture, background, experiences, education, etc. We survey recent work that tries to understand this phenomenon, and we outline a number of open questions and challenges which shape the research perspectives in this multi-disciplinary field.
Discovering User Bias in Ordinal Voting Systems.	Alyssa Lees, Chris Welty	www2019c	Crowdsourcing systems increasingly rely on users to provide more subjective ground truth for intelligent systems - e.g. ratings, aspect of quality and perspectives on how expensive or lively a place feels, etc. We focus on the ubiquitous implementation of online user ordinal voting (e.g 1-5, 1 star-4 stars) on some aspect of an entity, to extract a relative truth, measured by a selected metric such as vote plurality or mean. We argue that this methodology can aggregate results that yield little information to the end user. In particular, ordinal user rankings often converge to a indistinguishable rating. This is demonstrated by the trend in certain cities for the majority of restaurants to all have a 4 star rating. Similarly, the rating of an establishment can be significantly affected by a few users [10]. User bias in voting is not spam, but rather a preference that can be harnessed to provide more information to users. We explore notions of both global skew and user bias. Leveraging these bias and preference concepts, the paper suggests explicit models for better personalization and more informative ratings.
TaskMate: A Mechanism to Improve the Quality of Instructions in Crowdsourcing.	V. K. Chaithanya Manam, Dwarakanath Jampani, Mariam Zaim, Meng-Han Wu, Alexander J. Quinn	www2019c	Developing instructions for microtask crowd workers requires time to ensure consistent interpretations by crowd workers. Even with substantial effort, workers may still misinterpret the instructions due to ambiguous language and structure in the task design. Prior work demonstrated methods for facilitating iterative improvement with help from the requester. However, any participation by the requester reduces the time saved by delegating the work—and hence the utility of using crowdsourcing. We present TaskMate, a system for facilitating worker-led refinement of task instructions with minimal involvement by the requester. Small teams of workers search for ambiguities and vote on the interpretation they believe the requester intended. This paper describes the workflow, our implementation, and our preliminary evaluation.
Intra- and Inter-rater Agreement in a Subjective Speech Quality Assessment Task in Crowdsourcing.	Rafael Zequeira Jiménez, Anna Llagostera, Babak Naderi, Sebastian Möller, Jens Berger	www2019c	Crowdsourcing is a great tool for conducting subjective user studies with large amounts of users. Collecting reliable annotations about the quality of speech stimuli is challenging. The task itself is of high subjectivity and users in crowdsourcing work without supervision. This work investigates the intra- and inter-listener agreement withing a subjective speech quality assessment task. To this end, a study has been conducted in the laboratory and in crowdsourcing in which listeners were requested to rate speech stimuli with respect to their overall quality. Ratings were collected on a 5-point scale in accordance with the ITU-T Rec. P.800 and P.808, respectively. The speech samples were taken from the database ITU-T Rec. P.501 Annex D, and were presented four times to the listeners. Finally, the crowdsourcing results were contrasted to the ratings collected in the laboratory. Strong and significant Spearman’s correlation was achieved when contrasting the ratings collected in both environments. Our analysis show that while the inter-rater agreement increased the more the listeners conducted the assessment task, the intra-rater reliability remained constant. Our study setup helped to overcome the subjectivity of the task and we found that disagreement can represent a source of information to some extent.
The Practice of Labeling: Everything You Always Wanted to Know About Labeling (But Were Afraid to Ask).	Omar Alonso	www2019c	Many data intensive applications that use machine learning or artificial intelligence techniques depend on humans providing the initial dataset, enabling algorithms to process the rest or for other humans to evaluate the performance of such algorithms. There are, however, practical issues with the adoption of human computation and crowdsourcing at scale in the real world. Building systems data processing pipelines that require crowd computing remains difficult. In this tutorial, we present practical considerations for designing and implementing tasks that require the use of humans and machines in combination with the goal of producing high quality labels.
Crowdsourcing Inclusivity: Dealing with Diversity of Opinions, Perspectives and Ambiguity in Annotated Data.	Lora Aroyo, Anca Dumitrache, Oana Inel, Zoltán Szlávik, Benjamin Timmermans, Chris Welty	www2019c	In this tutorial, we introduce a novel crowdsourcing methodology called CrowdTruth [1, 9]. The central characteristic of CrowdTruth is harnessing the diversity in human interpretation to capture the wide range of opinions and perspectives, and thus provide more reliable, realistic and inclusive real-world annotated data for training and evaluating machine learning components. Unlike other methods, we do not discard dissenting votes, but incorporate them into a richer and more continuous representation of truth. CrowdTruth is a widely used crowdsourcing methodology1 adopted by industrial partners and public organizations such as Google, IBM, New York Times, Cleveland Clinic, Crowdynews, Sound and Vision archive, Rijksmuseum, and in a multitude of domains such as AI, news, medicine, social media, cultural heritage, and social sciences. The goal of this tutorial is to introduce the audience to a novel approach to crowdsourcing that takes advantage of the diversity of opinions and perspectives that is inherent to the Web, as methods that deal with disagreement and diversity in crowdsourcing have become increasingly popular. Creating this more complex notion of truth contributes directly to the larger discussion on how to make the Web more reliable, diverse and inclusive.
Creating Crowdsourced Research Talks at Scale.	Rajan Vaish, Shirish Goyal, Amin Saberi, Sharad Goel	www2018	There has been a marked shift towards learning and consuming information through video. Most academic research, however, is still distributed only in text form, as researchers often have limited time, resources, and incentives to create video versions of their work. To address this gap, we propose, deploy, and evaluate a scalable, end-to-end system for crowdsourcing the creation of short, 5-minute research videos based on academic papers. Doing so requires solving complex coordination and collaborative video production problems. To assist coordination, we designed a structured workflow that enables efficient delegation of tasks, while also motivating the crowd through a collaborative learning environment. To facilitate video production, we developed an online tool with which groups can make micro-audio recordings that are automatically stitched together to create a complete talk. We tested this approach with a group of volunteers recruited from 52 countries through an open call. This distributed crowd produced over 100 video talks in 12 languages based on papers from top-tier computer science conferences. The produced talks consistently received high ratings from a diverse group of non-experts and experts, including the authors of the original papers. These results indicate that our crowdsourcing approach is a promising method for producing high-quality research talks at scale, increasing the distribution and accessibility of scientific knowledge.
Attack under Disguise: An Intelligent Data Poisoning Attack Mechanism in Crowdsourcing.	Chenglin Miao, Qi Li, Lu Su, Mengdi Huai, Wenjun Jiang, Jing Gao	www2018	As an effective way to solicit useful information from the crowd, crowdsourcing has emerged as a popular paradigm to solve challenging tasks. However, the data provided by the participating workers are not always trustworthy. In real world, there may exist malicious workers in crowdsourcing systems who conduct the data poisoning attacks for the purpose of sabotage or financial rewards. Although data aggregation methods such as majority voting are conducted on workers» labels in order to improve data quality, they are vulnerable to such attacks as they treat all the workers equally. In order to capture the variety in the reliability of workers, the Dawid-Skene model, a sophisticated data aggregation method, has been widely adopted in practice. By conducting maximum likelihood estimation (MLE) using the expectation maximization (EM) algorithm, the Dawid-Skene model can jointly estimate each worker»s reliability and conduct weighted aggregation, and thus can tolerate the data poisoning attacks to some degree. However, the Dawid-Skene model still has weakness. In this paper, we study the data poisoning attacks against such crowdsourcing systems with the Dawid-Skene model empowered. We design an intelligent attack mechanism, based on which the attacker can not only achieve maximum attack utility but also disguise the attacking behaviors. Extensive experiments based on real-world crowdsourcing datasets are conducted to verify the desirable properties of the proposed mechanism.
Leveraging Crowdsourcing Data for Deep Active Learning An Application: Learning Intents in Alexa.	Jie Yang, Thomas Drake, Andreas C. Damianou, Yoelle Maarek	www2018	This paper presents a generic Bayesian framework that enables any deep learning model to actively learn from targeted crowds. Our framework inherits from recent advances in Bayesian deep learning, and extends existing work by considering the targeted crowdsourcing approach, where multiple annotators with unknown expertise contribute an uncontrolled amount (often limited) of annotations. Our framework leverages the low-rank structure in annotations to learn individual annotator expertise, which then helps to infer the true labels from noisy and sparse annotations. It provides a unified Bayesian model to simultaneously infer the true labels and train the deep learning model in order to reach an optimal learning efficacy. Finally, our framework exploits the uncertainty of the deep learning model during prediction as well as the annotators» estimated expertise to minimize the number of required annotations and annotators for optimally training the deep learning model. We evaluate the effectiveness of our framework for intent classification in Alexa (Amazon»s personal assistant), using both synthetic and real-world datasets. Experiments show that our framework can accurately learn annotator expertise, infer true labels, and effectively reduce the amount of annotations in model training as compared to state-of-the-art approaches. We further discuss the potential of our proposed framework in bridging machine learning and crowdsourcing towards improved human-in-the-loop systems.
