Social Networks Under Stress.	Daniel M. Romero, Brian Uzzi, Jon M. Kleinberg	www2016	Social network research has begun to take advantage of fine-grained communications regarding coordination, decision-making, and knowledge sharing. These studies, however, have not generally analyzed how external events are associated with a social network's structure and communicative properties. Here, we study how external events are associated with a network's change in structure and communications. Analyzing a complete dataset of millions of instant messages among the decision-makers in a large hedge fund and their network of outside contacts, we investigate the link between price shocks, network structure, and change in the affect and cognition of decision-makers embedded in the network. When price shocks occur the communication network tends not to display structural changes associated with adaptiveness. Rather, the network 'turtles up'. It displays a propensity for higher clustering, strong tie inter- action, and an intensification of insider vs. outsider communication. Further, we find changes in network structure pre- dict shifts in cognitive and affective processes, execution of new transactions, and local optimality of transactions better than prices, revealing the important predictive relationship between network structure and collective behavior within a social network.
Crowdsourcing Annotations for Websites' Privacy Policies: Can It Really Work?	Shomir Wilson, Florian Schaub, Rohan Ramanath, Norman M. Sadeh, Fei Liu, Noah A. Smith, Frederick Liu	www2016	Website privacy policies are often long and difficult to understand. While research shows that Internet users care about their privacy, they do not have time to understand the policies of every website they visit, and most users hardly ever read privacy policies. Several recent efforts aim to crowdsource the interpretation of privacy policies and use the resulting annotations to build more effective user interfaces that provide users with salient policy summaries. However, very little attention has been devoted to studying the accuracy and scalability of crowdsourced privacy policy annotations, the types of questions crowdworkers can effectively answer, and the ways in which their productivity can be enhanced. Prior research indicates that most Internet users often have great difficulty understanding privacy policies, suggesting limits to the effectiveness of crowdsourcing approaches. In this paper, we assess the viability of crowdsourcing privacy policy annotations. Our results suggest that, if carefully deployed, crowdsourcing can indeed result in the generation of non-trivial annotations and can also help identify elements of ambiguity in policies. We further introduce and evaluate a method to improve the annotation process by predicting and highlighting paragraphs relevant to specific data practices.
Bayesian Budget Feasibility with Posted Pricing.	Eric Balkanski, Jason D. Hartline	www2016	We consider the problem of budget feasible mechanism design proposed by Singer, but in a Bayesian setting. A principal has a public value for hiring a subset of the agents and a budget, while the agents have private costs for being hired. We consider both additive and submodular value functions of the principal. We show that there are simple, practical, ex post budget balanced posted pricing mechanisms that approximate the value obtained by the Bayesian optimal mechanism that is budget balanced only in expectation. A main motivating application for this work is crowdsourcing, e.g., on Mechanical Turk, where workers are drawn from a large population and posted pricing is standard. Our analysis methods relate to contention resolution schemes in submodular optimization of Vondràk et al. and the correlation gap analysis of Yan.
A Piggyback System for Joint Entity Mention Detection and Linking in Web Queries.	Marco Cornolti, Paolo Ferragina, Massimiliano Ciaramita, Stefan Rüd, Hinrich Schütze	www2016	In this paper we study the problem of linking open-domain web-search queries towards entities drawn from the full entity inventory of Wikipedia articles. We introduce SMAPH-2, a second-order approach that, by piggybacking on a web search engine, alleviates the noise and irregularities that characterize the language of queries and puts queries in a larger context in which it is easier to make sense of them. The key algorithmic idea underlying SMAPH-2 is to first discover a candidate set of entities and then link-back those entities to their mentions occurring in the input query. This allows us to confine the possible concepts pertinent to the query to only the ones really mentioned in it. The link-back is implemented via a collective disambiguation step based upon a supervised ranking model that makes one joint prediction for the annotation of the complete query optimizing directly the F1 measure. We evaluate both known features, such as word embeddings and semantic relatedness among entities, and several novel features such as an approximate distance between mentions and entities (which can handle spelling errors). We demonstrate that SMAPH-2 achieves state-of-the-art performance on the ERD@SIGIR2014 benchmark. We also publish GERDAQ (General Entity Recognition, Disambiguation and Annotation in Queries), a novel, public dataset built specifically for web-query entity linking via a crowdsourcing effort. SMAPH-2 outperforms the benchmarks by comparable margins also on GERDAQ.
Identifying Web Queries with Question Intent.	Gilad Tsur, Yuval Pinter, Idan Szpektor, David Carmel	www2016	Vertical selection is the task of predicting relevant verticals for a Web query so as to enrich the Web search results with complementary vertical results. We investigate a novel variant of this task, where the goal is to detect queries with a question intent. Specifically, we address queries for which the user would like an answer with a human touch. We call these CQA-intent queries, since answers to them are typically found in community question answering (CQA) sites. A typical approach in vertical selection is using a vertical's specific language model of relevant queries and computing the query-likelihood for each vertical as a selective criterion. This works quite well for many domains like Shopping, Local and Travel. Yet, we claim that queries with CQA intent are harder to distinguish by modeling content alone, since they cover many different topics. We propose to also take the structure of queries into consideration, reasoning that queries with question intent have quite a different structure than other queries. We present a supervised classification scheme, random forest over word-clusters for variable length texts, which can model the query structure. Our experiments show that it substantially improves classification performance in the CQA-intent selection task compared to content-oriented based classification, especially as query length grows.
Just in Time: Controlling Temporal Performance in Crowdsourcing Competitions.	Markus Rokicki, Sergej Zerr, Stefan Siersdorfer	www2016	Many modern data analytics applications in areas such as crisis management, stock trading, and healthcare, rely on components capable of nearly real-time processing of streaming data produced at varying rates. In addition to automatic processing methods, many tasks involved in those applications require further human assessment and analysis. However, current crowdsourcing platforms and systems do not support stream processing with variable loads. In this paper, we investigate how incentive mechanisms in competition based crowdsourcing can be employed in such scenarios. More specifically, we explore techniques for stimulating workers to dynamically adapt to both anticipated and sudden changes in data volume and processing demand, and we analyze effects such as data processing throughput, peak-to-average ratios, and saturation effects. To this end, we study a wide range of incentive schemes and utility functions inspired by real world applications. Our large-scale experimental evaluation with more than 900 participants and more than 6200 hours of work spent by crowd workers demonstrates that our competition based mechanisms are capable of adjusting the throughput of online workers and lead to substantial on-demand performance boosts.
Using Hierarchical Skills for Optimized Task Assignment in Knowledge-Intensive Crowdsourcing.	Panagiotis Mavridis, David Gross-Amblard, Zoltán Miklós	www2016	Besides the simple human intelligence tasks such as image labeling, crowdsourcing platforms propose more and more tasks that require very specific skills, especially in participative science projects. In this context, there is a need to reason about the required skills for a task and the set of available skills in the crowd, in order to increase the resulting quality. Most of the existing solutions rely on unstructured tags to model skills (vector of skills). In this paper we propose to finely model tasks and participants using a skill tree, that is a taxonomy of skills equipped with a similarity distance within skills. This model of skills enables to map participants to tasks in a way that exploits the natural hierarchy among the skills. We illustrate the effectiveness of our model and algorithms through extensive experimentation with synthetic and real data sets.
Scheduling Human Intelligence Tasks in Multi-Tenant Crowd-Powered Systems.	Djellel Eddine Difallah, Gianluca Demartini, Philippe Cudré-Mauroux	www2016	Micro-task crowdsourcing has become a popular approach to effectively tackle complex data management problems such as data linkage, missing values, or schema matching. However, the backend crowdsourced operators of crowd-powered systems typically yield higher latencies than the machine-processable operators, this is mainly due to inherent efficiency differences between humans and machines. This problem can be further exacerbated by the lack of workers on the target crowdsourcing platform, or when the workers are shared unequally among a number of competing requesters; including the concurrent users from the same organization who execute crowdsourced queries with different types, priorities and prices. Under such conditions, a crowd-powered system acts mostly as a proxy to the crowdsourcing platform, and hence it is very difficult to provide effiency guarantees to its end-users. Scheduling is the traditional way of tackling such problems in computer science, by prioritizing access to shared resources. In this paper, we propose a new crowdsourcing system architecture that leverages scheduling algorithms to optimize task execution in a shared resources environment, in this case a crowdsourcing platform. Our study aims at assessing the efficiency of the crowd in settings where multiple types of tasks are run concurrently. We present extensive experimental results comparing i) different multi-tenant crowdsourcing jobs, including a workload derived from real traces, and ii) different scheduling techniques tested with real crowd workers. Our experimental results show that task scheduling can be leveraged to achieve fairness and reduce query latency in multi-tenant crowd-powered systems, although with very different tradeoffs compared to traditional settings not including human factors.
The Communication Network Within the Crowd.	Ming Yin, Mary L. Gray, Siddharth Suri, Jennifer Wortman Vaughan	www2016	"Since its inception, crowdsourcing has been considered a black-box approach to solicit labor from a crowd of workers. Furthermore, the ""crowd"" has been viewed as a group of independent workers dispersed all over the world. Recent studies based on in-person interviews have opened up the black box and shown that the crowd is not a collection of independent workers, but instead that workers communicate and collaborate with each other. Put another way, prior work has shown the existence of edges between workers. We build on and extend this discovery by mapping the entire communication network of workers on Amazon Mechanical Turk, a leading crowdsourcing platform. We execute a task in which over 10,000 workers from across the globe self-report their communication links to other workers, thereby mapping the communication network among workers. Our results suggest that while a large percentage of workers indeed appear to be independent, there is a rich network topology over the rest of the population. That is, there is a substantial communication network within the crowd. We further examine how online forum usage relates to network topology, how workers communicate with each other via this network, how workers' experience levels relate to their network positions, and how U.S. workers differ from international workers in their network characteristics. We conclude by discussing the implications of our findings for requesters, workers, and platform providers like Amazon."
Leveraging Crowdsourcing for the Thematic Annotation of the Qur'an.	Amna Basharat, Ismailcem Budak Arpinar, Khaled Rasheed	www2016c	In this paper, we illustrate how we leverage crowdsourcing to create workflows for knowledge engineering in specialized and knowledge intensive domains. We undertake the special case of the Arabic script of the Qur'an, a widely studied manuscript, and attempt to employ crowdsourcing methods for its thematic annotation at the sub-verse level, for which, there is no standardized knowledge model available to date. We demonstrate that our proposed method presents feasibility to achieve reliable annotations in an efficient and scalable manner. The proposed methodology and framework is meant to be generalizable to other knowledge intensive and specialized domains.
Label Aggregation with Instance Grouping Model.	Li'ang Yin, Jianhua Han, Yong Yu	www2016c	Label aggregation is one of the key topics in crowdsourcing research. Most researchers make their efforts in modeling ability of users and difficulty of instances. In this paper, we consider label aggregation from the view of grouping instances. We assume instances are sampled from latent groups and they share the same true label with their corresponding groups. We construct a graphical model named InGroup(Instance Grouping model) to infer latent group assignment as well as true labels. The experimental results show the advantages of our model compared with baselines.
Human Atlas: A Tool for Mapping Social Networks.	Martin Saveski, Eric Chu, Soroush Vosoughi, Deb Roy	www2016c	Most social network analyses focus on online social networks. While these networks encode important aspects of our lives they fail to capture many real-world social connections. Most of these connections are, in fact, public and known to the members of the community. Mapping them is a task very suitable for crowdsourcing: it is easily broken down in many simple and independent subtasks. Due to the nature of social networks-presence of highly connected nodes and tightly knit groups-if we allow users to map their immediate connections and the connections between them, we will need few participants to map most connections within a community. To this end, we built the Human Atlas, a web-based tool for mapping social networks. To test it, we partially mapped the social network of the MIT Media Lab. We ran a user study and invited members of the community to use the tool. In 4.6 man-hours, 22 participants mapped 984 connections within the lab, demonstrating the potential of the tool.
TLScompare: Crowdsourcing Rules for HTTPS Everywhere.	Wilfried Mayer, Martin Schmiedecker	www2016c	For billions of users, today's Internet has become a critical infrastructure for information retrieval, social interaction and online commerce. However, in recent years research has shown that mechanisms to increase security and privacy like HTTPS are seldomly employed by default. With the exception of some notable key players like Google or Facebook, the transition to protecting not only sensitive information flows but all communication content using TLS is still in the early stages. While non-significant portion of the web can be reached securely using an open-source browser extension called HTTPS Everywhere by the EFF, the rules fueling it are so far manually created and maintained by a small set of people. In this paper we present our findings in creating and validating rules for HTTPS Everywhere using crowdsourcing approaches. We created a publicly reachable platform at tlscompare.org to validate new as well as existing rules at large scale. Over a period of approximately 5 months we obtained results for more than 7,500 websites, using multiple seeding approaches. In total, the users of TLScompare spent more than 28 hours of comparing time to validate existing and new rules for HTTPS Everywhere. One of our key findings is that users tend to disagree even regarding binary decisions like whether two websites are similar over port 80 and 443.
Perceived Task Similarities for Task Recommendation in Crowdsourcing Systems.	Steffen Schnitzer, Svenja Neitzel, Sebastian Schmidt, Christoph Rensing	www2016c	Crowdsourcing platforms support the assignment of jobs while relying on the workers' search capabilities. Recommenders can support the workers' decisions to improve quality and outcome for both worker and requester. A precedent study showed, that many workers expect to get tasks recommended, which are similar to previously finished ones. In order to create genuine task recommendation, similarities between tasks have to be identified and analyzed. Therefore, this work provides an empirical study about how workers perceive task similarities. The perceived task similarities may vary between workers with different cultural background and may depend e.g. on the complexity, required action or the requester of the task.
A Simple Tags Categorization Framework Using Spatial Coverage to Discover Geospatial Semantics.	Camille Tardy, Laurent Moccozet, Gilles Falquet	www2016c	There exist many popular crowdsourcing and social services (Volunteered Geographic Information (VGI)) to share information and documents such as Flickr, Foursquare, Twitter , Facebook, etc. They all use metadata, folksonomy and more importantly a geographic axis with GPS coordinates and/or geographic tags. Using this available folksonomy in VGI services we propose a logical approach to highlight and possibly discover the characteristics of geographic places. The approach is based on the notion of spatial coverage and a model of tags categorization and on their semantic identification, using semantic services such as GeoNames, OpenStreetMap or WordNet. We illustrate our model with Flickr to retrieve the characteristics (function, usage?) of places even if those places have a small number of related photos. Those found characteristics allow tag disambiguation and can be use to complete the semantic gap on places and POIs such as the function of buildings, which can exist in geographic services.
Machine Learning for Q&A Sites: State of the Art and Research Directions.	Xavier Amatriain	www2016c	Q&A sites like Quora aim at growing the world's knowledge. In order to do this, they need to get the right questions to the right people to answer them, but also the existing answers to people who are interested in them. In order to accomplish this, they need to build a complex ecosystem where issues such as content quality, engagement, demand, interests, or reputation are taken into account. It is not possible to build a system like this unless most of the process are highly automated and scalable. The good news is that using high-quality data you can build machine learning solutions that can help address all of the previous requirements. In this talk I will describe some interesting uses of machine learning for Q&A that range from different recommendation approaches such as personalized ranking to classifiers built to detect duplicate questions or spam. I will describe some of the modeling and feature engineering approaches that go into building these systems. I will also share some of the challenges faced when building such a large-scale knowledge base of human-generated knowledge. Finally, I will describe some of the unresolved research challenges in the Q&A Space. I will use my experience at Quora as the main driving example. Quora is a Q&A site that despite having over 80 million unique visitors a month, it is known for keeping a high-quality of answers and content in general.
Using Semantics to Search Answers for Unanswered Questions in Q&A Forums.	Priyanka Singh, Elena Simperl	www2016c	The expert based question and answering forums are crowdsourced and rely on people to provide answers for questions. This paper focuses on technology based Q&A systems like StackOverflow and Reddit. These websites are popular and yet many questions remain unanswered. The Suman system uses semantic keyword search in combination with traditional text search techniques to find similar questions with answers for unanswered questions. Furthermore, the Suman system also recommends experts who can answer those questions. This helps to narrow down the long tail of unanswered questions. The Suman system utilises Semantic Web and Linked Data technologies to integrate the datasets from two websites, structure them and link them to Linked Data Cloud. It uses available tools to solve name entity disambiguation problem and expands the query term with added semantics. The Suman system was evaluated and results were analysed to show its viability.
Assessing the Quality of Wikipedia Editors through Crowdsourcing.	Yu Suzuki, Satoshi Nakamura	www2016c	In this paper, we propose a method for assessing the quality of Wikipedia editors. By effectively determining whether the text meaning persists over time, we can determine the actual contribution by editors. This is used in this paper to detect vandal. However, the meaning of text does not always change if a term in the text is added or removed. Therefore, we cannot capture the changes of text meaning automatically, so we cannot detect whether the meaning of text survives or not. To solve this problem, we use crowdsourcing to manually detect changes of text meaning. In our experiment, we confirmed that our proposed method improves the accuracy of detecting vandals by about 5%.
Summarizing Entity Descriptions for Effective and Efficient Human-centered Entity Linking.	Gong Cheng, Danyun Xu, Yuzhong Qu	www2015	Entity linking connects the Web of documents with knowledge bases. It is the task of linking an entity mention in text to its corresponding entity in a knowledge base. Whereas a large body of work has been devoted to automatically generating candidate entities, or ranking and choosing from them, manual efforts are still needed, e.g., for defining gold-standard links for evaluating automatic approaches, and for improving the quality of links in crowdsourcing approaches. However, structured descriptions of entities in knowledge bases are sometimes very long. To avoid overloading human users with too much information and help them more efficiently choose an entity from candidates, we aim to substitute entire entity descriptions with compact, equally effective structured summaries that are automatically generated. To achieve it, our approach analyzes entity descriptions in the knowledge base and the context of entity mention from multiple perspectives, including characterizing and differentiating power, information overlap, and relevance to context. Extrinsic evaluation (where human users carry out entity linking tasks) and intrinsic evaluation (where human users rate summaries) demonstrate that summaries generated by our approach help human users carry out entity linking tasks more efficiently (22-23% faster), without significantly affecting the quality of links obtained; and our approach outperforms existing approaches to summarizing entity descriptions.
The Dynamics of Micro-Task Crowdsourcing: The Case of Amazon MTurk.	Djellel Eddine Difallah, Michele Catasta, Gianluca Demartini, Panagiotis G. Ipeirotis, Philippe Cudré-Mauroux	www2015	Micro-task crowdsourcing is rapidly gaining popularity among research communities and businesses as a means to leverage Human Computation in their daily operations. Unlike any other service, a crowdsourcing platform is in fact a marketplace subject to human factors that affect its performance, both in terms of speed and quality. Indeed, such factors shape the dynamics of the crowdsourcing market. For example, a known behavior of such markets is that increasing the reward of a set of tasks would lead to faster results. However, it is still unclear how different dimensions interact with each other: reward, task type, market competition, requester reputation, etc. In this paper, we adopt a data-driven approach to (A) perform a long-term analysis of a popular micro-task crowdsourcing platform and understand the evolution of its main actors (workers, requesters, and platform). (B) We leverage the main findings of our five year log analysis to propose features used in a predictive model aiming at determining the expected performance of any batch at a specific point in time. We show that the number of tasks left in a batch and how recent the batch is are two key features of the prediction. (C) Finally, we conduct an analysis of the demand (new tasks posted by the requesters) and supply (number of tasks completed by the workforce) and show how they affect task prices on the marketplace.
