Evolutionary habits on the web.	Daniele Quercia	www2014c	"For the last few years, I and my colleagues have been exploring the complex relationship between our offline and online worlds. This talk will show that, as online platforms become mature, the social behavior we have evolved over thousands of years is reflected on our actions on the web as well. It turns out that, in the context of social influence, finding the ""(special) many"" (of those who are able to spot trends early one) is more important than trying to find the ""special few""[10]; that people with different personality traits take on different roles on both Twitter and Facebook [5,6]; that language, with its vocabulary and prescribed ways of communicating, is a symbolic resource that can be used on its own to influence others [4]; and that a Facebook relationship is more likely to break if it is not embedded in the same social circle, if it is between two people whose ages differ, and if one of the two is neurotic or introvert [3]. Interestingly, we also found that a relationship with a common female friend is more robust than that with a common male friend. More recently, we have also explored the relationship between offline and online worlds in the urban context. We have considered hypotheses put forward in the 1970s urban sociology literature [1,2] and, for the first time, we have been able to test them at scale.We have done so by building two crowdsourcing web games: one crowdsources Londoners' mental images of the city [8], and the other crowdsources the discovery of the urban elements that make people happy [7]. We have found that, as opposed to well-to-do areas, those suffering from social problems are rarely present in residents' mental maps of the city, and they tend to be characterized more by cars and fortress-like buildings than by greenery. This talk will conclude by showing how combining both web games with Flickr offers interesting applications for discovering emotionally-pleasant routes [9] and for ranking city pictures [11]."
Understanding toxic behavior in online games.	Haewoon Kwak	www2014c	With the remarkable advances from isolated console games to massively multi-player online role-playing games, the online gaming world provides yet another place where people interact with each other. Online games have attracted attention from researchers, because i) the purpose of actions is relatively clear, and ii) actions are quantifiable. A wide range of predefined actions for supporting social interaction (e.g., friendship, communication, trade, enmity, aggression, and punishment) reflects either positive or negative connotations among game players, and is unobtrusively recorded by the game servers. These rich electronic footprints have become invaluable assets for the research of social dynamics. In particular, exploring negative behavior in online games is a key research direction because it directly influences gaming experience and user satisfaction. Even a few negative players can impact many others because of the design of multi-player games. For this reason these players are called toxic. The definition of toxic play is not cut and dry. Even if someone follows the game rules, he could be considered toxic. For example, killing one player repetitively is often deemed toxic behavior, although it does not break game rules at all. The vagueness of toxicity makes it hard to understand, detect, and prevent it. League of Legends (LoL), created by Riot Games with 70 million users as of 2012, offers a new way to understand toxic behavior. Riot Games develops a crowdsourcing framework, the Tribunal, to judge whether reported toxic behavior should be punished or not. Volunteered players review user reports and vote for either pardon or punishment. As of March 2013, 105 million votes had been collected in North America and Europe. We explore toxic playing and reaction based on large-scale data from the Tribunal[1]. We collect and investigate over 10 million user reports on 1.46 million toxic players and corresponding crowdsourced decisions made in the Tribunal. We crawl data from three different regions, North America, Western Europe, and Korea, to take regional differences of user behavior into account. To obtain the comprehensive view of toxic playing and reaction based on huge data collection, we answer following research questions in a bottom-up approach: how individuals react to toxic players, how teams interact with toxic players, how general toxic or non-toxic players behave across the match, and how crowds make a decision on toxic players. We find large-scale empirical support for some notoriously difficult theories to test in the wild, which are bystander effect, ingroup favoritism, black sheep effect, cohesion-performance relationships, and attribution theory. We also discover that regional differences affect the likelihood of being reported and the proportion of being punished of toxic players in the Tribunal. We then propose a supervised learning approach for predicting crowdsourced decisions on toxic behavior with large-scale labeled data collections[2]. Using the same sparse information available to the reviewers, we trained classifiers to detect the presence, and severity of toxicity. We built several models oriented around in-game performance, reports by victims of toxic behavior, and linguistic features of chat messages. We found that training with high agreement decisions resulted in more accuracy on low agreement decisions and that our classifier was adept in detecting clear cut innocence. Finally, we showed that our classifier is relatively robust across cultural regions; our classifier built from a North American dataset performed adequately on a European dataset. Ultimately, our work can be used as a foundation for the further study of toxic behavior.
Extraction and integration of web sources with humans and domain knowledge.	Disheng Qiu, Lorenzo Luce	www2014c	The extraction and integration of data from many web sources in different domains is an open issue. Two promising solutions take on this challenge: top down approaches rely on a domain knowledge that is manually crafted by an expert to guide the process and bottom up approaches try to infer the schema from many web sources to make sense of the extracted data. The first solutions scale over the number of web sources, but for settings with different domains, an expert has to manually craft an ontology for each domain. The second solutions do not require a domain expert, but high quality is achieved only with a lot of human interactions both in the extraction and integration steps. We introduce a framework that takes the best from both approaches. The framework addresses synergically both extraction and integration of data from web sources. No domain expert is required, it exploits data from a seed knowledge base to enhance the automatic extraction and integration (top down). Human workers from crowdsourcing platforms are engaged to improve the quality and the coverage of the extracted data. The framework adopts techniques to automatically extract both the schema and the data from multiple web sources (bottom up). The extracted information is then used to bootstrap the seed knowledge base, reducing in this way the human effort for future tasks.
Steering user behavior with badges.	Ashton Anderson, Daniel P. Huttenlocher, Jon M. Kleinberg, Jure Leskovec	www2013	An increasingly common feature of online communities and social media sites is a mechanism for rewarding user achievements based on a system of badges. Badges are given to users for particular contributions to a site, such as performing a certain number of actions of a given type. They have been employed in many domains, including news sites like the Huffington Post, educational sites like Khan Academy, and knowledge-creation sites like Wikipedia and Stack Overflow. At the most basic level, badges serve as a summary of a user's key accomplishments; however, experience with these sites also shows that users will put in non-trivial amounts of work to achieve particular badges, and as such, badges can act as powerful incentives. Thus far, however, the incentive structures created by badges have not been well understood, making it difficult to deploy badges with an eye toward the incentives they are likely to create. In this paper, we study how badges can influence and steer user behavior on a site---leading both to increased participation and to changes in the mix of activities a user pursues on the site. We introduce a formal model for reasoning about user behavior in the presence of badges, and in particular for analyzing the ways in which badges can steer users to change their behavior. To evaluate the main predictions of our model, we study the use of badges and their effects on the widely used Stack Overflow question-answering site, and find evidence that their badges steer behavior in ways closely consistent with the predictions of our model. Finally, we investigate the problem of how to optimally place badges in order to induce particular user behaviors. Several robust design principles emerge from our framework that could potentially aid in the design of incentives for a broad range of sites.
Reactive crowdsourcing.	Alessandro Bozzon, Marco Brambilla, Stefano Ceri, Andrea Mauri	www2013	In the second term, we aim to collect more than 10,000 QoE measurements. To support measurement at this scale, we will develop and apply enhancements in two major directions: 1) recruit and retain more subjects, 2) automate the process of selecting video materials and composing video playback scenarios. Including more gamification elements. In the previous two crowdsourcing-based experiments, we successfully achieved fairly strong user engagement. We will continue to polish the QUINCE user interface to ensure subjects can smoothly execute the assigned measurement tasks. We will further enhance QUINCE by introducing two more gamification elements: badges and leaderboards. Badges provide subjects some intermediate goals before achieving their maximum reward limit and also increase a subjects sense of achievement. We will design the criteria for receiving badges and update the evolve of scores. We will also implement a leaderboard, which can stimulate competition among subjects and yield additional measurements. Automating selection of video materials. Currently, for the simulated video streaming QoE test, we manually download from YouTube 5 High Definition (HD) video clips distributed using a Common Creative license, and re-encode them into DASH format. We also composed 4 simulation scenarios based on our prior experience in QoE measurement. For the YouTube video streaming test, we manually selected another 8 YouTube video clips to embed into QUINCE. Subjects may grow bored after repeatedly evaluating QoE on the same set of video clips. We also received email feedback from a subject who expressed this feeling in the November trial. In the second term, we will investigate the use of the YouTube Data API (or similar API provided by other video streaming providers) to automate the video selection process. We will use predefined keywords or video categories to retrieve a list of videos, such as Sports and Music. We will set various parameters to narrow search results to return only high quality and popular videos. When a certain video and scenario pair has collected sufficient samples (e.g., ¿ 30), we will crawl a new list of videos and download their highest-definition version and format them in CAIDAs server as DASH format. For the YouTube QoE assessment, we can simply update the list in our database.
Aggregating crowdsourced binary ratings.	Nilesh N. Dalvi, Anirban Dasgupta, Ravi Kumar, Vibhor Rastogi	www2013	In this paper we analyze a crowdsourcing system consisting of a set of users and a set of binary choice questions. Each user has an unknown, fixed, reliability that determines the user's error rate in answering questions. The problem is to determine the truth values of the questions solely based on the user answers. Although this problem has been studied extensively, theoretical error bounds have been shown only for restricted settings: when the graph between users and questions is either random or complete. In this paper we consider a general setting of the problem where the user--question graph can be arbitrary. We obtain bounds on the error rate of our algorithm and show it is governed by the expansion of the graph. We demonstrate, using several synthetic and real datasets, that our algorithm outperforms the state of the art.
Crowdsourced judgement elicitation with endogenous proficiency.	Anirban Dasgupta, Arpita Ghosh	www2013	Crowdsourcing is now widely used to replace judgement or evaluation by an expert authority with an aggregate evaluation from a number of non-experts, in applications ranging from rating and categorizing online content all the way to evaluation of student assignments in massively open online courses (MOOCs) via peer grading. A key issue in these settings, where direct monitoring of both effort and accuracy is infeasible, is incentivizing agents in the 'crowd' to put in effort to make good evaluations, as well as to truthfully report their evaluations. We study the design of mechanisms for crowdsourced judgement elicitation when workers strategically choose both their reports and the effort they put into their evaluations. This leads to a new family of information elicitation problems with unobservable ground truth, where an agent's proficiency--- the probability with which she correctly evaluates the underlying ground truth--- is endogenously determined by her strategic choice of how much effort to put into the task. Our main contribution is a simple, new, mechanism for binary information elicitation for multiple tasks when agents have endogenous proficiencies, with the following properties: (i) Exerting maximum effort followed by truthful reporting of observations is a Nash equilibrium. (ii) This is the equilibrium with maximum payoff to all agents, even when agents have different maximum proficiencies, can use mixed strategies, and can choose a different strategy for each of their tasks. Our information elicitation mechanism requires only minimal bounds on the priors, asks agents to only report their own evaluations, and does not require any conditions on a diverging number of agent reports per task to achieve its incentive properties. The main idea behind our mechanism is to use the presence of multiple tasks and ratings to estimate a reporting statistic to identify and penalize low-effort agreement--- the mechanism rewards agents for agreeing with another 'reference' report on the same task, but also penalizes for blind agreement by subtracting out this statistic term, designed so that agents obtain rewards only when they put in effort into their observations.
Pick-a-crowd: tell me what you like, and i'll tell you what to do.	Djellel Eddine Difallah, Gianluca Demartini, Philippe Cudré-Mauroux	www2013	Crowdsourcing allows to build hybrid online platforms that combine scalable information systems with the power of human intelligence to complete tasks that are difficult to tackle for current algorithms. Examples include hybrid database systems that use the crowd to fill missing values or to sort items according to subjective dimensions such as picture attractiveness. Current approaches to Crowdsourcing adopt a pull methodology where tasks are published on specialized Web platforms where workers can pick their preferred tasks on a first-come-first-served basis. While this approach has many advantages, such as simplicity and short completion times, it does not guarantee that the task is performed by the most suitable worker. In this paper, we propose and extensively evaluate a different Crowdsourcing approach based on a push methodology. Our proposed system carefully selects which workers should perform a given task based on worker profiles extracted from social networks. Workers and tasks are automatically matched using an underlying categorization structure that exploits entities extracted from the task descriptions on one hand, and categories liked by the user on social platforms on the other hand. We experimentally evaluate our approach on tasks of varying complexity and show that our push methodology consistently yield better results than usual pull strategies.
From query to question in one click: suggesting synthetic questions to searchers.	Gideon Dror, Yoelle Maarek, Avihai Mejer, Idan Szpektor	www2013	In Web search, users may remain unsatisfied for several reasons: the search engine may not be effective enough or the query might not reflect their intent. Years of research focused on providing the best user experience for the data available to the search engine. However, little has been done to address the cases in which relevant content for the specific user need has not been posted on the Web yet. One obvious solution is to directly ask other users to generate the missing content using Community Question Answering services such as Yahoo! Answers or Baidu Zhidao. However, formulating a full-fledged question after having issued a query requires some effort. Some previous work proposed to automatically generate natural language questions from a given query, but not for scenarios in which a searcher is presented with a list of questions to choose from. We propose here to generate synthetic questions that can actually be clicked by the searcher so as to be directly posted as questions on a Community Question Answering service. This imposes new constraints, as questions will be actually shown to searchers, who will not appreciate an awkward style or redundancy. To this end, we introduce a learning-based approach that improves not only the relevance of the suggested questions to the original query, but also their grammatical correctness. In addition, since queries are often underspecified and ambiguous, we put a special emphasis on increasing the diversity of suggestions via a novel diversification mechanism. We conducted several experiments to evaluate our approach by comparing it to prior work. The experiments show that our algorithm improves question quality by 14% over prior work and that adding diversification reduced redundancy by 55%.
Pricing mechanisms for crowdsourcing markets.	Yaron Singer, Manas Mittal	www2013	Every day millions of crowdsourcing tasks are performed in exchange for payments. Despite the important role pricing plays in crowdsourcing campaigns and the complexity of the market, most platforms do not provide requesters appropriate tools for effective pricing and allocation of tasks. In this paper, we introduce a framework for designing mechanisms with provable guarantees in crowdsourcing markets. The framework enables automating the process of pricing and allocation of tasks for requesters in complex markets like Amazon's Mechanical Turk where workers arrive in an online fashion and requesters face budget constraints and task completion deadlines. We present constant-competitive incentive compatible mechanisms for maximizing the number of tasks under a budget, and for minimizing payments given a fixed number of tasks to complete. To demonstrate the effectiveness of this framework we created a platform that enables applying pricing mechanisms in markets like Mechanical Turk. The platform allows us to show that the mechanisms we present here work well in practice, as well as to give experimental evidence to workers' strategic behavior in absence of appropriate incentive schemes.
Truthful incentives in crowdsourcing tasks using regret minimization mechanisms.	Adish Singla, Andreas Krause	www2013	What price should be offered to a worker for a task in an online labor market? How can one enable workers to express the amount they desire to receive for the task completion? Designing optimal pricing policies and determining the right monetary incentives is central to maximizing requester's utility and workers' profits. Yet, current crowdsourcing platforms only offer a limited capability to the requester in designing the pricing policies and often rules of thumb are used to price tasks. This limitation could result in inefficient use of the requester's budget or workers becoming disinterested in the task. In this paper, we address these questions and present mechanisms using the approach of regret minimization in online learning. We exploit a link between procurement auctions and multi-armed bandits to design mechanisms that are budget feasible, achieve near-optimal utility for the requester, are incentive compatible (truthful) for workers and make minimal assumptions about the distribution of workers' true costs. Our main contribution is a novel, no-regret posted price mechanism, BP-UCB, for budgeted procurement in stochastic online settings. We prove strong theoretical guarantees about our mechanism, and extensively evaluate it in simulations as well as on real data from the Mechanical Turk platform. Compared to the state of the art, our approach leads to a 180% increase in utility.
Mining emotions in short films: user comments or crowdsourcing?	Claudia Orellana-Rodriguez, Ernesto Diaz-Aviles, Wolfgang Nejdl	www2013c	Short films are regarded as an alternative form of artistic creation, and they express, in a few minutes, a whole gamma of different emotions oriented to impact the audience and communicate a story. In this paper, we exploit a multi-modal sentiment analysis approach to extract emotions in short films, based on the film criticism expressed through social comments from the video-sharing platform YouTube. We go beyond the traditional polarity detection (i.e., positive/negative), and extract, for each analyzed film, four opposing pairs of primary emotions: joy-sadness, anger-fear, trust-disgust, and anticipation-surprise. We found that YouTube comments are a valuable source of information for automatic emotion detection when compared to human analysis elicited via crowdsourcing.
Discovery of technical expertise from open source code repositories.	Rahul Venkataramani, Atul Gupta, Allahbaksh M. Asadullah, Basavaraju Muddu, Vasudev D. Bhat	www2013c	Online Question and Answer websites for developers have emerged as the main forums for interaction during the software development process. The veracity of an answer in such websites is typically verified by the number of 'upvotes' that the answer garners from peer programmers using the same forum. Although this mechanism has proved to be extremely successful in rating the usefulness of the answers, it does not lend itself very elegantly to model the expertise of a user in a particular domain. In this paper, we propose a model to rank the expertise of the developers in a target domain by mining their activity in different opensource projects. To demonstrate the validity of the model, we built a recommendation system for StackOverflow which uses the data mined from GitHub.
Crowdsourcing MapReduce: JSMapReduce.	Philipp Langhans, Christoph Wieser, François Bry	www2013c	JSMapReduce is an implementation of MapReduce which exploits the computing power available in the computers of the users of a web platform by giving tasks to the JavaScript engines of their web browsers. This article describes the implementation of JSMapReduce exploiting HTML 5 features, the heuristics it uses for distributing tasks to workers, and reports on an experimental evaluation of JSMapReduce.
ALFRED: crowd assisted data extraction.	Valter Crescenzi, Paolo Merialdo, Disheng Qiu	www2013c	The development of solutions to scale the extraction of data from Web sources is still a challenging issue. High accuracy can be achieved by supervised approaches, but the costs of training data, i.e., annotations over a set of sample pages, limit their scalability. Crowdsourcing platforms are making the manual annotation process more affordable. However, the tasks demanded to these platforms should be extremely simple, to be performed by non-expert people, and their number should be minimized, to contain the costs. We demonstrate ALFRED, a wrapper inference system supervised by the workers of a crowdsourcing platform. Training data are labeled values generated by means of membership queries, the simplest form of queries, posed to the crowd. ALFRED includes several original features: it automatically selects a representative sample set from the input collection of pages; in order to minimize the wrapper inference costs, it dynamically sets the expressiveness of the wrapper formalism and it adopts an active learning algorithm to select the queries posed to the crowd; it is able to manage inaccurate answers that can be provided by the workers engaged by crowdsourcing platforms.
