Cut-matching Games for Generalized Hypergraph Ratio Cuts.	Nate Veldt	www2023	Many social networks and web-based datasets are characterized by multiway interactions (e.g., groups of co-purchased online retail products or group conversations in Q&A forums) and hypergraph clustering is a fundamental primitive for analyzing these types of interactions. We present an O(log n)-approximation algorithm for a broad class of hypergraph ratio cut objectives. This includes objectives involving generalized hypergraph cut functions, which allow a user to penalize cut hyperedges differently depending on the number of nodes in each cluster. Our method generalizes the cut-matching framework for graph ratio cuts, and relies only on solving maximum s-t flow problems in a special reduced graph. It is significantly faster than existing hypergraph ratio cut algorithms, while also solving a more general problem. In numerical experiments on various web-based hypergraphs, we show that it quickly finds ratio cut solutions within a small factor of optimality.
Reinforcement Learning-based Counter-Misinformation Response Generation: A Case Study of COVID-19 Vaccine Misinformation.	Bing He, Mustaque Ahamad, Srijan Kumar	www2023	The spread of online misinformation threatens public health, democracy, and the broader society. While professional fact-checkers form the first line of defense by fact-checking popular false claims, they do not engage directly in conversations with misinformation spreaders. On the other hand, non-expert ordinary users act as eyes-on-the-ground who proactively counter misinformation – recent research has shown that 96% counter-misinformation responses are made by ordinary users. However, research also found that 2/3 times, these responses are rude and lack evidence. This work seeks to create a counter-misinformation response generation model to empower users to effectively correct misinformation. This objective is challenging due to the absence of datasets containing ground-truth of ideal counter-misinformation responses, and the lack of models that can generate responses backed by communication theories. In this work, we create two novel datasets of misinformation and counter-misinformation response pairs from in-the-wild social media and crowdsourcing from college-educated students. We annotate the collected data to distinguish poor from ideal responses that are factual, polite, and refute misinformation. We propose MisinfoCorrect, a reinforcement learning-based framework that learns to generate counter-misinformation responses for an input misinformation post. The model rewards the generator to increase the politeness, factuality, and refutation attitude while retaining text fluency and relevancy. Quantitative and qualitative evaluation shows that our model outperforms several baselines by generating high-quality counter-responses. This work illustrates the promise of generative text models for social good – here, to help create a safe and reliable information ecosystem. The code and data is accessible on https://github.com/claws-lab/MisinfoCorrect.
High-Effort Crowds: Limited Liability via Tournaments.	Yichi Zhang, Grant Schoenebeck	www2023	We consider the crowdsourcing setting where, in response to the assigned tasks, agents strategically decide both how much effort to exert (from a continuum) and whether to manipulate their reports. The goal is to design payment mechanisms that (1) satisfy limited liability (all payments are non-negative), (2) reduce the principal’s cost of budget, (3) incentivize effort and (4) incentivize truthful responses. In our framework, the payment mechanism composes a performance measurement, which noisily evaluates agents’ effort based on their reports, and a payment function, which converts the scores output by the performance measurement to payments. Previous literature suggests applying a peer prediction mechanism combined with a linear payment function. This method can achieve either (1), (3) and (4), or (2), (3) and (4) in the binary effort setting. In this paper, we suggest using a rank-order payment function (tournament). Assuming Gaussian noise, we analytically optimize the rank-order payment function, and identify a sufficient statistic, sensitivity, which serves as a metric for optimizing the performance measurements. This helps us obtain (1), (2) and (3) simultaneously. Additionally, we show that adding noise to agents’ scores can preserve the truthfulness of the performance measurements under the non-linear tournament, which gives us all four objectives. Our real-data estimated agent-based model experiments show that our method can greatly reduce the payment of effort elicitation while preserving the truthfulness of the performance measurement. In addition, we empirically evaluate several commonly used performance measurements in terms of their sensitivities and strategic robustness.
Randomized Pricing with Deferred Acceptance for Revenue Maximization with Submodular Objectives.	He Huang, Kai Han, Shuang Cui, Jing Tang	www2023	A lot of applications in web economics need to maximize the revenue under a budget for payments and also guarantee the truthfulness of users, so Budget-Feasible Mechanism (BFM) Design has aroused great interests during last decade. Most of the existing BFMs concentrate on maximizing a monotone submodular function subject to a knapsack constraint, which is insufficient for many applications with complex objectives or constraints. Observing this, the recent studies (e.g., [4, 5, 11]) have considered non-monotone submodular objectives or more complex constraints such as a k-system constraint. In this study, we follow this line of research and propose truthful BFMs with improved performance bounds for non-monotone submodular objectives with or without a k-system constraint. Our BFMs leverage the idea of providing random prices to users while deferring the decision on the final winning set, and are also based on a novel randomized algorithm for the canonical constrained submodular maximization problem achieving better performance bounds compared to the state-of-the-art. Finally, the effectiveness and efficiency of our approach are demonstrated by extensive experiments on several applications about social network marketing, crowdsourcing and personalized recommendation.
Multiview Representation Learning from Crowdsourced Triplet Comparisons.	Xiaotian Lu, Jiyi Li, Koh Takeuchi, Hisashi Kashima	www2023	Crowdsourcing has been used to collect data at scale in numerous fields. Triplet similarity comparison is a type of crowdsourcing task, in which crowd workers are asked the question “among three given objects, which two are more similar?”, which is relatively easy for humans to answer. However, the comparison can be sometimes based on multiple views, i.e., different independent attributes such as color and shape. Each view may lead to different results for the same three objects. Although an algorithm was proposed in prior work to produce multiview embeddings, it involves at least two problems: (1) the existing algorithm cannot independently predict multiview embeddings for a new sample, and (2) different people may prefer different views. In this study, we propose an end-to-end inductive deep learning framework to solve the multiview representation learning problem. The results show that our proposed method can obtain multiview embeddings of any object, in which each view corresponds to an independent attribute of the object. We collected two datasets from a crowdsourcing platform to experimentally investigate the performance of our proposed approach compared to conventional baseline methods.
HybridEval: A Human-AI Collaborative Approach for Evaluating Design Ideas at Scale.	Sepideh Mesbah, Ines Arous, Jie Yang, Alessandro Bozzon	www2023	Evaluating design ideas is necessary to predict their success and assess their impact early on in the process. Existing methods rely either on metrics computed by systems that are effective but subject to errors and bias, or experts’ ratings, which are accurate but expensive and long to collect. Crowdsourcing offers a compelling way to evaluate a large number of design ideas in a short amount of time while being cost-effective. Workers’ evaluation is, however, less reliable and might substantially differ from experts’ evaluation. In this work, we investigate workers’ rating behavior and compare it with experts. First, we instrument a crowdsourcing study where we asked workers to evaluate design ideas from three innovation challenges. We show that workers share similar insights with experts but tend to rate more generously and weigh certain criteria more importantly. Next, we develop a hybrid human-AI approach that combines a machine learning model with crowdsourcing to evaluate ideas. Our approach models workers’ reliability and bias while leveraging ideas’ textual content to train a machine learning model. It is able to incorporate experts’ ratings whenever available, to supervise the model training and infer worker performance. Results show that our framework outperforms baseline methods and requires significantly less training data from experts, thus providing a viable solution for evaluating ideas at scale.
Human-in-the-loop Regular Expression Extraction for Single Column Format Inconsistency.	Shaochen Yu, Lei Han, Marta Indulska, Shazia W. Sadiq, Gianluca Demartini	www2023	Format inconsistency is one of the most frequently appearing data quality issues encountered during data cleaning. Existing automated approaches commonly lack applicability and generalisability, while approaches with human inputs typically require specialized skills such as writing regular expressions. This paper proposes a novel hybrid human-machine system, namely “Data-Scanner-4C”, which leverages crowdsourcing to address syntactic format inconsistencies in a single column effectively. We first ask crowd workers to create examples from single-column data through “data selection” and “result validation” tasks. Then, we propose and use a novel rule-based learning algorithm to infer the regular expressions that propagate formats from created examples to the entire column. Our system integrates crowdsourcing and algorithmic format extraction techniques in a single workflow. Having human experts write regular expressions is no longer required, thereby reducing both the time as well as the opportunity for error. We conducted experiments through both synthetic and real-world datasets, and our results show how the proposed approach is applicable and effective across data types and formats.
Cross-center Early Sepsis Recognition by Medical Knowledge Guided Collaborative Learning for Data-scarce Hospitals.	Ruiqing Ding, Fangjie Rong, Xiao Han, Leye Wang	www2023	There are significant regional inequities in health resources around the world. It has become one of the most focused topics to improve health services for data-scarce hospitals and promote health equity through knowledge sharing among medical institutions. Because electronic medical records (EMRs) contain sensitive personal information, privacy protection is unavoidable and essential for multi-hospital collaboration. In this paper, for a common disease in ICU patients, sepsis, we propose a novel cross-center collaborative learning framework guided by medical knowledge, SofaNet, to achieve early recognition of this disease. The Sepsis-3 guideline, published in 2016, defines that sepsis can be diagnosed by satisfying both suspicion of infection and Sequential Organ Failure Assessment (SOFA) greater than or equal to 2. Based on this knowledge, SofaNet adopts a multi-channel GRU structure to predict SOFA values of different systems, which can be seen as an auxiliary task to generate better health status representations for sepsis recognition. Moreover, we only achieve feature distribution alignment in the hidden space during cross-center collaborative learning, which ensures secure and compliant knowledge transfer without raw data exchange. Extensive experiments on two open clinical datasets, MIMIC-III and Challenge, demonstrate that SofaNet can benefit early sepsis recognition when hospitals only have limited EMRs.
CollabEquality: A Crowd-AI Collaborative Learning Framework to Address Class-wise Inequality in Web-based Disaster Response.	Yang Zhang, Lanyu Shang, Ruohan Zong, Huimin Zeng, Zhenrui Yue, Dong Wang	www2023	Web-based disaster response (WebDR) is emerging as a pervasive approach to acquire real-time situation awareness of disaster events by collecting timely observations from the Web (e.g., social media). This paper studies a class-wise inequality problem in WebDR applications where the objective is to address the limitation of current WebDR solutions that often have imbalanced classification performance across different classes. To address such a limitation, this paper explores the collaborative strengths of the diversified yet complementary biases of AI and crowdsourced human intelligence to ensure a more balanced and accurate performance for WebDR applications. However, two critical challenges exist: 1) it is difficult to identify the imbalanced AI results without knowing the ground-truth WebDR labels a priori; ii) it is non-trivial to address the class-wise inequality problem using potentially imperfect crowd labels. To address the above challenges, we develop CollabEquality, an inequality-aware crowd-AI collaborative learning framework that carefully models the inequality bias of both AI and human intelligence from crowdsourcing systems into a principled learning framework. Extensive experiments on two real-world WebDR applications demonstrate that CollabEquality consistently outperforms the state-of-the-art baselines by significantly reducing class-wise inequality while improving the WebDR classification accuracy.
The Community Notes Observatory: Can Crowdsourced Fact-Checking be Trusted in Practice?	Luca Righes, Mohammed Saeed, Gianluca Demartini, Paolo Papotti	www2023c	Fact-checking is an important tool in fighting online misinformation. However, it requires expert human resources, and thus does not scale well on social media because of the flow of new content. Crowdsourcing has been proposed to tackle this challenge, as it can scale with a smaller cost, but it has always been studied in controlled environments. In this demo, we present the Community Notes Observatory, an online system to evaluate the first large-scale effort of crowdsourced fact-checking deployed in practice. We let demo attendees search and analyze tweets that are fact-checked by Community Notes users and compare the crowd’s activity against professional fact-checkers. The attendees will explore evidence of i) differences in how the crowd and experts select content to be checked, ii) how the crowd and the experts retrieve different resources to fact-check, and iii) the edge the crowd shows in fact-checking scalability and efficiency as compared to expert checkers.
Task Adaptive Multi-learner Network for Joint CTR and CVR Estimation.	Xiaofan Liu, Qinglin Jia, Chuhan Wu, Jingjie Li, Quanyu Dai, Lin Bo, Rui Zhang, Ruiming Tang	www2023c	CTR and CVR are critical factors in personalized applications, and many methods jointly estimate them via multi-task learning to alleviate the ultra-sparsity of conversion behaviors. However, it is still difficult to predict CVR accurately and robustly due to the limited and even biased knowledge extracted by the single model tower optimized on insufficient conversion samples. In this paper, we propose a task adaptive multi-learner (TAML) framework for joint CTR and CVR prediction. We design a hierarchical task adaptive knowledge representation module with different experts to capture knowledge in different granularities, which can effectively exploit the commonalities between CTR and CVR estimation tasks meanwhile keeping their unique characteristics. We apply multiple learners to extract data knowledge from various views and fuse their predictions to obtain accurate and robust scores. To facilitate knowledge sharing across learners, we further perform self-distillation that uses the fused scores to teach different learners. Thorough offline and online experiments show the superiority of TAML in different Ad ranking tasks, and we have deployed it in Huawei’s online advertising platform to serve the main traffic.
NLP4KGC: Natural Language Processing for Knowledge Graph Construction.	Edlira Vakaj, Sanju Tiwari, Nandana Mihindukulasooriya, Fernando Ortiz-Rodríguez, Ryan McGranaghan	www2023c	Welcome to the 1st NLP4KGC: Natural Language Processing for Knowledge Graph Construction Workshop! This event brings together experts and enthusiasts from both natural language processing (NLP) and knowledge graph (KG) creation felds. The main goal of this workshop is to foster collaboration and knowledge sharing among researchers, developers, and practitioners working on the cutting edge of NLP and KG creation.
The Age of Snippet Programming: Toward Understanding Developer Communities in Stack Overflow and Reddit.	Alessia Antelmi, Gennaro Cordasco, Daniele De Vinco, Carmine Spagnuolo	www2023c	Today, coding skills are among the most required competencies worldwide, often also for non-computer scientists. Because of this trend, community contribution-based, question-and-answer (Q&A) platforms became prominent for finding the proper solution to all programming issues. Stack Overflow has been the most popular platform for technical-related questions for years. Still, recently, some programming-related subreddits of Reddit have become a standing stone for questions and discussions. This work investigates the developers’ behavior and community formation around the twenty most popular programming languages. We examined two consecutive years of programming-related questions from Stack Overflow and Reddit, performing a longitudinal study on users’ posting activity and their high-order interaction patterns abstracted via hypergraphs. Our analysis highlighted crucial differences in how these Q&A platforms are utilized by their users. In line with previous literature, it emphasized the constant decline of Stack Overflow in favor of more community-friendly platforms, such as Reddit, which has been growing rapidly lately.
Preferences on a Budget: Prioritizing Document Pairs when Crowdsourcing Relevance Judgments.	Kevin Roitero, Alessandro Checco, Stefano Mizzaro, Gianluca Demartini	www2022	In Information Retrieval (IR) evaluation, preference judgments are collected by presenting to the assessors a pair of documents and asking them to select which of the two, if any, is the most relevant. This is an alternative to the classic relevance judgment approach, in which human assessors judge the relevance of a single document on a scale; such an alternative allows to make relative rather than absolute judgments of relevance. While preference judgments are easier for human assessors to perform, the number of possible document pairs to be judged is usually so high that it makes it unfeasible to judge them all. Thus, following a similar idea to pooling strategies for single document relevance judgments where the goal is to sample the most useful documents to be judged, in this work we focus on analyzing alternative ways to sample document pairs to judge, in order to maximize the value of a fixed number of preference judgments that can feasibly be collected. Such value is defined as how well we can evaluate IR systems given a budget, that is, a fixed number of human preference judgments that may be collected. By relying on several datasets featuring relevance judgments gathered by means of experts and crowdsourcing, we experimentally compare alternative strategies to select document pairs and show how different strategies lead to different IR evaluation result quality levels. Our results show that, by using the appropriate procedure, it is possible to achieve good IR evaluation results with a limited number of preference judgments, thus confirming the feasibility of using preference judgments to create IR evaluation collections.
Can Machine Translation be a Reasonable Alternative for Multilingual Question Answering Systems over Knowledge Graphs?	Aleksandr Perevalov, Andreas Both, Dennis Diefenbach, Axel-Cyrille Ngonga Ngomo	www2022	Providing access to information is the main and most important purpose of the Web. However, despite available easy-to-use tools (e.g., search engines, chatbots, question answering) the accessibility is typically limited by the capability of using the English language. This excludes a huge amount of people. In this work, we discuss Knowledge Graph Question Answering (KGQA) systems that aim at providing natural language access to data stored in Knowledge Graphs (KG). While several KGQA systems have been proposed, only very few have dealt with a language other than English. In this work, we follow our research agenda of enabling speakers of any language to access the knowledge stored in KGs. Because of the lack of native support for many languages, we use machine translation (MT) tools to evaluate KGQA systems regarding questions in languages that are unsupported by a KGQA system. In total, our evaluation is based on 8 different languages (including some that never were evaluated before). For the intensive evaluation, we extend the QALD-9 dataset for KGQA with Wikidata queries and high-quality translations. The extension was done in a crowdsourcing manner by native speakers of the different languages. By using multiple KGQA systems for the evaluation, we were enabled to investigate and answer the main research question: “Can MT be an alternative for multilingual KGQA systems?”. The evaluation results demonstrated that the monolingual KGQA systems can be effectively ported to the new languages with MT tools.
The Influences of Task Design on Crowdsourced Judgement: A Case Study of Recidivism Risk Evaluation.	Xiaoni Duan, Chien-Ju Ho, Ming Yin	www2022	Crowdsourcing is widely used to solicit judgement from people in diverse applications ranging from evaluating information quality to rating gig worker performance. To encourage the crowd to put in genuine effort in the judgement tasks, various ways to structure and organize these tasks have been explored, though the understandings of how these task design choices influence the crowd’s judgement are still largely lacking. In this paper, using recidivism risk evaluation as an example, we conduct a randomized experiment to examine the effects of two common designs of crowdsourcing judgement tasks—encouraging the crowd to deliberate and providing feedback to the crowd—on the quality, strictness, and fairness of the crowd’s recidivism risk judgements. Our results show that different designs of the judgement tasks significantly affect the strictness of the crowd’s judgements. Moreover, task designs also have the potential to significantly influence how fairly the crowd judges defendants from different racial groups, on those cases where the crowd exhibits substantial in-group bias. Finally, we find that the impacts of task designs on the judgement also vary with the crowd workers’ own characteristics, such as their cognitive reflection levels. Together, these results highlight the importance of obtaining a nuanced understanding on the relationship between task designs and properties of the crowdsourced judgements.
Ready Player One! Eliciting Diverse Knowledge Using A Configurable Game.	Agathe Balayn, Gaole He, Andrea Hu, Jie Yang, Ujwal Gadiraju	www2022	Access to commonsense knowledge is receiving renewed interest for developing neuro-symbolic AI systems, or debugging deep learning models. Little is currently understood about the types of knowledge that can be gathered using existing knowledge elicitation methods. Moreover, these methods fall short of meeting the evolving requirements of several downstream AI tasks. To this end, collecting broad and tacit knowledge, in addition to negative or discriminative knowledge can be highly useful. Addressing this research gap, we developed a novel game with a purpose, ‘FindItOut’, to elicit different types of knowledge from human players through easily configurable game mechanics. We recruited 125 players from a crowdsourcing platform, who played 2430 rounds, resulting in the creation of more than 150k tuples of knowledge. Through an extensive evaluation of these tuples, we show that FindItOut can successfully result in the creation of plural knowledge with a good player experience. We evaluate the efficiency of the game (over 10 × higher than a reference baseline) and the usefulness of the resulting knowledge, through the lens of two downstream tasks — commonsense question answering and the identification of discriminative attributes. Finally, we present a rigorous qualitative analysis of the tuples’ characteristics, that informs the future use of FindItOut across various researcher and practitioner communities.
