"SRA: Secure Reverse Auction for Task Assignment in Spatial Crowdsourcing","M. Xiao; K. Ma; A. Liu; H. Zhao; Z. Li; K. Zheng; X. Zhou","School of Computer Science and Technology/Suzhou Institute for Advanced Study, University of Science and Technology of China, Hefei, China; School of Computer Science and Technology/Suzhou Institute for Advanced Study, University of Science and Technology of China, Hefei, China; Department of Computer Science and Technology, Soochow University, Suzhou, China; School of Computer Science and Technology/Suzhou Institute for Advanced Study, University of Science and Technology of China, Hefei, China; Department of Computer Science and Technology, Soochow University, Suzhou, China; Big Data Research Center, University of Electronic Science and Technology of China, Chengdu, China; School of Information Technology and Electrical Engineering, The University of Queensland, Brisbane, Australia",IEEE Transactions on Knowledge and Data Engineering,"6 Mar 2020","2020","32","4","782","796","In this paper, we study a new type of spatial crowdsourcing, namely competitive detour tasking, where workers can make detours from their original travel paths to perform multiple tasks, and each worker is allowed to compete for preferred tasks by strategically claiming his/her detour costs. The objective is to make suitable task assignment by maximizing the social welfare of crowdsourcing systems and protecting workers' private sensitive information. We first model the task assignment problem as a reverse auction process. We formalize the winning bid selection of reverse auction as an n-to-one weighted bipartite graph matching problem with multiple 0-1 knapsack constraints. Since this problem is NP-hard, we design an approximation algorithm to select winning bids and determine corresponding payments. Based on this, a Secure Reverse Auction (SRA) protocol is proposed for this novel spatial crowdsourcing. We analyze the approximation performance of the proposed protocol and prove that it has some desired properties, including truthfulness, individual rationality, computational efficiency, and security. To the best of our knowledge, this is the first theoretically provable secure auction protocol for spatial crowdsourcing systems. In addition, we also conduct extensive simulations on a real trace to verify the performance of the proposed protocol.","1558-2191","","10.1109/TKDE.2019.2893240","National Natural Science Foundation of China(grant numbers:61872330,61572336,61572457,61632016,61379132,61532018,61836007,61832017,U1709217); Natural Science Foundation of Jiangsu Province(grant numbers:BK20131174,BK2009150); Natural Science Research of Jiangsu Higher Education Institutions of China(grant numbers:18KJA520010,17KJA520003); Anhui Initiative in Quantum Information Technologies(grant numbers:AHY150300); ","https://ieeexplore.ieee.org/stamp/stamp.jsp?arnumber=8613932","Privacy;reverse auction;spatial crowdsourcing;task assignment","Task analysis;Crowdsourcing;Protocols;Bipartite graph;Security;Approximation algorithms;Computer science","","54","","39","IEEE","16 Jan 2019","","","IEEE","IEEE Journals"
"Proxy-Free Privacy-Preserving Task Matching with Efficient Revocation in Crowdsourcing","J. Shu; K. Yang; X. Jia; X. Liu; C. Wang; R. H. Deng","Department of Computer Science, City University of Hong Kong, Kowloon Tong, Hong Kong, China; Department of Computer Science, University of Memphis, Memphis, TN, USA; Department of Computer Science, City University of Hong Kong, Kowloon Tong, Hong Kong, China; School of Information Systems, Singapore Management University, Singapore; Department of Computer Science, City University of Hong Kong, Kowloon Tong, Hong Kong, China; School of Information Systems, Singapore Management University, Singapore",IEEE Transactions on Dependable and Secure Computing,"7 Jan 2021","2021","18","1","117","130","Task matching in crowdsourcing has been extensively explored with the increasing popularity of crowdsourcing. However, privacy of tasks and workers is usually ignored in most of exiting solutions. In this paper, we study the problem of privacy-preserving task matching for crowdsourcing with multiple requesters and multiple workers. Instead of utilizing proxy re-encryption, we propose a proxy-free task matching scheme for multi-requester/multi-worker crowdsourcing, which achieves task-worker matching over encrypted data with scalability and non-interaction. We further design two different mechanisms for worker revocation including Server-Local Revocation (SLR) and Global Revocation (GR), which realize efficient worker revocation with minimal overhead on the whole system. The proposed scheme is provably secure in the random oracle model under the Decisional q-Combined Bilinear Diffie-Hellman (q-DCDBH) assumption. Comprehensive theoretical analysis and detailed simulation results show that the proposed scheme outperforms the state-of-the-art work.","1941-0018","","10.1109/TDSC.2018.2875682","Research Grants Council of Hong Kong(grant numbers:GRF CityU 11208917,CRF CityU C1008-16G); NSF China(grant numbers:61732022,61702105); ","https://ieeexplore.ieee.org/stamp/stamp.jsp?arnumber=8490721","Crowdsourcing;multi-requester/multi-worker;task matching;privacy;proxy-free;revocation","Task analysis;Crowdsourcing;Privacy;Encryption;Servers","","46","","46","IEEE","12 Oct 2018","","","IEEE","IEEE Journals"
"Vehicle-Based Bi-Objective Crowdsourcing","X. Zhang; Z. Yang; Y. Liu","School of Computer Science and Engineering, South China University of Technology, Guangzhou, China; Tsinghua National Laboratory for Information Science and Technology, Tsinghua University, Beijing, China; Tsinghua National Laboratory for Information Science and Technology, Tsinghua University, Beijing, China",IEEE Transactions on Intelligent Transportation Systems,"2 Oct 2018","2018","19","10","3420","3428","Mobile crowdsourcing is an emerging complex problem solving paradigm that makes use of pervasive mobile devices equipped with multi-functional sensors. Recently, vehicles have also been increasingly adopted for mobile crowdsourcing, as the vehicles, as well as drivers, can provide diverse sensing capability and predictable mobility. Existing mobile crowdsourcing algorithms mostly recruit workers to complete one kind of sensing tasks, i.e., location-based query tasks or automatic sensing tasks. In this paper, we investigate the possibility of recruiting a set of vehicles to simultaneously complete these two categories of tasks, so as to maximize the sensing utility of each participant. We first model the worker recruitment for vehicle-based crowdsourcing as a bi-objective optimization problem with respect to the sensing capability and predictable mobility of vehicles. The recruitment problem is proven to be NP-hard, and we design two heuristic algorithms based on the bi-objective greedy strategy and the multi-objective genetic algorithm to find the solutions. The experimental results with a real-world traffic trace data set show that the proposed algorithms outperform some existing algorithms in finding solutions that maximize both objectives.","1558-0016","","10.1109/TITS.2017.2766769","National Natural Science Foundation of China(grant numbers:61502178,61632013); Natural Science Foundation of Guangdong Province(grant numbers:2016A030313480); ","https://ieeexplore.ieee.org/stamp/stamp.jsp?arnumber=8265211","Mobile crowdsoucing;vehicle-based crowdsourcing;worker recruitment;task reliability;sensing coverage","Sensors;Crowdsourcing;Mobile communication;Recruitment;Trajectory;Mobile handsets","","44","","44","IEEE","22 Jan 2018","","","IEEE","IEEE Journals"
"FedCrowd: A Federated and Privacy-Preserving Crowdsourcing Platform on Blockchain","Y. Guo; H. Xie; Y. Miao; C. Wang; X. Jia","School of Artificial Intelligence, Beijing Normal University, Beijing, China; Department of Computer Science, City University of Hong Kong, Hong Kong; School of Cyber Engineering, Xidian University, Xi'an, China; Department of Computer Science, City University of Hong Kong, Hong Kong; Department of Computer Science, City University of Hong Kong, Hong Kong",IEEE Transactions on Services Computing,"5 Aug 2022","2022","15","4","2060","2073","Crowdsourcing has attracted widespread attention in recent years and developed into various applications. An indispensable service of crowdsourcing systems is task recommendation, which means tasks should be accurately recommended to the workers with aligned interests. However, existing systems rely on their separate servers to conduct recommendation services, resulting in computing resources locked inside each isolated system. Moreover, due to the wide attacking surfaces of traditional centralized servers setting, existing systems are subject to single points of failure or malicious data breaches. Therefore, failure to address these inherent limitations properly will hinder the wide adoption of crowdsourcing. In this article, we propose and implement FedCrowd, the first federated and privacy-preserving crowdsourcing platform by using blockchain technology. Our main idea is to employ the smart contract as a trusted platform for systems to release encrypted tasks, and carefully craft matching protocols to enable efficient task recommendations in the ciphertext domain. Our task-matching protocols are highly customized for the decentralized settings, where users can securely perform keyword and range-based queries over federated task indexes without sharing secret keys. We formally analyze the security strengths and complete the prototype implementation on Ethereum. Experiment results demonstrate the feasibility and usability of the FedCrowd platform.","1939-1374","","10.1109/TSC.2020.3031061","Fundamental Research Funds for the Central Universities; Research Grants Council of Hong Kong(grant numbers:CityU 11208917,CityU 11212717,CityU 11217819,CityU C1008-16G); Innovation and Technology Commission of Hong Kong(grant numbers:ITS/145/19); ","https://ieeexplore.ieee.org/stamp/stamp.jsp?arnumber=9224200","Crowdsourcing;privacy-preserving;decentralized application;searchable encryption;blockchain","Task analysis;Crowdsourcing;Blockchain;Smart contracts;Encryption","","43","","57","IEEE","14 Oct 2020","","","IEEE","IEEE Journals"
"SpatialRecruiter: Maximizing Sensing Coverage in Selecting Workers for Spatial Crowdsourcing","X. Zhang; Z. Yang; Y. -J. Gong; Y. Liu; S. Tang","School of Computer Science and Engineering, South China University of Technology, Guangzhou, China; School of Software and Tsinghua National Laboratory for Information Science and Technology, Tsinghua University, Beijing, China; School of Computer Science and Engineering, South China University of Technology, Guangzhou, China; School of Software and Tsinghua National Laboratory for Information Science and Technology, Tsinghua University, Beijing, China; School of Computer Science and Engineering, South China University of Technology, Guangzhou, China",IEEE Transactions on Vehicular Technology,"16 Jun 2017","2017","66","6","5229","5240","Spatial crowdsourcing and crowdsensing are two emerging crowdsourcing paradigms, which enable a variety of location-based query and sensing tasks. In spatial crowdsourcing, mobile workers are required to travel physically to target locations in order to complete query tasks. Most existing work, hence, has focused on designing efficient query task assignment schemes to maximize the task completion rate under traveling constraints of workers for spatial crowdsourcing systems. In crowdsensing, on the other hand, sensor recordings of workers' smartphones are of interest and have been collected to build various applications. Therefore, work concerning crowdsensing has strived to maximize the coverage area of sensor trajectories by selecting a set of workers. In this paper, we investigate the integration of these two paradigms. We notice a key link between these paradigms: While a worker is traveling to the target location of a query task, his trajectory may provide valuable coverage for a sensing task. Therefore, we propose a task management framework, named SpatialRecruiter, to efficiently match workers to the merged query and sensing tasks. We propose two coverage estimation functions to compute the coverage potential of a worker. Then, we design a greedy heuristic to select and assign workers. The experimental results on a real-world dataset demonstrate that the proposed strategies are efficient and effective in meeting the requirements of both paradigms.","1939-9359","","10.1109/TVT.2016.2614312","National Natural Science Foundation of China(grant numbers:61502178,61502542,61632013); Natural Science Foundation of Guangdong Province(grant numbers:2016A030313480); China Postdoctoral Science Foundation(grant numbers:2015M572318); ","https://ieeexplore.ieee.org/stamp/stamp.jsp?arnumber=7579233","Coverage maximization;crowdsensing;spatial crowdsourcing;task assignment","Sensors;Crowdsourcing;Mobile communication;Smart phones;Trajectory;Estimation","","42","","43","IEEE","28 Sep 2016","","","IEEE","IEEE Journals"
"Crowdsourcing Sensing to Smartphones: A Randomized Auction Approach","J. Li; Y. Zhu; Y. Hua; J. Yu","Shanghai Key Laboratory of Scalable Computing and Systems, Shanghai, China; Shanghai Key Laboratory of Scalable Computing and Systems, Shanghai, China; Shanghai Key Laboratory of Scalable Computing and Systems, Shanghai, China; Shanghai Key Laboratory of Scalable Computing and Systems, Shanghai, China",IEEE Transactions on Mobile Computing,"30 Aug 2017","2017","16","10","2764","2777","Crowdsourcing to mobile users has emerged as a compelling paradigm for collecting sensing data over a vast area for various monitoring applications. It is of paramount importance for such crowdsourcing paradigm to provide effective incentive mechanisms. State-of-the-art auction mechanisms for crowdsourcing to mobile users are typically deterministic in the sense that for a given sensing job from a crowdsourcer, only a small set of smartphones are selected to perform sensing tasks and the rest are not selected. One apparent disadvantage of such deterministic auction mechanisms is that the diversity with respect to the sensing job is reduced. As a consequence, the quality of the collected sensing data is also decreased. This is due to failure to exploit the intrinsic advantage of the large set of diverse mobile users in a mobile crowdsourcing network. In this paper, we propose a randomized combinatorial auction mechanism for the social cost minimization problem, which is proven to be NP-hard. We design an approximate task allocation algorithm that is near optimal with polynomial-time complexity and use it as a building block to construct the whole randomized auction mechanism. Compared with deterministic auction mechanisms, the proposed randomized auction mechanism increases the diversity in contributing users for a given sensing job. We carry out both solid theoretical analysis and extensive numerical studies and show that our randomized auction mechanism achieves approximate truthfulness, individual rationality, and high computational efficiency.","1558-0660","","10.1109/TMC.2017.2653774","973 Program(grant numbers:2014CB340303); 863 Program(grant numbers:2015AA015303); NSFC(grant numbers:61472254,61170238,61420106010); STCSM(grant numbers:14511107500,15DZ1100305); Young Faculty in Shenzhen Polytechnic(grant numbers:601522K30015); SZSTI(grant numbers:JCYJ20160407160609492); NRF(grant numbers:CREATE E2S2); New Century Excellent Talents in University of China; Changjiang Young Scholars in University of China; Shanghai Top Young Talents; ","https://ieeexplore.ieee.org/stamp/stamp.jsp?arnumber=7819511","Mobile crowdsourcing;incentive mechanism;randomized auction;diversity;quality;truthfulness;rational;social cost","Mobile communication;Sensors;Crowdsourcing;Resource management;Smart phones;Noise level;Mobile computing","","39","","45","IEEE","16 Jan 2017","","","IEEE","IEEE Journals"
"Group-Oriented Task Allocation for Crowdsourcing in Social Networks","J. Jiang; B. An; Y. Jiang; C. Zhang; Z. Bu; J. Cao","Jiangsu Provincial Key Laboratory of E-Business, College of Information Engineering, Nanjing University of Finance and Economics, Nanjing, China; School of Computer Science and Engineering, Nanyang Technological University, Singapore; School of Computer Science and Engineering, Southeast University, Nanjing, China; School of Computer Science and Engineering, Southeast University, Nanjing, China; Jiangsu Provincial Key Laboratory of E-Business, College of Information Engineering, Nanjing University of Finance and Economics, Nanjing, China; Jiangsu Provincial Key Laboratory of E-Business, College of Information Engineering, Nanjing University of Finance and Economics, Nanjing, China","IEEE Transactions on Systems, Man, and Cybernetics: Systems","15 Jun 2021","2021","51","7","4417","4432","Previous crowdsourcing studies often adopted the individual-oriented approach that outsources a task to an individual worker or team formation-based approach that outsources a task to an artificially formed team of workers. Nowadays, workers are often naturally organized into groups through social networks. To address such common issue of grouped workers in real crowdsourcing systems, this article explores a novel crowdsourcing paradigm in which the task allocation targets are naturally existing worker groups but not individual workers or artificially formed teams as before. Because a natural group might not possess all required skills and needs to coordinate with other groups in the social network contexts for performing a complex task, a concept of contextual crowdsourcing value is presented to measure a group's capacity to complete a task by coordinating with its contextual groups, which determines the priority that the group is assigned the task; then, the task allocation algorithms, including the allocations of groups and the workers actually participating in executing the task, are designed. The experiments on a real-world dataset show that our presented group-oriented approach can nearly always achieve better synergy performance, consistency performance, conflict performance, adaptability, and effectiveness on reducing costs, as compared with previous benchmark individual-oriented and team formation approaches.","2168-2232","","10.1109/TSMC.2019.2933327","National Natural Science Foundation of China(grant numbers:61932007,61472079,61806053,61807008); Natural Science Foundation of Jiangsu Province of China(grant numbers:BK20171363,BK20180356,BK20180369); ","https://ieeexplore.ieee.org/stamp/stamp.jsp?arnumber=8818337","Context-aware;crowdsourcing;group;social networks;task allocation","Task analysis;Crowdsourcing;Resource management;Social networking (online);Benchmark testing;Computer science;Coordinate measuring machines","","38","","41","IEEE","28 Aug 2019","","","IEEE","IEEE Journals"
"Privacy Protection Scheme Based on CP-ABE in Crowdsourcing-IoT for Smart Ocean","Y. Yu; L. Guo; S. Liu; J. Zheng; H. Wang","School of Computer Science and Engineering, Northeastern University, Shenyang, China; School of Communication and Information Engineering, Chongqing University of Posts and Telecommunications, Chongqing, China; School of Computer Science and Engineering, Northeastern University, Shenyang, China; School of Computer Science and Engineering, Northeastern University, Shenyang, China; School of Computer Science and Engineering, Northeastern University, Shenyang, China",IEEE Internet of Things Journal,"9 Oct 2020","2020","7","10","10061","10071","Crowdsourcing is a novel distributed problem-solving mechanism that can provide the collection and share of marine data in the Internet of Things for the smart ocean. Nevertheless, the privacy leakage issue caused by multirole information interaction in crowdsourcing brings a serious challenge to the smart ocean. In this article, we propose a crowdsourcing privacy protection scheme based on multiauthority ciphertext-policy attribute-based encryption to enhance privacy protection in the data sharing environment. In this scheme, we design an independent key component distribution approach through multiple authorities, which could effectively disperse the security responsibility from the crowdsourcing platform. Then, we present the idea of partial decryption on the platform to reduce the computing cost of mobile users and prevent the platform from snooping on users' data. Moreover, we put forward an efficient attribute revocation mechanism and a task search function in the scheme to achieve dynamic on-demand services while ensuring the forward and backward security of tasks. Theoretical analysis proves the correctness of both decryption and keywords matching, and the security of each involved entity. The simulation results show that our proposed scheme achieves a significant improvement in reducing time consumption compared with several related schemes.","2327-4662","","10.1109/JIOT.2020.2989476","National Key Research and Development Program of China(grant numbers:2018YFE0206800); National Natural Science Foundation of China(grant numbers:61941113); Fundamental Research Funds for the Central Universities(grant numbers:N181613003); Visiting Scholar Program of China Scholarship Council(grant numbers:201906085031); ","https://ieeexplore.ieee.org/stamp/stamp.jsp?arnumber=9076303","Ciphertext-policy attribute-based encryption (CP-ABE);crowdsourcing;Internet of Things (IoT) for smart ocean;multiple attribute authorities;privacy protection","Crowdsourcing;Task analysis;Oceans;Privacy;Encryption;Data privacy;Internet of Things","","38","","22","IEEE","22 Apr 2020","","","IEEE","IEEE Journals"
"ABCrowd An Auction Mechanism on Blockchain for Spatial Crowdsourcing","M. Kadadha; R. Mizouni; S. Singh; H. Otrok; A. Ouali","Electrical and Computer Engineering Department, Khalifa University of Science and Technology, Abu Dhabi, United Arab Emirates; Electrical and Computer Engineering Department, Khalifa University of Science and Technology, Abu Dhabi, United Arab Emirates; Electrical and Computer Engineering Department, Khalifa University of Science and Technology, Abu Dhabi, United Arab Emirates; Electrical and Computer Engineering Department, Khalifa University of Science and Technology, Abu Dhabi, United Arab Emirates; Emirates ICT Innovation Center (EBTIC), Abu Dhabi, United Arab Emirates",IEEE Access,"22 Jan 2020","2020","8","","12745","12757","In this paper, a fully distributed auction-blockchain-based crowdsourcing framework is proposed-ABCrowd. In a typical crowdsourcing framework, independent workers compete to be allocated requesters' tasks. These workers advertise their costs to the centralized platform, which then decides the final allocation of tasks. While performing the allocation, centralized platforms face two main challenges: 1) how to ensure trusted execution for the allocation of tasks, and 2) how to motivate workers to declare their truthful costs. To address these challenges, ABCrowd proposes to run the crowdsourcing platform entirely on Ethereum Blockchain while incorporating auctions. Blockchain and smart contracts guarantee trusted execution for the allocation through autonomous and transparent on-Chain execution. ABCrowd uses the Repeated-Single-Minded Bidder (R-SMB) auction mechanism, which motivates workers to bid truthfully before allocating them and calculating their payments. R-SMB is an approximation of the optimized off-Chain Vickrey-Clarke-Groves (VCG) mechanism in terms of maximized profit. It entails repeating the Single-Minded Bidder (SMB) auction mechanism to meet the allocation requirement of crowdsourcing applications. ABCrowd is implemented and evaluated using Solidity on a private Ethereum Blockchain, where a real publicly available dataset is used. The proposed on-Chain R-SMB auction mechanism is compared to the off-Chain VCG mechanism, where the results show that R-SMB provides similar performance to VCG in terms of the average number of allocated tasks. Furthermore, R-SMB outperforms VCG in workers' travelled distance and requesters' costs, at a low execution cost.","2169-3536","","10.1109/ACCESS.2020.2965897","Khalifa University of Science, Technology and Research(grant numbers:8474000012); ","https://ieeexplore.ieee.org/stamp/stamp.jsp?arnumber=8955886","Crowdsourcing;blockchain;smart contracts;auction","Blockchain;Task analysis;Resource management;Smart contracts;Privacy;Crowdsensing","","37","","31","CCBY","10 Jan 2020","","","IEEE","IEEE Journals"
