"FROG: A Fast and Reliable Crowdsourcing Framework","P. Cheng; X. Lian; X. Jian; L. Chen","Department of Computer Science and Engineering, Hong Kong University of Science and Technology, Kowloon, Hong Kong, China; Department of Computer Science, Kent State University, Kent, OH, USA; Department of Computer Science and Engineering, Hong Kong University of Science and Technology, Kowloon, Hong Kong, China; Department of Computer Science and Engineering, Hong Kong University of Science and Technology, Kowloon, Hong Kong, China",IEEE Transactions on Knowledge and Data Engineering,"2 Apr 2019","2019","31","5","894","908","For decades, the crowdsourcing has gained much attention from both academia and industry, which outsources a number of tasks to human workers. Typically, existing crowdsourcing platforms include CrowdFlower, Amazon Mechanical Turk (AMT), and so on, in which workers can autonomously select tasks to do. However, due to the unreliability of workers or the difficulties of tasks, workers may sometimes finish doing tasks either with incorrect/incomplete answers or with significant time delays. Existing studies considered improving the task accuracy through voting or learning methods, they usually did not fully take into account reducing the latency of the task completion. This is especially critical, when a task requester posts a group of tasks (e.g., sentiment analysis), and one can only obtain answers of all tasks after the last task is accomplished. As a consequence, the time delay of even one task in this group could delay the next step of the task requester’s work from minutes to days, which is quite undesirable for the task requester. Inspired by the importance of the task accuracy and latency, in this paper, we will propose a novel crowdsourcing framework, namely Fast and Reliable crOwdsourcinG framework (FROG), which intelligently assigns tasks to workers, such that the latencies of tasks are reduced and the expected accuracies of tasks are met. Specifically, our FROG framework consists of two important components, task scheduler and notification modules. For the task scheduler module, we formalize a FROG task scheduling (FROG-TS) problem, in which the server actively assigns workers to tasks to achieve high task reliability and low task latency. We prove that the FROG-TS problem is NP-hard. Thus, we design two heuristic approaches, request-based and batch-based scheduling. For the notification module, we define an efficient worker notifying (EWN) problem, which only sends task invitations to those workers with high probabilities of accepting the tasks. To tackle the EWN problem, we propose a smooth kernel density estimation approach to estimate the probability that a worker accepts the task invitation. Through extensive experiments, we demonstrate the effectiveness and efficiency of our proposed FROG platform on both real and synthetic data sets.","1558-2191","","10.1109/TKDE.2018.2849394","Hong Kong RGC(grant numbers:16207617); Science and Technology Planning Project of Guangdong Province, China(grant numbers:2015B010110006); NSFC(grant numbers:61729201,61232018); Microsoft Research Asia Collaborative Grant, and NSFC Guang Dong(grant numbers:U1301253,HKUST SSTSP FP305); Lian Start Up(grant numbers:220981); Kent State University; ","https://ieeexplore.ieee.org/stamp/stamp.jsp?arnumber=8392362","Crowdsourcing framework;scheduling algorithm;greedy algorithm;EM algorithm","Greedy algorithms;Crowdsourcing;Scheduling algorithms;Expectation-maximization algorithms","","15","","46","IEEE","21 Jun 2018","","","IEEE","IEEE Journals"
"Crowdsourcing, Mixed Elastic Systems and Human-Enhanced Computing–A Survey","J. Jarrett; M. B. Blake; I. Saleh","School of Computing and IT, University of Technology, Jamaica; Drexel University, PA; Intel Corporation, Santa Clara, CA",IEEE Transactions on Services Computing,"5 Feb 2018","2018","11","1","202","214","State-of-the-art practices have recognized the utility of leveraging human intervention as a crucial aspect of modern computing systems. The emerging crowdsourcing paradigm is based on harnessing human intelligence, effort and rational behaviors to augment computation and analysis. In addition to the crowdsourcing paradigm, new techniques have emerged that incorporate machine and human computational resources together forming a hybrid intelligence when addressing complex problems and tasks. This combined technique is particularly impactful if human and machine contributions can scale automatically in response to their respective efficiency and effectiveness when addressing subsets of a bigger problem - an approach that we have named mixed elastic systems. In this survey, we highlight state-of-the-art projects that investigate crowdsourcing, hybrid intelligence systems and mixed elastic systems. We also present a taxonomy and classification of the broader domain of human-enhanced computing systems as it assimilates crowdsourcing, hybrid intelligence, and mixed elastic systems.","1939-1374","","10.1109/TSC.2017.2674662","","https://ieeexplore.ieee.org/stamp/stamp.jsp?arnumber=7864475","Computer-supported cooperative work;human-centered computing;human factors;workflow management","Crowdsourcing;Computational modeling;Outsourcing;Organizations;Electronic mail;Production","","15","","61","IEEE","24 Feb 2017","","","IEEE","IEEE Journals"
"Two-Stage Bilateral Online Priority Assignment in Spatio-Temporal Crowdsourcing","Q. Zhang; Y. Wang; G. Yin; X. Tong; A. M. V. V. Sai; Z. Cai","School of Computer Science and Engineering, Southeast University, Nanjing, Jiangsu, China; School of Computer and Control Engineering, Yantai University, Yantai, Shandong, China; College of Computer Science and Technology, Harbin Engineering University, Harbin, Heilongjiang, China; School of Computer and Control Engineering, Yantai University, Yantai, Shandong, China; Department of Computer Science, Georgia State University, Atlanta, GA, USA; Department of Computer Science, Georgia State University, Atlanta, GA, USA",IEEE Transactions on Services Computing,"13 Jun 2023","2023","16","3","2267","2282","With the advent of intelligent technology, the users of spatio-temporal crowdsourcing and their participation in the crowdsourcing tasks continue to increase exponentially. This poses new challenges to the crowdsourcing field. One of the core research areas of spatio-temporal crowdsourcing is task assignment. Most of the existing research on task assignment is focused on offline optimal task assignment, where, the platform has already learned all the information about workers and tasks beforehand. However, these studies cannot obtain good results in real-world situations. At the same time, online task assignment problems often result in local optimal assignment. To solve these problems, more attention needs to be paid to online task assignments and the arrival time of workers. This paper proposes an Online Bilateral Assignment (OBA) problem based on the online assignment model. The competitive ratio of the Greedy algorithm is analyzed according to the OBA problem model. Also, another solution to the OBA problem according to the Greedy algorithm, the Improved-Baseline algorithm, is proposed. Additionally, a Bilateral Online Priority Reassignment algorithm (BOPR) is proposed. The BOPR algorithm realizes real-time task/worker assignment through the bilateral assignment as a solution for online task assignment. In order to guarantee the number of matching tasks, a priority queue is designed in the BOPR algorithm. Considering the waiting time deadlines of tasks and workers and the error rate for priority ranking, it avoids tasks and workers waiting too long and assigns each task to the best possible extent. On this basis, a two-stage assignment strategy is designed for unsuccessful tasks, which could minimize the error rate of the task and significantly improve the efficiency of task assignment. Finally, through experiments on real data sets, the algorithm's performance in terms of global utility value and the number of matches is evaluated.","1939-1374","","10.1109/TSC.2022.3197676","National Natural Science Foundation of China(grant numbers:62073201,62072392,62172351); Youth Innovation Science and Technology Support Program of Shandong Provincial(grant numbers:2021KJ080); Shandong Natural Science Foundation(grant numbers:ZR2020KF019); Major scientific and technological innovation projects of Shandong Province(grant numbers:2019JZZY020131); Yantai Science and Technology Innovation Development Plan(grant numbers:2021YT06000645); Beijing University of Posts and Telecommunications(grant numbers:SKLNST-2022-1-12); ","https://ieeexplore.ieee.org/stamp/stamp.jsp?arnumber=9854201","Spatio-temporal crowdsourcing;online bilateral assignment;priority queue;bilateral online reassignment;two-stage task assignment","Task analysis;Crowdsourcing;Optimization;Technological innovation;Heuristic algorithms;Data models;Computer science","","14","","50","IEEE","10 Aug 2022","","","IEEE","IEEE Journals"
"Cost-Effective and Latency-Minimized Data Placement Strategy for Spatial Crowdsourcing in Multi-Cloud Environment","P. Wang; Z. Chen; M. Zhou; Z. Zhang; A. Abusorrah; A. C. Ammari","School of Computer Science and Technology, Donghua University, Shanghai, China; School of Computer Science and Technology, Donghua University, Shanghai, China; Department of Electrical and Computer Engineering, New Jersey Institute of Technology, Newark, NJ, USA; School of Computer Science and Technology, Donghua University, Shanghai, China; Department of Electrical and Computer Engineering, Faculty of Engineering, and K. A. CARE Energy Research and Innovation Center, Center of Research Excellence in Renewable Energy and Power Systems, King Abdulaziz University, Jeddah, Saudi Arabia; Department of Electrical and Computer Engineering, College of Engineering, Sultan Qaboos University, Al Khoud Muscat, Oman",IEEE Transactions on Cloud Computing,"7 Mar 2023","2023","11","1","868","878","As an increasingly mature business model, crowdsourcing, especially spatial crowdsourcing, has played an important role in data collection, disaster response, urban planning and other fields. However, the rapid growth of user scale and massive data collected inevitably brings serious challenges to computing and storage resources. The emergence of cloud computing provides an opportunity to handle such challenges. Its nearly unlimited resource provision capability can provide reliable services for different crowdsourcing applications. Nevertheless, considering the risks of privacy leakage and vendor lock-in using only a single cloud, as well as the additional restrictions caused by the wide geographical distribution of data and associations among workers, the use of multi-cloud seems to be a better choice. In this article, we define a problem to find an effective data placement scheme for spatial crowdsourcing in multi-cloud environment to achieve the cost-effectiveness and minimal latency. We take full account of the interval pricing strategy. Then we analyze the geographical distribution characteristics of data centers through a clustering algorithm, and propose an effective data initialization strategy. Finally, we use a genetic algorithm to further optimize the results. Through experiments on real-world data from cloud providers, the efficiency and effectiveness of our proposed method is verified. Compared with some existing algorithms, the proposed method can significantly reduce the system cost and latency, among which the cost reduction is up to 150 times and the latency reduction is up to twice.","2168-7161","","10.1109/TCC.2021.3119862","National Natural Science Foundation of China(grant numbers:61602109); DHU Distinguished Young Professor Program(grant numbers:LZB2019003); Shanghai Science and Technology Innovation Action Plan(grant numbers:19511101802); Fundamental Research Funds for the Central Universities; Deanship of Scientific Research; King Abdulaziz University(grant numbers:RG-60-135-42); Omantel-SQU(grant numbers:EG/SQU-OT/19/04); ","https://ieeexplore.ieee.org/stamp/stamp.jsp?arnumber=9573442","Spatial crowdsourcing;multi-cloud;data placement;interval pricing;density clustering","Crowdsourcing;Cloud computing;Data centers;Costs;Task analysis;Reliability;Memory","","14","","49","IEEE","14 Oct 2021","","","IEEE","IEEE Journals"
"Duration-Variable Participant Recruitment for Urban Crowdsourcing With Indeterministic Trajectories","M. Hu; Z. Zhong; Y. Niu; M. Ni","State Key Laboratory of Rail Traffic Control and Safety, Beijing Jiaotong University, Beijing, China; State Key Laboratory of Rail Traffic Control and Safety, Beijing Jiaotong University, Beijing, China; State Key Laboratory of Rail Traffic Control and Safety, Beijing Jiaotong University, Beijing, China; State Key Laboratory of Rail Traffic Control and Safety, Beijing Jiaotong University, Beijing, China",IEEE Transactions on Vehicular Technology,"10 Nov 2017","2017","66","11","10271","10282","For urban crowdsourcing applications, the data sensing tasks can be achieved by vehicles traveling on the roads, which can save the expenses on constructing dedicated infrastructures. In this paper, to efficiently handle the crowdsourcing recruitment problem, we propose to recruit participants with the duration-variable principle and prove that it performs better compared to the strategy that recruits vehicles for all required time periods. The duration-variable principle enables recruitment of vehicular sensing resources across different time epochs to maximize the crowdsourcing profits. To ensure the utilization of limited budget, we formulate the duration-variable participant recruitment (DPR) problem with the consideration of indeterministic trajectories to determine which vehicle subset is chosen and how many epochs are provided for each selected vehicle. Since the formulated problem is NP-hard, we propose a two-step DPR algorithm by maximizing the available sensing resource utilization efficiency in each recruitment round, which is shown to be near-optimal and has low computational complexity. Experiments on real traces show that the proposed DPR scheme exceeds three other solutions in providing higher spatial coverage for urban crowdsourcing applications.","1939-9359","","10.1109/TVT.2017.2718043","State Key Laboratory of Rail Traffic Control and Safety(grant numbers:RCS2016ZT012,RCS2017ZT009); National Nature Science Foundation of China(grant numbers:61401016); China Postdoctoral Science Foundation(grant numbers:2017M610040); Fundamental Research Funds; Central Universities(grant numbers:2016RC056); ","https://ieeexplore.ieee.org/stamp/stamp.jsp?arnumber=7954643","Crowdsourcing;duration-variable participant recruitment;indeterministic trajectories;limited budget","Recruitment;Crowdsourcing;Sensors;Trajectory;Roads;Algorithm design and analysis;Computational complexity","","13","","33","IEEE","21 Jun 2017","","","IEEE","IEEE Journals"
"Truthful Online Double Auctions for Mobile Crowdsourcing: An On-Demand Service Strategy","S. Liu; Y. Yu; L. Guo; P. L. Yeoh; Q. Ni; B. Vucetic; Y. Li","School of Computer Science and Engineering and the Key Laboratory of Intelligent Computing in Medical Image, Ministry of Education, Northeastern University, Shenyang, China; School of Computer Science and Engineering and the Key Laboratory of Intelligent Computing in Medical Image, Ministry of Education, Northeastern University, Shenyang, China; School of Communication and Information Engineering, Chongqing University of Posts and Telecommunications, Chongqing, China; School of Electrical and Information Engineering, The University of Sydney, Sydney, NSW, Australia; School of Computing and Communications and Data Science Institute, Lancaster University, Lancaster, U.K.; School of Electrical and Information Engineering, The University of Sydney, Sydney, NSW, Australia; School of Electrical and Information Engineering, The University of Sydney, Sydney, NSW, Australia",IEEE Internet of Things Journal,"24 Aug 2022","2022","9","17","16096","16112","Double auctions play a pivotal role in stimulating active participation of a large number of users comprising both task requesters and workers in mobile crowdsourcing. However, most existing studies have concentrated on designing offline two-sided auction mechanisms and supporting single-type tasks and fixed auction service models. Such works ignore the need of dynamic services and are unsuitable for large-scale crowdsourcing markets with extremely diverse demands (i.e., types and urgency degrees of tasks required by different requesters) and supplies (i.e., task skills and online durations of different workers). In this article, we consider a practical crowdsourcing application with an on-demand service strategy. Especially, we innovatively design three online service models, namely, online single-bid single-task (OSS), online single-bid multiple-task (OSM), and online multiple-bid multiple-task (OMM) models to accommodate diversified tasks and bidding demands for different users. Furthermore, to effectively allocate tasks and facilitate bidding, we propose a truthful online double auction mechanism for each service model based on the McAfee double auction. By doing so, each user can flexibly select auction service models and corresponding auction mechanisms according to their current interested tasks and online duration. To illustrate this, we present a three-demand example to explain the effectiveness of our on-demand service strategy in realistic crowdsourcing applications. Moreover, we theoretically prove that our mechanisms satisfy truthfulness, individual rationality, budget balance, and consumer sovereignty. Through extensive simulations, we show that our mechanisms can accommodate the various demands of different users and improve social utility, including platform utility and average user utility.","2327-4662","","10.1109/JIOT.2022.3151924","National Natural Science Foundation of China(grant numbers:62171113,61941113); Fundamental Research Funds for the Central Universities(grant numbers:N2116011,N2116003); U.K. EPSRC(grant numbers:EP/K011693/1); ","https://ieeexplore.ieee.org/stamp/stamp.jsp?arnumber=9714505","Mobile crowdsourcing;on-demand service;online double auction;truthful mechanism design","Task analysis;Crowdsourcing;Biological system modeling;Internet of Things;Resource management;Nickel;Data models","","13","","30","IEEE","16 Feb 2022","","","IEEE","IEEE Journals"
"BciNet: A Biased Contest-Based Crowdsourcing Incentive Mechanism Through Exploiting Social Networks","Y. Wang; W. Dai; Q. Jin; J. Ma","College of Telecommunications and Information Engineering, Nanjing University of Posts and Telecommunications, Nanjing, China; College of Telecommunications and Information Engineering, Nanjing University of Posts and Telecommunications, Nanjing, China; Department of Human Informatics and Cognitive Sciences, Faculty of Human Sciences, Waseda University, Tokorozawa, Japan; Digital Media Department, Faculty of Computer and Information Sciences, Tokyo, Japan","IEEE Transactions on Systems, Man, and Cybernetics: Systems","17 Jul 2020","2020","50","8","2926","2937","Crowdsourcing has proved to be a splendid tool to aggregate the knowledge from a pool of individuals in order to perform abundant microtasks efficiently. Recently, with the explosive growth of online social network, Word of Mouth (WoM)-based crowdsourcing systems have emerged, in which besides conducting the tasks by themselves, participants simultaneously recruit other individuals through exploiting their social networks to help solve crowdsourced tasks. This crowdsourcing paradigm can greatly facilitate to grow the pool of crowdworkers. However, there exist two conflicting challenges in designing an effective WoM-based incentive mechanism: 1) sybil attack and 2) heterogeneous effect of participants. That is, intuitively, incentivizing (usually compensating for) common-ability individuals will inevitably stimulate the behavior of sybil attack (i.e., some individuals create multiple sybils, and split the total efforts into those sybils to expect more compensation). This paper proposes a novel biased contest-based crowdsourcing incentive mechanism through exploiting social networks (BciNet), aiming to balance those two conflicting objectives. BciNet is composed of two phases. First, based on spreading activation model, an enhanced geometric virtual point dissemination mechanism is able to provide sybil-proof property and accommodate the realistic social network structure. Second, based on participants' virtual points, a biased contest gives more reward to less able participants. Through carefully calibrating the bias factor, simulation results based on the real dataset show that BciNet can greatly improve the amount of participants' effort levels, and actually be robust against the sybil attack. In brief, for a practical incentive mechanism, the methodology to address conflicting goals is to put rational individuals into dilemma: to be sybil or not to be, it is the problem, i.e., the potential gain from the sybils in the second phase may be offset by the loss in the first phase.","2168-2232","","10.1109/TSMC.2018.2837165","NSFC(grant numbers:61171092); Jiangsu Educational Bureau Project(grant numbers:14KJA510004); NUPTSFs(grant numbers:NY215177,NY217089); ","https://ieeexplore.ieee.org/stamp/stamp.jsp?arnumber=8370841","Biased contest;incentive mechanism;social network;sybil attack;word of mouth (WoM)","Social network services;Task analysis;Crowdsourcing;Mouth;Robustness;Cybernetics;Aggregates","","11","","22","IEEE","1 Jun 2018","","","IEEE","IEEE Journals"
"Multi-Attribute Crowdsourcing Task Assignment With Stability and Satisfactory","Y. Xing; L. Wang; Z. Li; Y. Zhan","School of Computer Science and Communication Engineering, Jiangsu University, Zhenjiang, China; School of Computer Science and Communication Engineering, Jiangsu University, Zhenjiang, China; School of Computer Science and Communication Engineering, Jiangsu University, Zhenjiang, China; School of Computer Science and Communication Engineering, Jiangsu University, Zhenjiang, China",IEEE Access,"24 Sep 2019","2019","7","","133351","133361","Recently, crowdsourcing applications for smart cities have become more and more popular due to its higher work efficiency and lower work costs. However, the reasonable task assignment is still one of the important challenges for crowdsourcing. The existing researches on crowdsourcing task assignment focus on the tradeoff between maximizing the utility of platforms and minimizing the cost of requesters, but they lack of the considerations of stability and satisfactory. In this paper, we propose an intelligent multi attributes crowdsourcing task assignment with stability and satisfactory, called TASS. TASS can exploit the multi attributes to solve the stability of the transaction, and adopt the game theory to maximize the satisfaction of both sides during the task assignment. Next, we theoretically prove that the task assignment mechanism is truthfulness, individual rationality, stable and satisfactory assignment, and budget-balanced. Finally, we evaluate the performances of TASS with the state-of-the-art task assignment works. The experimental results show that TASS is better than the state-of-the-art task assignment works in terms of truthfulness, individually rationality, stable and satisfactory assignment, and balanced budget.","2169-3536","","10.1109/ACCESS.2019.2941045","National Key Research and Development Project(grant numbers:2017YFB1400703); Jiangsu Province’s Graduate Research Innovation Project in 2012(grant numbers:CXZZ12_0690); China Postdoctoral Science Foundation(grant numbers:2019M651738); ","https://ieeexplore.ieee.org/stamp/stamp.jsp?arnumber=8834775","Crowdsourcing;smart city;task assignment;game theory;stable matching","Task analysis;Crowdsourcing;Smart cities;Stability criteria;Privacy;Security","","10","","38","CCBY","12 Sep 2019","","","IEEE","IEEE Journals"
