"K-Anonymity for Crowdsourcing Database","S. Wu; X. Wang; S. Wang; Z. Zhang; A. K. H. Tung","College of Computer Science, Zhejiang University, Hangzhou, P.R. China; School of Computing, National University of Singapore, Singapore; School of Computing, National University of Singapore, Singapore; Advanced Digital Sciences Center, Illinois at Singapore Pte. Ltd., Singapore; School of Computing, National University of Singapore, Singapore",IEEE Transactions on Knowledge and Data Engineering,"5 Aug 2014","2014","26","9","2207","2221","In crowdsourcing database, human operators are embedded into the database engine and collaborate with other conventional database operators to process the queries. Each human operator publishes small HITs (Human Intelligent Task) to the crowdsourcing platform, which consists of a set of database records and corresponding questions for human workers. The human workers complete the HITs and return the results to the crowdsourcing database for further processing. In practice, published records in HITs may contain sensitive attributes, probably causing privacy leakage so that malicious workers could link them with other public databases to reveal individual private information. Conventional privacy protection techniques, such as K-Anonymity, can be applied to partially solve the problem. However, after generalizing the data, the result of standard K-Anonymity algorithms may render uncontrollable information loss and affects the accuracy of crowdsourcing. In this paper, we first study the tradeoff between the privacy and accuracy for the human operator within data anonymization process. A probability model is proposed to estimate the lower bound and upper bound of the accuracy for general K-Anonymity approaches. We show that searching the optimal anonymity approach is NP-Hard and only heuristic approach is available. The second contribution of the paper is a general feedback-based K-Anonymity scheme. In our scheme, synthetic samples are published to the human workers, the results of which are used to guide the selection on anonymity strategies. We apply the scheme on Mondrian algorithm by adaptively cutting the dimensions based on our feedback results on the synthetic samples. We evaluate the performance of the feedback-based approach on U.S. census dataset, and show that given a predefined  $K$ , our proposal outperforms standard K-Anonymity approaches on retaining the effectiveness of crowdsourcing.","1558-2191","","10.1109/TKDE.2013.93","","https://ieeexplore.ieee.org/stamp/stamp.jsp?arnumber=6529080","Information Technology and Systems;Database Management;General;Security;integrity;and protection;General;Query design and implementation languages;Crowdsourcing;K-Anonymity;database privacy;data partition","Crowdsourcing;Databases;Accuracy;Privacy;Upper bound;Engines;Data privacy","","27","","28","IEEE","11 Jun 2013","","","IEEE","IEEE Journals"
"DTCS: An Integrated Strategy for Enhancing Data Trustworthiness in Mobile Crowdsourcing","J. Hu; H. Lin; X. Guo; J. Yang","College of Engineering, Mathematics and Physical Sciences, University of Exeter, Exeter, U.K.; College of Mathematics and Informatics, Fujian Normal University, Fuzhou, China; College of Mathematics and Informatics, Fujian Normal University, Fuzhou, China; Guangzhou Institute of Geography, Guangzhou, China",IEEE Internet of Things Journal,"16 Jan 2019","2018","5","6","4663","4671","Mobile crowdsourcing systems (MCSs) are important sources of information for the positioning services in Internet-of-Things such as gathering location information through employing citizens to participate in data collection. Although MCSs have attracted significant research and development efforts, there are salient open issues and challenges in security and privacy for MCS, which is an essential factor for its success. This paper proposes an integrated strategy named data trustworthiness enhanced crowdsourcing strategy (DTCS) to enhance data trustworthiness and defend against the internal threats for mobile crowdsourcing. The DTCS integrates effective methods including an evaluation scheme for the attribute relevancy and familiarity of participants, a trust relationship establishment method, a group division strategy based on attributes and metagraph, and a core-selecting-based incentive mechanism. The simulation results show that the DTCS improves the performance of the crowdsourcing strategy compared to the state-of-the-art including the TSCM and PPPCM. The DTCS can effectively defend against internal conflicting behavior attacks and collusion attacks to enhance data trustworthiness for mobile crowdsourcing.","2327-4662","","10.1109/JIOT.2018.2801559","National Natural Science Foundation of China(grant numbers:61363068,61472083,61402110,61772181); Pilot Project of Fujian Province(grant numbers:2016Y0031); Foundation of Science and Technology on Information Assurance Laboratory(grant numbers:KJ-14-109); GDAS Special Project of Science and Technology Development(grant numbers:2017GDASCX-0101); ","https://ieeexplore.ieee.org/stamp/stamp.jsp?arnumber=8279405","Data trustworthiness;Internet-of-Things (IoT);mechanism design;mobile crowdsourcing","Crowdsourcing;Mobile communication;Sensors;Security;Trust management;Data privacy;Data models","","23","","38","IEEE","2 Feb 2018","","","IEEE","IEEE Journals"
"Improve Reputation Evaluation of Crowdsourcing Participants Using Multidimensional Index and Machine Learning Techniques","Y. Huang; M. Chen","State Key Laboratory of Software Engineering, School of Computer Science, Wuhan University, Wuhan, China; State Key Laboratory of Software Engineering, School of Computer Science, Wuhan University, Wuhan, China",IEEE Access,"30 Aug 2019","2019","7","","118055","118067","Building a scientific and reasonable reputation evaluation mechanism for crowdsourcing participants is an effective way to solve the problem of transaction fraud, to establish the trust of traders and ensure the quality of task completion. Under the big data environment, machine learning methods have been applied in the domain of e-commerce of physical goods to improve the traditional reputation evaluation methods, and achieved good results. However, few studies have applied machine learning methods to crowdsourcing, a form of service e-commerce, to evaluate the reputation of participants. This paper proposes a reputation evaluation model (i.e. LDA-RF) for crowdsourcing participants of Random Forest based on Linear Discriminant Analysis. The model consists of five steps: firstly, building a multidimensional reputation evaluation index system for crowdsourcing participants, collecting real data sets, and preprocessing data; secondly, data dimensionality reduction methods, including Linear Discriminant Analysis, Principal Component Analysis, Mean Impact Value method and ReliefF feature selection method, are used to eliminate redundant variables; thirdly, data normalization; fourthly, with selected feature subset, five machine learning techniques, Random Forest, Decision Tree, Back propagation Neural Network, Radial Basis Function Neural Network and Support Vector Machine are used to train the model; Fifthly, the validity of the model is tested by four evaluation measures: 10 fold cross validation, confusion matrix, Kruskal-wallis test and dispersion degree. The results show that the LDA-RF model on accuracy, F1-measure, generalization ability and robustness are better than those of other models, and it has better performance and effectiveness. This study represents a new contribution to establish reputation evaluation of crowdsourcing participants under big data environment.","2169-3536","","10.1109/ACCESS.2019.2933147","National Natural Science Foundation of China(grant numbers:91118003,61373039); ","https://ieeexplore.ieee.org/stamp/stamp.jsp?arnumber=8787738","Crowdsourcing participants;reputation evaluation;machine learning;random forest;data dimension reduction","Crowdsourcing;Task analysis;Indexes;Machine learning;Data models;Analytical models;Game theory","","20","","33","CCBY","5 Aug 2019","","","IEEE","IEEE Journals"
"Challenges and Research Directions in Crowdsourcing for Engineering Design: An Interview Study With Industry Professionals","M. Shergadwala; H. Forbes; D. Schaefer; J. H. Panchal","Purdue University, West Lafayette, IN, USA; Faculty of Engineering, Department of Industrial Design, University of Liverpool, Liverpool, U.K.; University of Liverpool, Liverpool, U.K.; School of Engineering, Purdue University, West Lafayette, IN, USA",IEEE Transactions on Engineering Management,"10 Jun 2022","2022","69","4","1592","1604","Crowdsourcing is an emerging paradigm in engineering design for open innovation. It offers various benefits to crucial aspects of design innovation, such as generating diverse design ideas and engaging consumers. However, crowdsourcing initiatives for engineering design are prone to failures if the complex nature of engineering design processes is not accounted for. For example, the initiative can fail if design solutions do not achieve the required quality, which, in turn, is influenced by factors such as domain knowledge, problem complexity, and incentive structures. Thus, there lies a need to systematically design crowdsourcing initiatives. In this article, the authors build on an existing framework for designing crowdsourcing initiatives in an engineering design context. They do so, by conducting an interview study with industry professionals with product design experience. The authors investigate the challenges experienced by these professionals for adopting crowdsourcing initiatives for engineering design. Through the study, research opportunities are identified that expand and aid the adoption of the framework. The authors discuss relevant literature for the identified research directions and frame the research gaps that need to be pursued. The authors conclude by encouraging academic communities to pursue collaborative efforts toward enabling systematic design of crowdsourcing initiatives for engineering design.","1558-0040","","10.1109/TEM.2020.2983551","National Science Foundation; NSF CMMI(grant numbers:1400050); Engineering and Physical Sciences Research Council; ","https://ieeexplore.ieee.org/stamp/stamp.jsp?arnumber=9097239","Crowdsourcing;engineering design;interviews;research opportunities","Crowdsourcing;Interviews;Industries;Task analysis;Technological innovation;Product design;Organizations","","18","","73","IEEE","20 May 2020","","","IEEE","IEEE Journals"
"Optimal Incentive Design for Cloud-Enabled Multimedia Crowdsourcing","S. Maharjan; Y. Zhang; S. Gjessing","Simula Research Laboratory, Fornebu, Norway; Simula Research Laboratory, Norway; Simula Research Laboratory, Norway",IEEE Transactions on Multimedia,"15 Nov 2016","2016","18","12","2470","2481","Multimedia crowdsourcing possesses a huge potential to actualize many new applications that are expected to yield tremendous benefits in diverse fields including environment monitoring, emergency rescues during natural catastrophes, online education, sports, and entertainment. Nonetheless, multimedia crowdsourcing unfolds new challenges such as big data acquisition and processing, more stringent quality of service requirements, and heterogeneity of crowdsensors. Consequently, incentive mechanisms specifically tailored to multimedia crowdsourcing applications need to be developed to fully utilize the potential of multimedia crowdsourcing. In this paper, we design an optimal incentive mechanism for the smartphone contributors to participate in a cloud-enabled multimedia crowdsourcing scheme. We establish a condition that determines whether the smartphones are eligible to participate, and provide a close form expression for the optimal duration of service from the contributors, for a given reward from the crowdsourcer. Consequently, we derive the conditions for existence of an optimal reward for the contributors from the crowdsourcer, and prove its uniqueness. We numerically illustrate the performance of our model considering logarithmic and linear cost functions for the cloud resources. The similarity of the results for different cost models corroborates the validity of our model and the results, whereas the difference in the magnitudes suggests that the strategy of the crowdsourcer as well as the strategies of the smartphone participants considerably depend on the cloud cost model.","1941-0077","","10.1109/TMM.2016.2604080","Research Council of Norway(grant numbers:240079/F20); ","https://ieeexplore.ieee.org/stamp/stamp.jsp?arnumber=7555338","Crowdsourcing;energy consumption;multimedia cloud;quality of service;reward;utility","Multimedia communication;Crowdsourcing;Streaming media;Sensors;Mobile communication;Cloud computing","","17","","35","IEEE","29 Aug 2016","","","IEEE","IEEE Journals"
"SybSub: Privacy-Preserving Expressive Task Subscription With Sybil Detection in Crowdsourcing","J. Shu; X. Liu; K. Yang; Y. Zhang; X. Jia; R. H. Deng","Department of Computer Science, City University of Hong Kong, Hong Kong; School of Information Systems, Singapore Management University, Singapore; Department of Computer Science, University of Memphis, Memphis, TN, USA; National Engineering Laboratory for Wireless Security, Xi’an University of Posts and Telecommunications, Xi’an; Department of Computer Science, City University of Hong Kong, Hong Kong; School of Information Systems, Singapore Management University, Singapore",IEEE Internet of Things Journal,"8 May 2019","2019","6","2","3003","3013","The past decade has witnessed the rise of crowdsourcing, and privacy in crowdsourcing has also gained rising concern in the meantime. Task matching or task subscription is one of indispensable services in crowdsourcing, but few mechanisms can achieve the expressive task subscription while protecting the privacy. In this paper, we focus on the privacy leaks and attacks during task subscription in crowdsourcing, and propose a privacy-preserving task subscription scheme with sybil detection, called SybSub. The SybSub scheme achieves the expressiveness of task subscription in the multisubscriber and multipublisher crowdsourcing while protecting the privacy of both subscribers and publishers against the semi-honest crowdsourcing service provider, and meanwhile supports the sybil attack detection against greedy subscribers. We implement the SybSub scheme and evaluate it thoroughly. Performance results validate that the SybSub scheme is efficient and feasible.","2327-4662","","10.1109/JIOT.2018.2877780","Research Grants Council of Hong Kong(grant numbers:GRF CityU 11208917,CRF CityU C1008-16G); National Natural Science Foundation of China(grant numbers:61732022,61702105); ","https://ieeexplore.ieee.org/stamp/stamp.jsp?arnumber=8506390","Crowdsourcing;expressiveness;privacy-preserving;sybil detection;task subscription","Task analysis;Crowdsourcing;Privacy;Encryption;Numerical models;Internet of Things","","13","","40","IEEE","24 Oct 2018","","","IEEE","IEEE Journals"
"Small Profits and Quick Returns: An Incentive Mechanism Design for Crowdsourcing Under Continuous Platform Competition","D. Baek; J. Chen; B. J. Choi","Department of Computer Science, Stony Brook University, New York, USA; Department of Computer Science, Stony Brook University, New York, USA; Department of Computer Science and Engineering, Soongsil University, Seoul, South Korea",IEEE Internet of Things Journal,"10 Jan 2020","2020","7","1","349","362","Crowdsourcing can be applied to provide scalable and efficient services to support various tasks. As the driving force of crowdsourcing is the interaction among participants, various incentive mechanisms have been proposed to attract and retain a sufficient number of participants to provide a sustainable crowdsourcing service. However, there exist some gaps between the modeled entities or markets in the existing works and those in reality: 1) dichotomous task valuation and workers' punctuality and 2) crowdsourcing service market monopolized by a platform. To bridge those gaps of such impractical assumption, we model workers' heterogeneous punctuality behavior and task depreciation over time. Based on those models, we propose an expected social welfare maximizing (ESWM) mechanism that aims to maximize the expected social welfare (ESW) by attracting and retaining more participants in the long term, i.e., multiple rounds of crowdsourcing. In the evaluation, we modeled the continuous competition between the ESWM and one of the existing works in both short-term and long-term scenarios. The simulation results show that the ESWM mechanism achieves higher ESW and platform utility than the benchmark by attracting and retaining more participants. Moreover, we prove that the ESWM mechanism achieves the desirable economic properties: individual rationality, budget balance, computational efficiency, and truthfulness.","2327-4662","","10.1109/JIOT.2019.2953278","Ministry of Science and ICT (MSIT), Korea, under the ICT Consilience Creative program(grant numbers:IITP-2019-2011-1-00783); Institute for Information & communications Technology Planning & Evaluation (IITP); National Research Foundation of Korea(grant numbers:NRF-2019R1C1C1007277); NSF CAREER Award, the United States.(grant numbers:1553385); ","https://ieeexplore.ieee.org/stamp/stamp.jsp?arnumber=8897639","Crowdsourcing;distributed computing;incentive mechanism","Task analysis;Crowdsourcing;Cost accounting;Sensors;Internet of Things;Bridges","","11","","29","IEEE","13 Nov 2019","","","IEEE","IEEE Journals"
"Two-Stage Game Design of Payoff Decision-Making Scheme for Crowdsourcing Dilemmas","H. Xia; R. Zhang; X. Cheng; T. Qiu; D. O. Wu","College of Information Science and Engineering, Ocean University of China, Qingdao, China; College of Information Science and Engineering, Ocean University of China, Qingdao, China; College of Computer Science and Technology, Qingdao University, Qingdao, China; School of Computer Science and Technology, College of Intelligence and Computing, Tianjin University, Tianjin, China; Department of Electrical and Computer Engineering, University of Florida, Gainesville, FL, USA",IEEE/ACM Transactions on Networking,"15 Dec 2020","2020","28","6","2741","2754","Crowdsourcing uses collective intelligence to finish complicated tasks and is widely applied in many fields. However, the crowdsourcing dilemmas between the task requester and the task completer restrict the efficiency of system severely, e.g., the cooperation dilemma leads to the failure in the interactions and the quality of service dilemma results in the inability of task completer to provide high-quality service. Current research usually focuses on solving only one aforementioned dilemma and fails to integrate perfectly with the service architectural pattern of crowdsourcing systems. In this article, combined with the crowdsourcing interaction phase, we limit the objects that cause dilemma and propose a  $\boldsymbol {t}$ wo-stage  $\boldsymbol {g}$ ame  $\boldsymbol {p}$ ayoff  $\boldsymbol {d}$ ecision-making scheme (TGPD) to overcome these shortcomings. To solve the cooperation dilemma between the requester and the crowdsourcing platform, we first propose a dynamic payment method based on the reputation-quality rules for the task requester, and then develop a cos-evaluation algorithm to estimate platform’s cost, last design a co-determine algorithm to determine whether the platform adopts a cooperative strategy. To address the quality of service dilemma between the crowdsourcing platform and the workers, we first present an auction-screening method to estimate the reasonable recruitment range of workers which can be optimized by the result of cos-evaluation algorithm, and then use a reward distribution method to motivate workers to complete tasks with high quality and on time. The experimental results indicate that our new scheme successfully increases the worker’s and platforms’ payoffs at the same time, improves the accuracy of screening workers, enhances the worker’s quality of service, and decreases the platform’s cost.","1558-2566","","10.1109/TNET.2020.3018448","National Natural Science Foundation of China (NSFC)(grant numbers:61872205); National Key Research and Development Program of China(grant numbers:2019YFB1703601); Shandong Provincial Natural Science Foundation(grant numbers:ZR2019MF018); Source Innovation Project of Qingdao(grant numbers:18-2-2-56-jch); ","https://ieeexplore.ieee.org/stamp/stamp.jsp?arnumber=9180340","Cooperation dilemma;quality of service dilemma;two-stage game;dynamic payment;auction screening","Task analysis;Crowdsourcing;Quality of service;Games;Decision making;Recruitment;Incentive schemes","","11","","46","CCBY","31 Aug 2020","","","IEEE","IEEE Journals"
"Differentially Private Crowdsourcing With the Public and Private Blockchain","M. Wang; T. Zhu; X. Zuo; M. Yang; S. Yu; W. Zhou","School of Computer Science, University of Technology Sydney, Ultimo, NSW, Australia; School of Computer Science, University of Technology Sydney, Ultimo, NSW, Australia; School of Computer Science, University of Technology Sydney, Ultimo, NSW, Australia; Data61, Commonwealth Scientific and Industrial Research Organization, Canberra, ACT, Australia; School of Computer Science, University of Technology Sydney, Ultimo, NSW, Australia; Faculty of Data Science, City University of Macau, Macau, China",IEEE Internet of Things Journal,"5 May 2023","2023","10","10","8918","8930","As a result of the rapid development of Internet of Things (IoT) systems, an increasing number of academics are focusing on finding new applications for IoT systems. For IoT systems, crowdsourcing is a prevalent practise. Due to the large number of deployed devices in IoT networks, more research is still required on the privacy and trust issues that arise when utilizing crowdsourcing. As a result of the characteristics of social computing, the crowdsourcing network poses issues in terms of confidentiality and reliability. To consolidate and create this industry, we have built a differentially private crowdsourcing system that integrates public and private blockchains to address the privacy and trust issues of conventional crowdsourcing systems. Our proposed solution enables varying levels of privacy protection to protect the user’s identity and location. Moreover, the installation of blockchain networks might potentially ensure the data’s integrity. In the conclusion of this article, the possibility of deploying a crowdsourcing system with blockchain in IoE networks is examined.","2327-4662","","10.1109/JIOT.2022.3233360","ARC Linkage Project from the Australian Research Council, Australia(grant numbers:LP180101150); ","https://ieeexplore.ieee.org/stamp/stamp.jsp?arnumber=10004636","Blockchain;crowdsourcing;Internet of Things (IoT);IoE;privacy preservation","Blockchains;Crowdsourcing;Internet of Things;Privacy;Task analysis;Servers;Smart contracts","","10","","39","IEEE","2 Jan 2023","","","IEEE","IEEE Journals"
"On the Cybernetics of Crowdsourcing Innovation: A Process Model","L. Lin; H. Shen; S. Liu; L. Xu; X. Cheng","Computer Network Information Center, Chinese Academy of Sciences, Beijing, China; Institute of Computing Technology, Chinese Academy of Science, Beijing, China; Institute of Computing Technology, Chinese Academy of Science, Beijing, China; Institute of Computing Technology, Chinese Academy of Science, Beijing, China; Institute of Computing Technology, Chinese Academy of Science, Beijing, China",IEEE Access,"15 Mar 2022","2022","10","","27255","27269","For small and medium-sized enterprises and large enterprises alike, crowdsourcing innovation has become an important element of a product’s whole life cycle. It is the open call process of soliciting consumers to harvest and evaluate ideas or other intellectual assets. The previous proposed taxonomic framework for charactering this process is mainly for general crowdsourcing process and summarized by empirical study. The purpose of this paper is to propose a conceptual model for crowdsourcing innovation from a cybernetic and knowledge management perspective by normative research. The authors performed a normative study and deduced five systemic characteristics from the general laws of control system that guarantee ongoing efficiency for the innovation process. The normative research results provide two key contributions. Firstly, general control laws deduce five indispensable characteristics, and they reveal the intrinsic mechanism of crowdsourcing innovation: the knowledge flow controls, which are also the connotation of open innovation. Secondly, the authors have analyzed a five-characteristics system model and tested the model in several classical cases to show the design tricks of cases. This study provides a new conceptual framework that integrates the theory of open innovation and cybernetics to provide a new view of crowdsourcing innovation process design. In practice, this framework guides managers through the design criteria needed to implement a success crowdsourcing process.","2169-3536","","10.1109/ACCESS.2022.3154101","Beijing Nova Program(grant numbers:Z201100006820061); National Natural Science Foundation of China(grant numbers:61902380); ","https://ieeexplore.ieee.org/stamp/stamp.jsp?arnumber=9720929","Collaborative work;collective intelligence;crowdsourcing;cybernetics;knowledge management;open innovation;problem-solving","Technological innovation;Crowdsourcing;Task analysis;Systematics;Problem-solving;Collective intelligence;Process control","","5","","54","CCBY","24 Feb 2022","","","IEEE","IEEE Journals"
