"Microtask Programming","T. D. LaToza; A. Di Lecce; F. Ricci; W. B. Towne; A. van der Hoek","Department of Computer Science, George Mason University, Fairfax; Cuebiq Srl, Milano, Italy; Bosch Rexroth, Milan, Italy; Carnegie Mellon University, Pittsburgh; Department of Informatics, University of California, Irvine, Irvine",IEEE Transactions on Software Engineering,"13 Nov 2019","2019","45","11","1106","1124","Traditional forms of Crowdsourcing such as open source software development harness crowd contributions to democratize the creation of software. However, potential contributors must first overcome joining barriers forcing casually committed contributors to spend days or weeks onboarding and thereby reducing participation. To more effectively harness potential contributions from the crowd, we propose a method for programming in which work occurs entirely through microtasks, offering contributors short, self-contained tasks such as implementing part of a function or updating a call site invoking a function to match a change made to the function. In microtask programming, microtasks involve changes to a single artifact, are automatically generated as necessary by the system, and nurture quality through iteration. A study examining the feasibility of microtask programming to create small programs found that developers were able to complete 1008 microtasks, onboard and submit their first microtask in less than 15 minutes, complete all types of microtasks in less than 5 minutes on average, and create 490 lines of code and 149 unit tests. The results demonstrate the potential feasibility as well as revealing a number of important challenges to address to successfully scale microtask programming to larger and more complex programs.","1939-3520","","10.1109/TSE.2018.2823327","National Science Foundation(grant numbers:NSF IIS-1111446,IIS-1302522,CCF-1414197); ","https://ieeexplore.ieee.org/stamp/stamp.jsp?arnumber=8331909","Programming environments;management","Programming;Task analysis;Crowdsourcing;Programming environments;Public domain software;Collaborative software","","9","","49","IEEE","5 Apr 2018","","","IEEE","IEEE Journals"
"Top Challenges for Smart Worlds: A Report on the Top10Cs Forum","J. Ma; Y. Zheng; H. Ning; L. T. Yang; R. Huang; H. Liu; Q. Mu; S. S. Yau","Faculty of Computer and Information Sciences, Hosei University, Tokyo, Japan; School of Computer and Communication Engineering, University of Science and Technology Beijing, Beijing, China; School of Computer and Communication Engineering, University of Science and Technology Beijing, Beijing, China; Department of Computer Science, St. Francis Xavier University, Antigonish, NS, Canada; Faculty of Computer and Information Sciences, Hosei University, Tokyo, Japan; Research Institute, Run Technologies Company, Ltd., Beijing, China; School of Computer and Communication Engineering, University of Science and Technology Beijing, Beijing, China; School of Computing, Informatics, and Decision Systems Engineering, Arizona State University, Tempe, AZ, USA",IEEE Access,"20 May 2017","2015","3","","2475","2480","Smart worlds begin with smart things, such as smart objects, smart cities, smart manufacturing, and smart systems, are overlaid with sensing and actuation, many embedded in things, and eventually encompass all aspects of the cyber, physical, social, and thinking hyperspace. In the future, human beings will live in a smart environment where both life and work are well addressed by technology, whereas humans will be responsible only for providing creativity. For this purpose, we have organized the first 2015 Smart World Congress, including five IEEE International Conferences. Specifically, a variety of challenges are presented in the field of smart world. Therefore, an open forum on the top ten challenges (Top10Cs) for smart worlds was held under the congress to identify the main challenges through collecting the intelligence existing particularly in crowd wisdom. Top10Cs and related works, as a crowdsourcing approach, discuss and analyze the top challenges for smart worlds based on the selective results of the crowd and experts via an online platform. Moreover, we summarize the experiences obtained in organizing the Top10Cs forum.","2169-3536","","10.1109/ACCESS.2015.2504123","Fundamental Research Funds for the Central Universities(grant numbers:06105031); Japan Society for the Promotion of Science through the Grants-in-Aid for Scientific Research(grant numbers:25330270,26330350); National Natural Science Foundation of China(grant numbers:61471035); Top10Cs Open Forum and 2015 Smart World Congress; ","https://ieeexplore.ieee.org/stamp/stamp.jsp?arnumber=7339414","smart worlds;top challenges;collective intel-ligence;crowdsourcing;crowd wisdom;Smart worlds;top challenges;collective intelligence;crowdsourcing;crowd wisdom","Crowdsourcing;Electronic mail;Security;Internet of things;Big data;Organizations","","9","","18","OAPA","26 Nov 2015","","","IEEE","IEEE Journals"
"Improved Bayesian Causal Map Approach for Community-Based Product Design Project Feasibility Analysis","M. Yang; P. Jiang","State Key Laboratory for Manufacturing Systems Engineering, Xi'an Jiaotong University, Xi'an, China; State Key Laboratory for Manufacturing Systems Engineering, Xi'an Jiaotong University, Xi'an, China",IEEE Transactions on Engineering Management,"16 Jul 2020","2020","67","3","794","812","The development of sharing economy and social media technology leads to a new design mode-community-based product design (CPD), including crowdsourcing design, open source design, and maker product design. CPD projects have the potential to use socialized design resource for creative product development because they are openly participated by a large number of socialized designers. However, CPD projects are unreliable, unpredictable, and usually endure low success rate. We believe that the reason for these problems is that many unreliable factors caused by the nature of CPD mode are disturbing the implementation of CPD projects, but few research works can provide systematic and quantitative understanding of the relationship between these factors and CPD project feasibility, which makes it difficult for stakeholders to evaluate and manage their CPD projects. To mitigate these problems, in this paper an improved Bayesian causal map approach is developed and used to build a CPD project feasibility analysis model. The model can reveal the interaction relationship among the factors, and provide quantitative evaluation of CPD project feasibility given the states of the factors. In this way, the model can help the stakeholders in CPD project management by showing them which factors require priority processing and providing them with the prediction of project success rate, and eventually improve the overall reliability of CPD projects. The model has been verified through sensitivity analysis and post analysis on real CPD projects.","1558-0040","","10.1109/TEM.2018.2889841","National Natural Science Foundation of China(grant numbers:71571142); ","https://ieeexplore.ieee.org/stamp/stamp.jsp?arnumber=8620227","Bayesian causal maps;Bayesian networks;community-based product design (CPD);crowdsourcing, opensource;project feasibility analysis (PFA)","Bayes methods;Product design;Stakeholders;Crowdsourcing;Task analysis;Reliability;Sensitivity analysis","","8","","67","IEEE","20 Jan 2019","","","IEEE","IEEE Journals"
"Automatic Sentiment Annotation of Idiomatic Expressions for Sentiment Analysis Task","B. M. A. Tahayna; R. K. Ayyasamy; R. Akbar","Faculty of Information and Communication Technology, Universiti Tunku Abdul Rahman (UTAR), Kampar, Perak, Malaysia; Faculty of Information and Communication Technology, Universiti Tunku Abdul Rahman (UTAR), Kampar, Perak, Malaysia; Department of Computer and Information Sciences, Universiti Teknologi PETRONAS (UTP), Seri Iskandar, Perak, Malaysia",IEEE Access,"29 Nov 2022","2022","10","","122234","122242","Social media users use words and phrases to convey their views or opinions. However, some people use idioms or proverbs that are implicit and indirect to make a stronger impression on the audience or perhaps catch their attention by utilizing funny, sarcastic, or metaphorical phrases. Idioms and proverbs are figurative expressions with a thematically coherent totality that cannot be understood literally. In previous work, the extension of IBM’s Sentiment Lexicon of Idiomatic Expressions was proposed to include around 9,000 idioms; a crowdsourcing service manually annotates both lexicons. Therefore, in this research, we provide a knowledge-based expansion approach to avoid human annotation of idioms. For sentiment classification, the proposed method has the advantage that it does not require any fine-tuning for the BERT model. Experimental comparisons show that automated idiom enrichment and annotation are very beneficial for the performance of the sentiment classifier. The expanded annotated lexicon will be made available to the general public.","2169-3536","","10.1109/ACCESS.2022.3222233","Universiti Tunku Abdul Rahman under the University Tunku Abdul Rahman (UTAR) Research Fund(grant numbers:IPSR/RMC/UTARRF/2020-C1/R01); Universiti Teknologi PETRONAS STIRF Research Fund(grant numbers:015LA0-036); ","https://ieeexplore.ieee.org/stamp/stamp.jsp?arnumber=9954231","Data augmentation;deep learning;fine-tuning;idiomatic expressions;lexicon;sentiment analysis","Sentiment analysis;Social networking (online);Deep learning;Bit error rate;Data augmentation;Dictionaries;Annotations","","8","","32","CCBY","17 Nov 2022","","","IEEE","IEEE Journals"
"A Design Framework for Social Product Development","H. Forbes; D. Schaefer; J. Panchal; J. Han","Department of Industrial Design, University of Liverpool Faculty of Engineering, Liverpool, U.K.; University of Liverpool, Liverpool, U.K.; Purdue University, West Lafayette, IN, USA; Department of Industrial Design, University of Liverpool Faculty of Engineering, Liverpool, U.K.",IEEE Transactions on Engineering Management,"14 Jan 2022","2022","69","2","302","313","Social product development (SPD) is defined as a group of “coalescing tools and socio-technologies” represented by several tenants including crowdsourcing, internet-based mass collaboration, open innovation, and cloud-based design and manufacture. Existing examples of SPD have resulted in enhanced collaboration in design teams, shorter lead times, and significant reductions in R&D costs. Despite these potential benefits, guidance on how to conduct SPD is lacking in existing literature and the use of SPD tenants in the industry is limited. The aim of this article is to present a framework to guide the application of SPD. As part of this framework, the authors present a tool for the selection of SPD tenants that allows users to select an SPD tenant based on their requirements and capabilities. The framework allows practitioners to consider how SPD tenants can be used to solve design problems and allows the user to design SPD tenants with consideration of their own needs. This article concludes with a validation activity and discussion on future research directions in this field.","1558-0040","","10.1109/TEM.2019.2948996","","https://ieeexplore.ieee.org/stamp/stamp.jsp?arnumber=8895755","Crowdsourcing;open innovation;social product development","Product development;Design methodology;Technological innovation;Organizations;Tools;Collaboration","","8","","60","IEEE","11 Nov 2019","","","IEEE","IEEE Journals"
"Stimulating Innovation on Social Product Development: An Analysis of Social Behaviors in Online Innovation Communities","C. Han; M. Yang","Department of Systems Management and Strategy, University of Greenwich, London, U.K.; Department of Systems Management and Strategy, University of Greenwich, London, U.K.",IEEE Transactions on Engineering Management,"14 Jan 2022","2022","69","2","365","375","With firms’ increasing adoption of social product development strategies, such as mass collaboration and crowdsourcing, online users are actively participating in the development of new products and services via social media platforms. Online innovation communities (OICs), one representative of such social media platforms, have been used by large firms to collect ideas from their users and facilitate the product development process. While it is extensively studied that product ideas with high popularity on OICs are of great importance to the product development, research on what social behaviors of online users lead to the high popularity is largely unclear. This article conducts an empirical study by collecting a large-scale, quantitative dataset from an OIC between 2014 and 2018. With the analysis of users’ online idea posting and commenting behaviors, our results reveal that the idea contribution experience, together with comment diversity, positively influence the overall popularity of an individual's ideas, while the motivation of providing comments is negatively related. Moreover, user's innovation capability poses a positive effect on both overall and average popularity of ideas. These findings can help firms better incentivise their users on OICs to improve the effectiveness and efficiency of social product development.","1558-0040","","10.1109/TEM.2019.2955073","","https://ieeexplore.ieee.org/stamp/stamp.jsp?arnumber=8930934","Innovation management;technological innovation;social network services;crowdsourcing","Technological innovation;Product development;Collaboration;Social networking (online);Social computing;Business;Focusing","","7","","46","IEEE","11 Dec 2019","","","IEEE","IEEE Journals"
"Geospatial Modeling of Road Traffic Using a Semi-Supervised Regression Algorithm","M. Saldana-Perez; M. Torres-Ruiz; M. Moreno-Ibarra","Instituto Politécnico Nacional, CIC, Mexico City, Mexico; Instituto Politécnico Nacional, CIC, Mexico City, Mexico; Instituto Politécnico Nacional, CIC, Mexico City, Mexico",IEEE Access,"16 Dec 2019","2019","7","","177376","177386","Nowadays, big cities are facing many challenges with respect to traffic congestion, climate change, air and water pollution, among others. Thus, smart cities are intended to improve the life quality of the citizens, tackling such issues with the integration of information and communication technologies to reduce the impact and achieve a well-being state of citizens. In this work, a model to predict the traffic congestion applying a support vector machine method is proposed. In addition, a crowdsourcing approach based on mining the Twitter social networks collecting events associated with the traffic is also proposed. The main contribution of this research is focused on providing a methodology that characterizes the traffic congestion analyzing crowd-sensed data from a geospatial perspective. This approach was implemented over the Mexico City as a case study, in order to forecast possible future traffic events in the city, in which the citizens share their particular situation to discover alternatives routes for avoiding the traffic congestion. Future works are oriented towards designing mobile applications in order to introduce the proposed approach and integrate information from multiple platforms and navigation systems.","2169-3536","","10.1109/ACCESS.2019.2942586","Consejo Nacional de Innovación, Ciencia y Tecnología(grant numbers:B140563); Secretaría de Investigación y Posgrado, Instituto Politécnico Nacional(grant numbers:20196338); ","https://ieeexplore.ieee.org/stamp/stamp.jsp?arnumber=8845592","Geospatial modeling;machine learning;regression;road traffic;urban computing;volunteered geographic information","Smart cities;Roads;Support vector machines;Machine learning;Prediction algorithms;Geospatial analysis;Climate change;Urban areas","","7","","35","CCBY","20 Sep 2019","","","IEEE","IEEE Journals"
"Automatic Lane-Level Intersection Map Generation using Low-Channel Roadside LiDAR","H. Liu; C. Lin; B. Gong; D. Wu","Department of Traffic Information and Control Engineering, Jilin University, Changchun, China; Department of Traffic Information and Control Engineering, Jilin University, Changchun, China; Department of Traffic Information and Control Engineering, Jilin University, Changchun, China; Texas A&M Transportation Institute, Texas A&M University, College Station, Texas, TX, USA",IEEE/CAA Journal of Automatica Sinica,"1 May 2023","2023","10","5","1209","1222","A lane-level intersection map is a cornerstone in high-definition (HD) traffic network maps for autonomous driving and high-precision intelligent transportation systems applications such as traffic management and control, and traffic accident evaluation and prevention. Mapping an HD intersection is time-consuming, labor-intensive, and expensive with conventional methods. In this paper, we used a low-channel roadside light detection and range sensor (LiDAR) to automatically and dynamically generate a lane-level intersection, including the signal phases, geometry, layout, and lane directions. First, a mathematical model was proposed to describe the topology and detail of a lane-level intersection. Second, continuous and discontinuous traffic object trajectories were extracted to identify the signal phases and times. Third, the layout, geometry, and lane direction were identified using the convex hull detection algorithm for trajectories. Fourth, a sliding window algorithm was presented to detect the lane marking and extract the lane, and the virtual lane connecting the inbound and outbound of the intersection were generated using the vehicle trajectories within the intersection and considering the traffic rules. In the field experiment, the mean absolute estimation error is 2 s for signal phase and time identification. The lane marking identification Precision and Recall are 96% and 94.12%, respectively. Compared with the satellite-based, MMS-based, and crowdsourcing-based lane mapping methods, the average lane location deviation is 0.2 m and the update period is less than one hour by the proposed method with low-channel roadside LiDAR.","2329-9274","","10.1109/JAS.2023.123183","National Natural Science Foundation of China(grant numbers:51408257); ","https://ieeexplore.ieee.org/stamp/stamp.jsp?arnumber=10113595","High-definition map;lane-level intersection map;roadside LiDAR;sliding window;traffic object trajectory","Geometry;Point cloud compression;Estimation error;Laser radar;Layout;Mathematical models;Trajectory","","7","","54","","1 May 2023","","","IEEE","IEEE Journals"
"Match Maximization of Vehicle-to-Vehicle Energy Charging With Double-Sided Auction","A. Yassine; M. S. Hossain","Department of Software Engineering, Lakehead University, Thunder Bay, Canada; Department of Software Engineering, College of Computer and Information Sciences, King Saud University, Riyadh, Saudi Arabia",IEEE Transactions on Intelligent Transportation Systems,"1 Nov 2023","2023","24","11","13250","13259","The future Intelligent Transportation System (ITS) will rely heavily on the advancement of the Internet of Things (IoT). Indeed, the IoT infrastructure paves the way toward connecting vehicles for various benefits including traffic monitoring, crowdsourcing, energy trading, and other ITS services. One of the use cases of the IoV is Vehicle-to-Vehicle (V2V) energy charging/discharging, which is expected to be an integral part of the ITS. In V2V paradigm, Electric Vehicles (EVs) with bidirectional chargers can communicate with a grid edge network or directly with another EV using low-power wide-area networks (LPWAN) or 5G wireless connection to offer or demand energy. V2V energy exchange allows EV owners to make money from selling their battery’s excess energy to other EVs. One of the main challenges for the wide adoption of V2V is the development of mechanisms that maximize the benefits for participants. In the V2V paradigm, energy providers and suppliers require mechanisms that ensure maximal matching for the optimal social welfare of the users. In this paper, we propose a double-sided auction mechanism that matches EVs by pairing bids and asks such that the traded volume and the utilities are maximized. Through theoretical analysis, we show that the proposed model can indeed be truthful, individually rationale, and computationally efficient. Finally, we evaluate the proposed model based on real data and provide performance analysis.","1558-0016","","10.1109/TITS.2023.3265870","Distinguished Scientist Fellowship Program (DSFP2023), King Saud University, Riyadh, Saudi Arabia; Natural Sciences and Engineering Research Council of Canada (NSERC); ","https://ieeexplore.ieee.org/stamp/stamp.jsp?arnumber=10153934","Electric vehicle (EV);double-sided auction;match maximization;V2V energy trading;Internet of Vehicles;fog nodes","Costs;Resource management;Vehicular ad hoc networks;Ecosystems;Vehicle-to-grid;Transportation;State of charge","","7","","37","IEEE","15 Jun 2023","","","IEEE","IEEE Journals"
"Earth Observation Image Semantic Bias: A Collaborative User Annotation Approach","A. Murillo Montes de Oca; R. Bahmanyar; N. Nistor; M. Datcu","Faculty of Psychology and Educational Sciences, Ludwig-Maximilians-Universität, Munich, Germany; German Aerospace Center (DLR), Remote Sensing Technology Institute (IMF), Wessling, Germany; Walden University, Minneapolis, MN, USA; German Aerospace Center (DLR), Remote Sensing Technology Institute (IMF), Wessling, Germany",IEEE Journal of Selected Topics in Applied Earth Observations and Remote Sensing,"19 Jul 2017","2017","10","6","2462","2477","Correctly annotated image datasets are important for developing and validating image mining methods. However, there is some doubt regarding the generalizability of the models trained and validated on available datasets. This is due to dataset biases, which occur when the same semantic label is used in different ways across datasets, and/or when identical object categories are labeled differently across datasets. In this paper, we demonstrate the existence of dataset biases with a sample of eight remote sensing image datasets, first showing they are readily discriminable from a feature perspective, and then demonstrating that a model trained on one dataset is not always valid on others. Past approaches to reducing dataset biases have relied on crowdsourcing, however this is not always an option (e.g., due to public-accessibility restrictions of images), raising the question: How to structure annotation tasks to efficiently and accurately annotate images with a limited number of nonexpert annotators? We propose a collaborative annotation methodology, conducting image annotation experiments where users are placed in either a collaborative or individual condition, and we analyze their annotation performance. Results show the collaborators produce more thorough, precise annotations, requiring less time than the individuals. Collaborators labels show less variance around the consensus point, meaning their assigned labels are more predictable and likely to be generally accepted by other users. Therefore, collaborative image annotation is a promising annotation methodology for creating reliable datasets with a reduced number of nonexpert annotators. This in turn has implications for the creation of less biased image datasets.","2151-1535","","10.1109/JSTARS.2017.2697003","Munich Aerospace; ","https://ieeexplore.ieee.org/stamp/stamp.jsp?arnumber=7926346","Dataset biases;remote sensing images;semantic image annotation;sensory and semantic gaps;user evaluation","Remote sensing;Semantics;Collaboration;Synthetic aperture radar;Optical sensors","","7","","29","IEEE","11 May 2017","","","IEEE","IEEE Journals"
