"HiHeading: Smartphone-Based Indoor Map Construction System with High Accuracy Heading Inference","W. Ma; J. Wu; C. Long; Y. Zhu","Department of Automation, Shanghai Jiao Tong University, Shanghai, China; Department of Computer Science and Engineering, Shanghai Jiao Tong University, Shanghai, China; Department of Computer Science and Engineering, Shanghai Jiao Tong University, Shanghai, China; Department of Automation, Shanghai Jiao Tong University, Shanghai, China",2015 11th International Conference on Mobile Ad-hoc and Sensor Networks (MSN),"29 Feb 2016","2015","","","172","177","Smartphone is widely used in indoor map construction with its build-in sensors. However, the low accuracy problem of build-in sensors always causes the collected user trajectories noisy. The significant problem we face is the low accuracy of walk heading estimated by build-in sensors because of phone heading fluctuation and magnetic field anomaly. This paper presents HiHeading - a high reliable crowdsourcing-based indoor map construction system. HiHeading leverages build-in inertial sensors to construct accurate motion traces. These traces are generated by HiHeading with high accuracy based on the novel ideal of fusing gyroscope and orientation sensor to get reliable walk heading estimation in indoor dead reckoning (DR). To evaluate our system, we have tested it in a middle size indoor office by recording 3 people's walk trajectories during 5 days. We present an evaluation of our system and the experiment result shows 70% of the heading estimation error is lower than 10 degrees.","","978-1-5090-0329-7","10.1109/MSN.2015.35","","https://ieeexplore.ieee.org/stamp/stamp.jsp?arnumber=7420940","indoor map construction;smartphone","Gyroscopes;Trajectory;IEEE 802.11 Standard;Estimation;Legged locomotion;Dead reckoning;Accelerometers","","5","","16","IEEE","29 Feb 2016","","","IEEE","IEEE Conferences"
"C-space: Fostering new creative paradigms based on recording and sharing “casual” videos through the internet","B. Simões; P. Aksenov; P. Santos; T. Arentze; R. De Amicis",Fondazione GraphiTech; Eindhoven University of Technology; Fraunhofer IGD; Eindhoven University of Technology; Fondazione GraphiTech,2015 IEEE International Conference on Multimedia & Expo Workshops (ICMEW),"30 Jul 2015","2015","","","1","4","A key theme in ubiquitous computing is to create smart environments in which there is seamless integration of people, information, and physical reality. In this manuscript, we describe a set of tools that facilitate the creation of such environments, e,g, a service to transform videos recorded with mobile devices into navigable 3D scenes, a service to compute and describe the emotional processes that occur during the user interaction with such content, a service that takes into account certain dynamic needs of users in personalizing solutions for allocating their leisure time and activities, a gamified crowdsourcing application, and a set of projection-based tools for creating and interacting with augmented environments. Ultimately, our objective is have a framework that seamless integrates all these components, to foster creativity processes.","","978-1-4799-7079-7","10.1109/ICMEW.2015.7169833","","https://ieeexplore.ieee.org/stamp/stamp.jsp?arnumber=7169833","4d;affective;smart routing;projection","","","5","","7","IEEE","30 Jul 2015","","","IEEE","IEEE Conferences"
"Towards a methodology and instrumentation toolset for cloud manufacturing","O. Skarlat; M. Borkowski; S. Schulte","TU Wien, Distributed Systems Group; TU Wien, Distributed Systems Group; TU Wien, Distributed Systems Group",2016 1st International Workshop on Cyber-Physical Production Systems (CPPS),"2 Jun 2016","2016","","","1","4","Cloud Manufacturing is a recent concept to realize real-world manufacturing processes by applying a combination of well-known principles from the fields of Cloud Computing, Business Process Management (BPM), and Internet of Things (IoT) to the manufacturing domain. Cloud Manufacturing assumes using crowdsourcing and outsourcing types of business mobilization to transform local production-oriented manufacturing into global service-oriented manufacturing networks. While there have been a number of conceptual frameworks for Cloud Manufacturing, there is still a lack of concrete methodologies and instrumentation. Especially, the integration of generic Cyber-Physical Systems (CPS) shop floors and the support of manufacturing business processes in the Cloud have not been given full consideration yet. Within this paper, we intend to define a research agenda and according missing methodologies and instrumentation to ground a platform for Cloud Manufacturing.","","978-1-5090-1156-8","10.1109/CPPS.2016.7483920","","https://ieeexplore.ieee.org/stamp/stamp.jsp?arnumber=7483920","","Cloud computing;Manufacturing processes;Business;Instruments;Internet of things;Optimization","","5","","22","IEEE","2 Jun 2016","","","IEEE","IEEE Conferences"
"Crownn: Human-in-the-loop Network with Crowd-generated Inputs","Y. Sakata; Y. Baba; H. Kashima",Kyoto University; University of Tsukuba; Kyoto University,"ICASSP 2019 - 2019 IEEE International Conference on Acoustics, Speech and Signal Processing (ICASSP)","17 Apr 2019","2019","","","7555","7559","Input features are indispensable for almost all machine learning methods; however, their definitions themselves are sometimes too abstract to extract automatically. Human-in-the-loop machine learning is a promising solution to such cases where humans extract the feature values for machine learning models. We use crowdsourcing for feature value extraction and consider a problem to aggregate the feature values to improve machine learning classifiers. We propose a novel neural network model called CROWNN, a neural network with crowd-generated inputs with the worker convolution layer, that learns both the capabilities of human feature extractors and the weights of a neural network classifier by applying the idea of the convolution neural network to feature aggregation. Our experiments using four datasets show the proposed method outperforms the baseline method using unsupervised aggregation methods in some datasets. We also show the robustness of the proposed model against the existence of spam workers, especially when they are malicious workers who intentionally flip the feature values.","2379-190X","978-1-4799-8131-1","10.1109/ICASSP.2019.8682321","","https://ieeexplore.ieee.org/stamp/stamp.jsp?arnumber=8682321","Crowdsourcing;human computation;human-in-the-loop","Feature extraction;Task analysis;Crowdsourcing;Neural networks;Machine learning;Convolution;Aggregates","","5","","16","IEEE","17 Apr 2019","","","IEEE","IEEE Conferences"
"Online Radio Map Update Based on a Marginalized Particle Gaussian Process","Z. Xu; B. Huang; B. Jia; W. Li","College of Computer Science, Inner Mongolia University, Hohhot, China; College of Computer Science, Inner Mongolia University, Hohhot, China; College of Computer Science, Inner Mongolia University, Hohhot, China; College of Computer Science, Inner Mongolia University, Hohhot, China","ICASSP 2019 - 2019 IEEE International Conference on Acoustics, Speech and Signal Processing (ICASSP)","17 Apr 2019","2019","","","4624","4628","In this paper, a novel scheme is reported to adapt radio maps to environmental dynamics in an online fashion by combining crowdsourcing and gaussian process regression (GPR). Specifically, a Marginalized Particle Gaussian Process (MPGP) is adopted to recursively fuse crowdsourced fingerprints with an existing offline radio map. The advantages of the proposed scheme lie in the efficiency and scalability in comparison with the traditional approaches. Extensive experiments are carried out in a real scenario of nearly 1000 m2 during five months, and a comparison is made with several existing popular solutions. It is shown that the proposed scheme outperforms its counterparts in terms of both robustness and accuracy.","2379-190X","978-1-4799-8131-1","10.1109/ICASSP.2019.8683485","","https://ieeexplore.ieee.org/stamp/stamp.jsp?arnumber=8683485","","","","5","","19","IEEE","17 Apr 2019","","","IEEE","IEEE Conferences"
"A Connected Car-based Parking Location Service System","Y. KC; C. -S. Kang","Department of Eco-friendly Offshore Plant FEED Engineering, Changwon National University, Changwon, Korea; Department of Information & Communication Engineering, Changwon National University, Changwon, Korea",2019 IEEE International Conference on Internet of Things and Intelligence System (IoTaIS),"6 Feb 2020","2019","","","167","171","The number of vehicles is increasing rapidly, which results in finding a free parking spot as a prominent problem. Due to the increased number of cars, drivers have to hunt around the streets and parking facilities searching for free parking spots. Consequently, there are concerns about traffic congestion as well as time consumption, fuel wasting, and air quality degradation due to the emission of the fine dust at residential areas and shopping districts. To alleviate the problems, we propose a connected car-based on-street parking location service system, in which the system consists of the parking space detection device (DD), the cloud server, and mobile application. Each of the cars in the system is equipped with a DD that acts as a mobile sensing unit (MSU). The proposed system is based on the concept of crowdsourcing; thus, each MSU is responsible for detecting the free parking location and transmitting the parking-related information (MSU id, MSU location, the width of detected free parking location) to the server through a wireless network. Later, a user (i.e., driver) can select a free parking location and navigate to its feasible parking location via a mobile application. However, when the system is unable to detect any free on-street parking location, it suggests users about off-street parking facilities near the user's intended destination.","","978-1-7281-2516-9","10.1109/IoTaIS47347.2019.8980443","","https://ieeexplore.ieee.org/stamp/stamp.jsp?arnumber=8980443","IoT;Connected-car;Smart cities;Smart parking;On-street parking;LTE;Crowdsourcing;Mobile application","Navigation;Wireless networks;Mobile applications;Sensors;Servers;Automobiles;Internet of Things","","4","","12","IEEE","6 Feb 2020","","","IEEE","IEEE Conferences"
"Open Monitoring Platform for Mobile Broadband","W. Hofer; P. Svoboda; W. Kastner; V. Raida; M. Rupp","TU Wien, Institute of Telecommunications, Austria; TU Wien, Institute of Telecommunications, Austria; TU Wien, Institute of Computer Engineering, Austria; TU Wien, Institute of Telecommunications, Austria; TU Wien, Institute of Telecommunications, Austria",2020 IEEE 91st Vehicular Technology Conference (VTC2020-Spring),"30 Jun 2020","2020","","","1","5","Enhanced Mobile Broadband (eMBB) is just around the corner, and its performance aspect makes it interesting for Vehicle-to-Vehicle (V2V) communication. Fair benchmarking of communication networks has been a research topic for decades. In contrast to wired networks, mobile networks lack a quick, accurate, and data-saving tool to describe the properties of the connection in a vehicle. Therefore, this work aims to create a crowdsourcing-ready and easily expandable software platform capable of analyzing the current network conditions in a quick and data-saving way. Based on literature research, we identified CRUSP as quick, data-saving, and accurate method to characterize mobile communication networks. Afterwards, we realized Constant Rate Ultra Short Probing (CRUSP) in a flexible software platform for performing, gathering, and analyzing measurements. The evaluation of the software was performed in a configurable and shielded reference cell and delivered an average error of 2.44% to iPerf3, a popular reference tool. In conclusion, the results indicated that the developed software operates accurately in Long-Term Evolution (LTE) networks.","2577-2465","978-1-7281-5207-3","10.1109/VTC2020-Spring48590.2020.9128798","","https://ieeexplore.ieee.org/stamp/stamp.jsp?arnumber=9128798","available bandwidth;ABW;eMBB;mobile broadband;measurement platform;CRUSP","Tools;Software;Bandwidth;Volume measurement;Broadband communication;Computer architecture;Monitoring","","4","","19","IEEE","30 Jun 2020","","","IEEE","IEEE Conferences"
"Europa: Increasing Accessibility of Geospatial Datasets","H. Shin; N. Exe; U. Dutta; T. R. Joshi; S. Verma; S. Gupta","Granular AI, MA, USA; Granular AI, MA, USA; Granular AI, MA, USA; Granular AI, MA, USA; Granular AI, MA, USA; Granular AI, MA, USA",IGARSS 2022 - 2022 IEEE International Geoscience and Remote Sensing Symposium,"28 Sep 2022","2022","","","6848","6851","In this paper we introduce a novel platform for teams to develop rich, analysis-ready datasets for geospatial machine learning. Europa11https://europa.granular.ai addresses longstanding challenges that remote sensing and machine vision researchers face when developing datasets, including data sourcing, dataset development and sharing. By simplifying and accelerating the dataset creation process, Europa serves to expedite the pace of geospatial machine learning innovation. The platform enables users to develop feature-rich, spatio-temporal datasets using multiple sources of satellite imagery. Europa supports the development of datasets for segmentation, classification, object detection, and change detection problems. Europa also enables collaborative dataset development, with a management protocol for crowdsourcing labels and annotations. The web interface and API are built upon a resilient dataset management protocol that supports versioning, forking and access control, enabling greater research collaboration.","2153-7003","978-1-6654-2792-0","10.1109/IGARSS46834.2022.9884440","","https://ieeexplore.ieee.org/stamp/stamp.jsp?arnumber=9884440","annotation tool;open source datasets;remote sensing;geospatial;deep learning","Technological innovation;Protocols;Satellites;Annotations;Collaboration;Machine learning;Object segmentation","","4","","13","IEEE","28 Sep 2022","","","IEEE","IEEE Conferences"
"Optimal Crowdsourced Classification with a Reject Option in the Presence of Spammers","Q. Li; P. K. Varshney","Department of EECS, Syracuse University, Syracuse, NY, USA; Department of EECS, Syracuse University, Syracuse, NY, USA","2018 IEEE International Conference on Acoustics, Speech and Signal Processing (ICASSP)","13 Sep 2018","2018","","","4109","4113","We explore the design of an effective crowdsourcing system for an M -ary classification task. Crowd workers complete simple binary microtasks whose results are aggregated to give the final decision. We consider the scenario where the workers have a reject option so that they are allowed to skip microtasks when they are unable to or choose not to respond to binary microtasks. We present an aggregation approach using a weighted majority voting rule, where each worker's response is assigned an optimized weight to maximize crowd's classification performance.","2379-190X","978-1-5386-4658-8","10.1109/ICASSP.2018.8461615","","https://ieeexplore.ieee.org/stamp/stamp.jsp?arnumber=8461615","Classification;crowdsourcing;distributed inference;reject option;spammers","Crowdsourcing;Task analysis;Simulation;Manganese;Maximum likelihood estimation;System performance;Probability distribution","","4","","21","IEEE","13 Sep 2018","","","IEEE","IEEE Conferences"
"Towards a Gamified Equivalent Mutants Detection Platform","T. Laurent; L. Guillot; M. Toyama; R. Smith; D. Bean; A. Ventresque","Keio University, Yokohama, Japan; Lero@UCD School of Computer Science, University College Dublin, Ireland; Keio University, Yokohama, Japan; Skype Division, Microsoft Corporation, Seattle, USA; Skype Division, Microsoft Corporation, Seattle, USA; Lero@UCD School of Computer Science, University College Dublin, Ireland","2017 IEEE International Conference on Software Testing, Verification and Validation Workshops (ICSTW)","17 Apr 2017","2017","","","382","384","This poster presents a gamified system for equivalent mutants detection. This system can be used as a standalone tool for developers and testing teams alike - but we plan to use this system on a crowdsourcing platform to evaluate the various parameters involved in the detection of equivalent mutants, such as, expertise (coding and testing), familiarity with the code base, complexity of the code and tests, measured likelihood of equivalent mutants.","","978-1-5090-6676-6","10.1109/ICSTW.2017.70","","https://ieeexplore.ieee.org/stamp/stamp.jsp?arnumber=7899087","","Testing;Labeling;Complexity theory;Electronic mail;Prototypes;Crowdsourcing;Conferences","","4","","13","IEEE","17 Apr 2017","","","IEEE","IEEE Conferences"
"An indoor localization system by fusing smartphone inertial sensors and bluetooth low energy beacons","J. Li; M. Guo; S. Li","Department of Precision Instrument, Tsinghua University, Beijing, China; Department of Precision Instrument, Tsinghua University, Beijing, China; Department of NBC Defence, Institute of NBC Defence, Beijing, China",2017 2nd International Conference on Frontiers of Sensors Technologies (ICFST),"18 Dec 2017","2017","","","317","321","Indoor localization becomes a research focus in recent years since. Smartphone-based pedestrian dead reckoning (PDR) is one of the widely-adopted localization techniques with limiting problems such as the drift of inertial sensors. Bluetooth Low Energy (BLE) has better performance result which makes it an auxiliary tool for PDR to correct errors. But BLE fingerprint sampling and calibrating are time-consuming and labor-intensive. In this paper, a Support Vector Machine (SVM) classification algorithm based crowdsourcing method is developed and applied to generate BLE landmarks instead of manual work leveraging smartphone sensors and uploaded BLE signals. A particle filter is also used to fusion PDR and landmarks detection results for better localization performance. The experiments show that the proposed fusion algorithm achieved the accuracy of 3.15 m at 90% of the time with dense landmarks (1 landmark per 5 m), which performs 51.76% better than 6.53 m from PDR algorithm. With sparse landmarks (1 landmark per 15 m), the proposed fusion algorithm achieved the accuracy of 3.26 m at 90% of the time. The proposed tracking system using smartphone inertial sensors and BLE beacons can be a promising methodology in practical usages.","","978-1-5090-4860-1","10.1109/ICFST.2017.8210527","","https://ieeexplore.ieee.org/stamp/stamp.jsp?arnumber=8210527","smartphone;indoor localization;pedestrian dead reckoning;Bluetooth Low Energy","Sensors;Training;Servers;Legged locomotion;Estimation;Support vector machines;Classification algorithms","","4","","15","IEEE","18 Dec 2017","","","IEEE","IEEE Conferences"
"Producing and evaluating crowdsourced computer security attack trees","D. Bogaard; S. Goel; S. Kandari; D. Johnson; G. Markowsky; B. Stackpole","Department of Information Sciences and Technology, Rochester Institute of Technology, Rochester, NY; Information Technology Department, SUNY, Albany, NY; Department of Information Sciences and Technology, Rochester Institute of Technology, Rochester, NY; Department of Computing Security, Rochester Institute of Technology, Rochester, NY; School of Computing and Information Science, University of Maine, Orono, ME; Department of Computing Security, Rochester Institute of Technology, Rochester, NY",2016 IEEE Symposium on Technologies for Homeland Security (HST),"15 Sep 2016","2016","","","1","4","We describe the recent developments of an open-source project called RATCHET that can be used by groups of users to collectively construct attack trees. We present the RATCHET framework as well as a model for testing and evaluation of the produced attack trees. RATCHET has been tested in classroom settings with positive results and this paper presents the plans for expanding its outreach to the community at large and building attack trees through crowdsourcing. This paper gives an overview of RATCHET and an introduction to its use.","","978-1-5090-0770-7","10.1109/THS.2016.7568951","","https://ieeexplore.ieee.org/stamp/stamp.jsp?arnumber=7568951","crowdsourcing;attack tree;security;attack surface;evaluation","Testing;Crowdsourcing;Fault trees;Measurement;Analytical models;Information security","","4","","14","IEEE","15 Sep 2016","","","IEEE","IEEE Conferences"
"Incident Detection based on Multimodal data from Social Media using Deep Learning Methods","C. Fatichah; P. D. Sammy Wiyadi; D. Adni Navastara; N. Suciati; A. Munif","Department of Informatics, Institut Teknologi Sepuluh Nopember, Surabaya, Indonesia; Department of Informatics, Institut Teknologi Sepuluh Nopember, Surabaya, Indonesia; Department of Informatics, Institut Teknologi Sepuluh Nopember, Surabaya, Indonesia; Department of Informatics, Institut Teknologi Sepuluh Nopember, Surabaya, Indonesia; Department of Informatics, Institut Teknologi Sepuluh Nopember, Surabaya, Indonesia",2020 International Conference on ICT for Smart Society (ICISS),"4 Jan 2021","2020","","","1","6","Social media is one of the uses of crowdsourcing to gather vast amounts of information. The applications of incident detection using social media data are commonly focus on text analysis. Due to the ability of social media to capture variant data types such as text, voice, image, or video, the development of incident detection based on multimodal data is preferred. The use of multimodal data on incident detection is expected to improve the accuracy of prediction. This research aims to detect emergency incidents based on multimodal data streams from social media using deep learning methods. We compare several deep learning architectures that implement some neural network variants, namely Convolutional Neural Network (CNN) and Long Short-Term Memory (LSTM). We crawled data from Twitter API and labeled into three incident categories i.e. flood, traffic jam, and wildfire. The CNN and C-LSTM are used for text prediction, and the best performance obtained by C-LSTM and achieved 99.09% in the accuracy. The compared CNN models for image prediction are AlexNet, VGG16, VGG19, and SqueezeNet. The best performance obtained by VGG16 with data augmentation and achieved 99.08% in the accuracy. The incident detection results of multimodal data are obtained from the highest confidence level of text or image.","2640-0545","978-1-6654-0422-8","10.1109/ICISS50791.2020.9307555","","https://ieeexplore.ieee.org/stamp/stamp.jsp?arnumber=9307555","Incident detection;Deep learning;Convolutional Neural Network;Long Short-Term Memory;Social media data","Social networking (online);Blogs;Event detection;Feature extraction;Computer architecture;Training;Deep learning","","4","","20","IEEE","4 Jan 2021","","","IEEE","IEEE Conferences"
"Image tag completion and refinement by subspace clustering and matrix completion","Y. Hou; Z. Lin","Key Lab. of Machine Perception (MOE), Peking University, P. R. China; Key Lab. of Machine Perception (MOE), Peking University, P. R. China",2015 Visual Communications and Image Processing (VCIP),"25 Apr 2016","2015","","","1","4","Tag-based image retrieval (TBIR) has drawn much attention in recent years due to the explosive amount of digital images and crowdsourcing tags. However, the TBIR applications still suffer from the deficient and inaccurate tags provided by users. Inspired by the subspace clustering methods, we formulate the tag completion problem in a subspace clustering model which assumes that images are sampled from subspaces, and complete the tags using the state-of-the-art Low Rank Representation (LRR) method. And we propose a matrix completion algorithm to further refine the tags. Our empirical results on multiple benchmark datasets for image annotation show that the proposed algorithm outperforms state-of-the-art approaches when handling missing and noisy tags.","","978-1-4673-7314-2","10.1109/VCIP.2015.7457875","","https://ieeexplore.ieee.org/stamp/stamp.jsp?arnumber=7457875","Image Annotation;Subspace Clustering;Low Rank Representation;Matrix Completion;Tag Completion;Tag Refinement","Sparse matrices;Clustering algorithms;Noise measurement;Visualization;Image retrieval;Semantics;Dictionaries","","4","","22","IEEE","25 Apr 2016","","","IEEE","IEEE Conferences"
