"Video quality evaluation in the cloud","C. Keimel; J. Habigt; C. Horch; K. Diepold","Technische Universität München, Munich, Germany; Technische Universität München, Munich, Germany; Technische Universität München, Munich, Germany; Technische Universität München, Munich, Germany",2012 19th International Packet Video Workshop (PV),"2 Jul 2012","2012","","","155","160","Video quality evaluation with subjective testing is both time consuming and expensive. An interesting new approach to traditional testing is the so-called crowdsourcing, moving the testing effort into the internet. The QualityCrowd framework allows codec independent, crowd-based video quality assessment with a simple web interface, usable with common web browsers. However, due to its codec independent approach, the framework can pose high bandwidth requirements on the coordinating server. We therefore propose in this contribution a cloud-based extension of the QualityCrowd framework in order to perform subjective quality evaluation as a cloud application. Moreover, this allows us to access an even larger pool of potential participants due to the improved connectivity. We compare the results from an online subjective test using this framework with the results from a test in a standardized environment. This comparison shows that QualityCrowd delivers equivalent results within the acceptable inter-lab correlation.","2167-969X","978-1-4673-0301-9","10.1109/PV.2012.6229729","","https://ieeexplore.ieee.org/stamp/stamp.jsp?arnumber=6229729","","Servers;Testing;Video sequences;Browsers;Internet;Codecs;Visualization","","13","","18","IEEE","2 Jul 2012","","","IEEE","IEEE Conferences"
"Secure and Reliable Decentralized Truth Discovery Using Blockchain","Y. Tian; J. Yuan; H. Song","Department of ECSSE, Embry-Riddle Aeronautical University, Daytona Beach, FL; Department of ECSSE, Embry-Riddle Aeronautical University, Daytona Beach, FL; Department of ECSSE, Embry-Riddle Aeronautical University, Daytona Beach, FL",2019 IEEE Conference on Communications and Network Security (CNS),"19 Aug 2019","2019","","","1","8","Truth discovery with crowdsourcing has become increasingly popular in recent years by leveraging the wisdom of crowd to solve complex tasks. So far, many existing crowd-sourcing applications utilize a central server for deployment, which collects and processes data from a crowd of workers. However, this kind of centralized model also introduces security concerns, including data privacy, integrity of processed data, and single point of failure. In this paper, we propose a secure decentralized framework for truth discovery with a privacy-preserving and reliable realization. Instead of relying on the central servers (e.g., public cloud servers)to behave correctly, our framework delegates the data aggregation and processing tasks to distributed entities, whose behaviors are enforced and verified by utilizing the emerging blockchain-based smart contract technology. Meanwhile, as the blockchain lacks support for on-chain data confidentiality, we utilize the privacy-preserving solution and integrate it with blockchain for privacy protection. Moreover, given the decentralized nature of our framework, it also overcomes the limitation of single point of failure. We implement a prototype of our framework using Ethereum blockchain and demonstrate its practical performance.","","978-1-5386-7117-7","10.1109/CNS.2019.8802712","","https://ieeexplore.ieee.org/stamp/stamp.jsp?arnumber=8802712","","Blockchain;Task analysis;Smart contracts;Servers;Privacy;Conferences;Crowdsourcing","","13","","27","IEEE","19 Aug 2019","","","IEEE","IEEE Conferences"
"Mining User Interests to Predict Perceived Psycho-Demographic Traits on Twitter","S. Volkova; Y. Bachrach; B. Van Durme","Johns Hopkins University, Baltimore, MD; Microsoft Research, Cambridge, UK; Johns Hopkins University, Baltimore, MD, US",2016 IEEE Second International Conference on Big Data Computing Service and Applications (BigDataService),"23 May 2016","2016","","","36","43","We analyze the relation between user interests and their perceived psychodemographic attributes using Twitter data, training models for predicting various personal traits of users. In contrast to existing work, which bases predictions on the textual tweets produced by users, we leverage the fact that users are embedded in the Twitter social network. We examine the accounts that our users follow, and use them to determine the high-level interests of these users, then use these areas of interest as features for predicting perceived personal traits. We cover target attributes such as gender, age, educational background, political stand and personality. We evaluate our technique on a dataset of over 4,000 Twitter user profiles. We use crowdsourcing to annotate these user profiles with perceptions regarding their personal traits, and correlate these with user interests, as captured by the accounts they follow and their classification in the Twitter ""Who To Follow"" hierarchy. We compare the accuracy of our personal trait prediction methods with the state-of-the-art approaches that solely rely on user tweets, and discuss the correlations between perceived user demographics and interests.","","978-1-5090-2251-9","10.1109/BigDataService.2016.28","","https://ieeexplore.ieee.org/stamp/stamp.jsp?arnumber=7474353","Social network analytics;Twitter;Psycho-demographic traits","Twitter;Facebook;Crowdsourcing;Recommender systems;Electronic mail;Pragmatics","","13","","60","IEEE","23 May 2016","","","IEEE","IEEE Conferences"
"Using Public Private Partnership models in smart cities - proposal for Croatia","M. Milenković; M. Rašić; G. Vojković","Faculty of Transport and Traffic Sciences, University of Zagreb, Zagreb, Croatia; Department of Law, Zagreb School of Economics and Management, Zagreb, Croatia; Faculty of Transport and Traffic Sciences, University of Zagreb, Zagreb, Croatia","2017 40th International Convention on Information and Communication Technology, Electronics and Microelectronics (MIPRO)","13 Jul 2017","2017","","","1412","1417","How smart is a “smart city”? According to Asian examples of newly growing smart cities, usage of technology can improve life standard and reduce cost of living, improve operational efficiency, environmental sustainability, eco-friendly infrastructure, smart technology Internet of Things (IoT), smart living and direct citizen participation in decision making process. Learning, adaptation and innovation could be the future for Croatian cities by using all mentioned, which will improve social, regulatory and safety indicators for designing a better living environment for Croatian citizens. While using Public Private Partnership (PPP) models, crowdsourcing and democratic ecologies which provide better and more efficient public services by taking advantage of private sector's “know-how”, cities will create long-term investment opportunities and sustain real time optimization strategies by providing safe and reliable place to invest. The intention of this paper is to show how the (local) government's role in PPP projects is to evaluate and approve detailed execution plans of the concessionaire while the private partner's role is to design, build, finance, and operate the facilities. In futuro, digital technologies offer numerous possibilities for citizen participation in decision making at local and regional government level.","","978-953-233-090-8","10.23919/MIPRO.2017.7973643","","https://ieeexplore.ieee.org/stamp/stamp.jsp?arnumber=7973643","Internet of Things;smart city;Public Private Partnership;concession models;public procurement;decision making","Smart cities;Government;Europe;Biological system modeling;Sociology;Statistics","","13","","28","","13 Jul 2017","","","IEEE","IEEE Conferences"
"Collective intelligence for the design of emergency response","A. S. Vivacqua; M. R. S. Borges","Institute of Mathematics UFRJ, Universidade Federal do Rio de Janeiro, Rio de Janeiro, Brazil; Institute of Mathematics NCE-Electronic Computing Institute UFRJ, Universidade Federal do Rio de Janeiro, Rio de Janeiro, Brazil",The 2010 14th International Conference on Computer Supported Cooperative Work in Design,"24 May 2010","2010","","","623","628","Collective Intelligence has received much attention in recent years, as organizations and businesses discover the power of crowds. With new technologies, such as blogs, twitter, wikis, photo sharing, collaborative tagging and social networking sites, people may create and disseminate content as never before. Many organizations are looking for ways to harness this power, which is being called collective intelligence. Additionally, many open-source initiatives have shown that it is possible to obtain high quality results from collectively produced work. In this paper, we consider the domain of emergency response. We have been working in this domain for a few years now, mostly focusing on small disaster relief groups and field command. One of the command problems is lack of information about the location where the disaster occurred. We believe some of this information could be crowdsourced, changing current practices and enabling more effective response to the situation. In this paper, we discuss the possibilities for crowdsourcing and present an initial proposal for harnessing collective intelligence for the fire department.","","978-1-4244-6763-1","10.1109/CSCWD.2010.5471897","","https://ieeexplore.ieee.org/stamp/stamp.jsp?arnumber=5471897","collective intelligence;crowdsourcing;disaster relief","Fires;Collaborative work;Informatics;Computer science;Mathematics;Blogs;Social network services;Mashups;Tagging;Proposals","","12","","14","IEEE","24 May 2010","","","IEEE","IEEE Conferences"
"A WiFi-Direct Based Local Communication System","Z. Wang; F. Li; X. Wang; T. Li; T. Hong","Software College of Northeastern University, Northeastern University, Shenyang, China; Ministry of Education, Southeast University; School of Computer Science and Engineering, Northeastern University, Shenyang, China; School of Computer Science and Engineering, Northeastern University, Shenyang, China; School of Computer Science and Engineering, Northeastern University, Shenyang, China",2018 IEEE/ACM 26th International Symposium on Quality of Service (IWQoS),"24 Jan 2019","2018","","","1","6","The infrastructure-based networks will be unavailable in the case of infrastructure failures (e.g., earthquake and tsunami) or in crowded areas (e.g., concert and conference hall). This promotes the evolution of location communication systems, which also benefit offloading computing, mobile edge computing and mobile crowdsourcing. In this paper, we utilize Wi-Fi Direct (WFD) to develop a local communication system. We not only present an intra-group communication solution by the native characteristics of WFD, but also propose a general solution for the bidirectional inter-group communication, which is beyond the scope of WFD specifications. Experimental results show that the maximum throughput of intra-group communication could reach up to 31.7 Mbps, and the maximum throughput of inter-group communication is 8.26 Mbps.","1548-615X","978-1-5386-2542-2","10.1109/IWQoS.2018.8624171","","https://ieeexplore.ieee.org/stamp/stamp.jsp?arnumber=8624171","","Wireless fidelity;Relays;Cloud computing;Mobile handsets;Unicast;Throughput","","12","","14","IEEE","24 Jan 2019","","","IEEE","IEEE Conferences"
"Ambiguity Helps: Classification with Disagreements in Crowdsourced Annotations","V. Sharmanska; D. Hernández-Lobato; J. M. Hernández-Lobato; N. Quadrianto","SMiLe CLiNiC, University of Sussex, Brighton, UK; Universidad Autónoma de Madrid, Madrid, Spain; Harvard University, Cambridge, Massachusetts, US; SMiLe CLiNiC, University of Sussex, Brighton, UK",2016 IEEE Conference on Computer Vision and Pattern Recognition (CVPR),"12 Dec 2016","2016","","","2194","2202","Imagine we show an image to a person and ask her/him to decide whether the scene in the image is warm or not warm, and whether it is easy or not to spot a squirrel in the image. For exactly the same image, the answers to those questions are likely to differ from person to person. This is because the task is inherently ambiguous. Such an ambiguous, therefore challenging, task is pushing the boundary of computer vision in showing what can and can not be learned from visual data. Crowdsourcing has been invaluable for collecting annotations. This is particularly so for a task that goes beyond a clear-cut dichotomy as multiple human judgments per image are needed to reach a consensus. This paper makes conceptual and technical contributions. On the conceptual side, we define disagreements among annotators as privileged information about the data instance. On the technical side, we propose a framework to incorporate annotation disagreements into the classifiers. The proposed framework is simple, relatively fast, and outperforms classifiers that do not take into account the disagreements, especially if tested on high confidence annotations.","1063-6919","978-1-4673-8851-1","10.1109/CVPR.2016.241","","https://ieeexplore.ieee.org/stamp/stamp.jsp?arnumber=7780610","","Gaussian processes;Probabilistic logic;Crowdsourcing;Support vector machines;Noise measurement;Training;Computer vision","","12","","38","IEEE","12 Dec 2016","","","IEEE","IEEE Conferences"
"Crowdsharing Wireless Energy Services","A. Lakhdari; A. Abusafia; A. Bouguettaya","School of Computer Science, University of Sydney, Sydney, Australia; School of Computer Science, University of Sydney, Sydney, Australia; School of Computer Science, University of Sydney, Sydney, Australia",2020 IEEE 6th International Conference on Collaboration and Internet Computing (CIC),"20 Jan 2021","2020","","","18","24","We propose a novel self-sustained ecosystem for energy sharing in the IoT environment. We leverage energy harvesting, wireless power transfer, and crowdsourcing that facilitate the development of an energy crowdsharing framework to charge IoT devices. The ubiquity of IoT devices coupled with the potential ability for sharing energy provides new and exciting opportunities to crowdsource wireless energy, thus enabling a green alternative for powering IoT devices anytime and anywhere. We discuss the crowdsharing of energy services, open challenges, and proposed solutions.","","978-1-7281-4146-6","10.1109/CIC50333.2020.00013","Australian Research Council(grant numbers:DP160103595,LE180100158); ","https://ieeexplore.ieee.org/stamp/stamp.jsp?arnumber=9319029","IoT;energy;service;crowdsharing;sustainable;green IoT crowdsourcing","Internet of Things;Wireless communication;Ecosystems;Inductive charging;Wearable computers;Microcell networks;Green products","","12","","41","IEEE","20 Jan 2021","","","IEEE","IEEE Conferences"
"Towards Crowdsourced Signal Map Construction via Implicit Interaction of IoT Devices","S. He; S. . -H. G. Chan","Department of Computer Science and Engineering, The Hong Kong University of Science and Technology; Department of Computer Science and Engineering, The Hong Kong University of Science and Technology","2017 14th Annual IEEE International Conference on Sensing, Communication, and Networking (SECON)","3 Jul 2017","2017","","","1","9","Site survey cost has become a major deployment challenge for large-scale wireless systems. Some previous approaches require explicit user inputs to label the locations of crowdsourced signals, which is inconvenient in practice. Others may rely on intensively-calibrated specialized sensors. Furthermore, the locations of crowdsourced signals are usually random and sparse, making it difficult to build a complete signal map. To address these, we propose Surecose, a novel signal map construction system by implicit crowdsourcing and interaction of low-cost cooperative sensors. Surecose is initialized with the light-weight sparse signal map collection. Having the background application on, the naive users are implicit surveyors unknowingly uploading crowdsourced signals. Phones may detect each other (mobile sensors), or beacons (fixed sensors). To label their locations, Surecose measures the mutual sensor proximity of the IoT devices. Via joint location labeling and sensor calibration, Surecose transparently locates the users despite devices used. Then Surecose constructs the database with a directionally and environmentally adapted Gaussian process, which scales the labeled locations and RSSIs anywhere into a complete signal map. Extensive experiments in diverse environments, including a campus hall, an international airport and a premium shopping mall, have validated that Surecose can adaptively and accurately construct the Wi-Fi signal map (often more than 20% reduction in RSSI construction error), with low survey cost (around 70% survey reduction) and little human intervention.","2155-5494","978-1-5090-6599-8","10.1109/SAHCN.2017.7964901","","https://ieeexplore.ieee.org/stamp/stamp.jsp?arnumber=7964901","","Sensors;Labeling;Mobile communication;Wireless fidelity;Crowdsourcing;Calibration;Databases","","11","","26","IEEE","3 Jul 2017","","","IEEE","IEEE Conferences"
"Crowdsourced Exploration of Mobile App Features: A Case Study of the Fort McMurray Wildfire","M. Nayebi; M. Marbouti; R. Quapp; F. Maurer; G. Ruhe","SEDS laboratory, University of Calgary, Calgary, Canada; SEDS laboratory, University of Calgary, Calgary, Canada; SEDS laboratory, University of Calgary, Calgary, Canada; ASE labratory, University of Calgary, Calgary, Canada; ASE labratory, University of Calgary, Calgary, Canada",2017 IEEE/ACM 39th International Conference on Software Engineering: Software Engineering in Society Track (ICSE-SEIS),"29 Jun 2017","2017","","","57","66","The ubiquity of mobile devices has led to unprecedented growth in not only the usage of apps, but also their capacity to meet people's needs. Smart phones take on a heightened role in emergency situations, as they may suddenly be among their owner's only possessions and resources. The 2016 wildfire in Fort McMurray, Canada, intrigued us to study the functionality of the existing apps by analyzing social media information. We investigated a method to suggest features that are useful for emergency apps. Our proposed method called MAPFEAT, combines various machine learning techniques to analyze tweets in conjunction with crowdsourcing and guides an extended search in app stores to find currently missing features in emergency apps based on the needs stated in social media. MAPFEAT is evaluated by a real-world case study of the Fort McMurray wildfire, where we analyzed 69,680 unique tweets recorded over a period from May 2nd to May 7th, 2016. We found that (i) existing wildfire apps covered a range of 28 features with not all of them being considered helpful or essential, (ii) a large range of needs articulated in tweets can be mapped to features existing in non-emergency related apps, and (iii) MAPFEAT's suggested feature set is better aligned with the needs expressed by general public. Only six of the features existing in wildfire apps is among top 40 crowdsourced features explored by MAPFEAT, with the most important one just ranked 13th. By using MAPFEAT, we proactively understand victims' needs and suggest mobile software support to the people impacted. MAPFEAT looks beyond the current functionality of apps in the same domain and extracts features using variety of crowdsourced data.","","978-1-5386-2673-3","10.1109/ICSE-SEIS.2017.8","","https://ieeexplore.ieee.org/stamp/stamp.jsp?arnumber=7961668","Wildfire;Emergency;App store mining;Twitter;Mobile apps;Machine learning","Real-time systems;Mobile communication;Feature extraction;Software;Data mining;Twitter","","11","","36","IEEE","29 Jun 2017","","","IEEE","IEEE Conferences"
"Participation in crowd systems","L. R. Varshney","IBM Thomas J. Watson Research Center, USA","2012 50th Annual Allerton Conference on Communication, Control, and Computing (Allerton)","21 Mar 2013","2012","","","996","1001","There is growing interest in using crowds of human workers to perform information processing tasks that are difficult for machines. At IBM, we have deployed a large internal crowdsourcing contest system for software development, which has now successfully completed thousands of tasks. Contrary to concerns of power efficiency and bandwidth in machine systems, player participation and motivation are key concerns in such crowd-based human computation systems. In this paper, we demonstrate that player participation is well-described by a power-law distribution, much like Lotka's Law of scientific productivity. We further describe a momentum-based generative model for participation that explains the observed empirical phenomenon and provide a thermodynamic interpretation, discussing what it means for a crowd system to heat up. Overall, player motivation is essential for driving participation and ensuring a reliable delivery platform; several intrinsic, extrinsic, and social motivators have been identified.","","978-1-4673-4539-2","10.1109/Allerton.2012.6483327","","https://ieeexplore.ieee.org/stamp/stamp.jsp?arnumber=6483327","","Liquids;Thermodynamics;Information processing;Friction;Encyclopedias;Electronic publishing","","11","","41","IEEE","21 Mar 2013","","","IEEE","IEEE Conferences"
"I want to ride my bicycle: A microservice-based use case for a MaaS architecture","F. Callegati; G. Delnevo; A. Melis; S. Mirri; M. Prandini; P. Salomoni","Department of Electrical and Information Engineering, Università di Bologna, Italy; Department of Computer Science and Engineering, Università di Bologna, Italy; Department of Electrical and Information Engineering, Università di Bologna, Italy; Department of Computer Science and Engineering, Università di Bologna, Italy; Department of Computer Science and Engineering, Università di Bologna, Italy; Department of Computer Science and Engineering, Università di Bologna, Italy",2017 IEEE Symposium on Computers and Communications (ISCC),"4 Sep 2017","2017","","","18","22","This work presents a use case on multimodal urban paths in a smart mobility context. The proposed solution builds on the experience already matured and developed by the authors in different fields: crowdsourcing and sensing done by users to gather data related to urban barriers and facilities, computation of personalized paths for users with special needs, and integration of open data provided by bus companies to identify the actual accessibility features and estimate the real arrival time of vehicles at stops. In terms of functionality, the first “monolithic” prototype fulfilled the goal of composing the aforementioned pieces of information to support citizens with reduced mobility (users with disabilities and/or elderly people) in their urban movements. In this paper, we describe a service-oriented architecture that exploits the microservices orchestration paradigm to enable the creation of new services and to make the management of the various data sources easier and more effective. The manuscript demonstrates the effectiveness of the approach showing a successful use case of a service that take into account multimodal paths, by involving cyclists, bicycle lanes, and bike sharing services in a urban environments. Such a use case take into account the user's interface and interaction mechanisms, which are strongly affected by the context of use.","","978-1-5386-1629-1","10.1109/ISCC.2017.8024498","","https://ieeexplore.ieee.org/stamp/stamp.jsp?arnumber=8024498","smart city;open data;crowdsourcing;crowdsensing;smart mobility;SOA;MaaS;orchestration","Sensors;Smart cities;Computer architecture;Crowdsourcing;Planning;Software","","11","","26","IEEE","4 Sep 2017","","","IEEE","IEEE Conferences"
"AVrate Voyager: an open source online testing platform","S. Göring; R. R. Ramachandra Rao; S. Fremerey; A. Raake","Audio Visual Technology Group, Technische Universität Ilmenau, Germany; Audio Visual Technology Group, Technische Universität Ilmenau, Germany; Audio Visual Technology Group, Technische Universität Ilmenau, Germany; Audio Visual Technology Group, Technische Universität Ilmenau, Germany",2021 IEEE 23rd International Workshop on Multimedia Signal Processing (MMSP),"16 Mar 2022","2021","","","1","6","Subjective testing is an integral part of many research fields considering, e.g., human perception. For this purpose, lab tests are a popular approach to gather ratings for subjective evaluations. However, not in all cases controlled lab tests can be performed, either in cases where no labs are existing, accessible or it may be disallowed to use them. For this reason, online tests, e.g., using crowdsourcing are supposed to be an alternative approach for traditional lab tests. We describe in the following paper a framework to implement such online tests for audio, video, and image-related evaluations or questionnaires. Our framework AVrate Voyager builds upon previously developed frameworks for lab tests including the experience with them. AVrate Voyager uses scalable web technologies to implement a test framework, this ensures that it will be running reliably. In addition, we added strategies for pre-caching to avoid additional influence for play-out, e.g. in the case of video testing. We analyze several conducted tests using the new framework and describe the required steps to modify the provided tool in detail.","2473-3628","978-1-6654-3288-7","10.1109/MMSP53017.2021.9733561","","https://ieeexplore.ieee.org/stamp/stamp.jsp?arnumber=9733561","subjective testing;online testing","Point cloud compression;Head-mounted displays;Signal processing;Browsers;Quality assessment;Reliability;Labeling","","11","","38","IEEE","16 Mar 2022","","","IEEE","IEEE Conferences"
