"Semi-Automatic Crowdsourcing Tool for Online Food Image Collection and Annotation","Z. Shao; R. Mao; F. Zhu","School of Electrical and Computer Engineering, Purdue University, West Lafayette, Indiana, USA; School of Electrical and Computer Engineering, Purdue University, West Lafayette, Indiana, USA; School of Electrical and Computer Engineering, Purdue University, West Lafayette, Indiana, USA",2019 IEEE International Conference on Big Data (Big Data),"24 Feb 2020","2019","","","5186","5189","Assessing dietary intake accurately remains an open and challenging research problem. In recent years, image-based approaches have been developed to automatically estimate food intake by capturing eat occasions with mobile devices and wearable cameras. To build a reliable machine-learning models that can automatically map pixels to calories, successful image-based systems need large collections of food images with high quality groundtruth labels to improve the learned models. In this paper, we introduce a semi-automatic system for online food image collection and annotation. Our system consists of a web crawler, an automatic food detection method and a web-based crowdsoucing tool. The web crawler is used to download large sets of online food images based on the given food labels. Since not all retrieved images contain foods, we introduce an automatic food detection method to remove irrelevant images. We designed a web-based crowdsourcing tool to assist the crowd or human annotators to locate and label all the foods in the images. The proposed semi-automatic online food image collection system can be used to build large food image datasets with groundtruth labels efficiently from scratch.","","978-1-7281-0858-2","10.1109/BigData47090.2019.9006165","","https://ieeexplore.ieee.org/stamp/stamp.jsp?arnumber=9006165","Crowdsourcing;Food Image Analysis;Dietary Assessment","Noise measurement;Tools;Task analysis;Crowdsourcing;Crawlers;Machine learning","","3","","36","IEEE","24 Feb 2020","","","IEEE","IEEE Conferences"
"A Threefold Similarity Analysis of Crowdsourcing Feeds","K. Liu; G. Motta; L. You; T. Ma","Dept. of Industrial and Information Engineering, University of Pavia, Pavia, Italy; Dept. of Industrial and Information Engineering, University of Pavia, Pavia, Italy; Dept. of Industrial and Information Engineering, University of Pavia, Pavia, Italy; Dept. of Industrial and Information Engineering, University of Pavia, Pavia, Italy",2015 International Conference on Service Science (ICSS),"8 Feb 2016","2015","","","93","98","Crowdsourcing is a valuable social sensing for the smarter city. We present an approach for classifying crowd sourced feeds from a threefold point of view, namely image, text, and geography. The main idea is to extract feeds within a specific geographic range, and then analyze similarity of image color and text semantic. The approach enables to identify feeds that report the same issue, hence filtering redundant information. Based on proved methods and algorithms, such approach has been implemented in a software application, called CITY FEED, that is used by the Municipality of Pavia.","2165-3836","978-1-4799-9947-7","10.1109/ICSS.2015.14","","https://ieeexplore.ieee.org/stamp/stamp.jsp?arnumber=7400779","Crowdsourcing;Smart city;Image similarity analysis;Text similarity analysis","Feeds;Cities and towns;Image color analysis;Histograms;Semantics;Integrated circuit modeling","","3","","29","IEEE","8 Feb 2016","","","IEEE","IEEE Conferences"
"A crowdsourcing approach to protect against novel malware threats","C. Christoforidis; V. Vlachos; I. Androulidakis","Department of Computer Science and Engineering, Technological Educational Institute of Thessaly, Greece; Department of Computer Science and Engineering, Technological Educational Institute of Thessaly, Greece; University of Ioannina, Greece",2014 22nd Telecommunications Forum Telfor (TELFOR),"9 Feb 2015","2014","","","1063","1066","Worm attacks for more than two decades have been affecting the Internet causing instability and economic loses. In a huge pool of possible victims such as the Internet there can exist many targets running the same software with the same vulnerabilities. To prevent such targets from getting infected one can use the crowd experience to identify a possible attack and restrict the use of possible vulnerable software for a certain period. Crowdsourcing intelligence or collaborative intelligence is the power of many when each one in a group of participants shares certain information. It is characterized by enhancing information accuracy which further improves decision making on the group. This paper presents and analyzes NetBuckler, a collaborative client application which employs collaborative intelligence to defend against Internet worms. It also briefly presents JXTA and its potential.","","978-1-4799-6191-7","10.1109/TELFOR.2014.7034590","","https://ieeexplore.ieee.org/stamp/stamp.jsp?arnumber=7034590","collaborative intelligence;JXTA;peer-to-peer;windows;worm protection","Grippers;Peer-to-peer computing;Intrusion detection;Internet;Collaboration;Operating systems","","3","","42","IEEE","9 Feb 2015","","","IEEE","IEEE Conferences"
"Automated crowd flow estimation enhanced by crowdsourcing","J. Ribera; K. Tahboub; E. J. Delp","Universitat Politècnica de Catalunya, Barcelona, Spain; Universitat Politècnica de Catalunya, Barcelona, Spain; Universitat Politècnica de Catalunya, Barcelona, Spain",NAECON 2014 - IEEE National Aerospace and Electronics Conference,"23 Feb 2015","2014","","","174","179","Video surveillance systems that contain a large number of cameras makes the continuous monitoring of the video feeds nearly an impossible task. If the information from these many cameras is to be exploited automatic video analytic techniques must be developed. In this paper, we present improvements to a previously developed crowd flow estimation method. We use crowdsourcing techniques to enhance the performance. An experimental evaluation is conducted using publicly available datasets.","2379-2027","978-1-4799-4689-1","10.1109/NAECON.2014.7045798","","https://ieeexplore.ieee.org/stamp/stamp.jsp?arnumber=7045798","crowd flow estimation;crowd analysis;people counting;crowdsourcing","Crowdsourcing;Vectors;Training;Support vector machine classification;Estimation;Uncertainty;Error analysis","","3","","21","IEEE","23 Feb 2015","","","IEEE","IEEE Conferences"
"Deriving perceptual gradation OF L2 English mispronunciations using crowdsourcing and the WorkerRank algorithm","H. Wang; H. Meng","Department of Systems Engineerin g and Engineering Management, Chinese University of Hong Kong, Hong Kong, China; Department of Systems Engineerin g and Engineering Management, Chinese University of Hong Kong, Hong Kong, China",2012 International Conference on Speech Database and Assessments,"31 Jan 2013","2012","","","145","150","Pedagogically, feedback in CAPT systems can be improved by focusing on the most critical errors rather than presenting all errors to the users at the same time. This paper presents our work on the use of crowdsourcing for collection of gradations of word-level mispronunciations in non-native English speech. Quality control procedures based on the proposed WorkerRank algorithm (adapted from well-known PageRank algorithm), are performed for selecting a subset of the crowdsourced data in order to ensure reliability. Based on the selected data, we derive a set of rated word-level mispronunciations, according to a four-point gradation of no error, subtle, medium and salient errors.","","978-1-4673-2810-4","10.1109/ICSDA.2012.6422468","","https://ieeexplore.ieee.org/stamp/stamp.jsp?arnumber=6422468","CAPT;Crowdsourcing;mispronunciation gradation;WorkerRank","Reliability;Speech;Humans;Materials;Equations;Mathematical model;Vectors","","3","","13","IEEE","31 Jan 2013","","","IEEE","IEEE Conferences"
"Indoor Floor Map Crowdsourcing Building Method Based on Inertial Measurement Unit Data","L. Ma; L. Tang; Y. Xu; Y. Cui","Communication Research Center, Harbin Institute of Technology, Harbin, China; Communication Research Center, Harbin Institute of Technology, Harbin, China; Communication Research Center, Harbin Institute of Technology, Harbin, China; Communication Research Center, Harbin Institute of Technology, Harbin, China",2017 IEEE 85th Vehicular Technology Conference (VTC Spring),"16 Nov 2017","2017","","","1","5","Currently, the indoor navigation has attracted lots of attention and been considered as the most prominent technology in the future. However, the biggest obstacle that hinders the promotion of the indoor navigation is the cost of building floor map. In the unknown indoor environment, it will take a lot of resources to acquire or build indoor floor map. Therefore, in this paper, in order to reduce the floor map building cost, we mainly propose to utilize the pedestrian dead reckoning (PDR) method through massive users' inertial measurement unit (IMU) data to build indoor floor map. We proposed a novel algorithm through the density analysis of massive crowdsourcing trajectories, and keep the most proper trajectories with the suitable hotspots to generate floor map. The proposed algorithm relies on the improved PDR algorithm based on the proposed indoor walking model. We have implemented the proposed algorithm in our lab and evaluated its performances. The simulation results show that the proposed algorithm could automatically generate the floor map in the unknown environments with lower cost, which would contribute a lot for the indoor navigation technology.","","978-1-5090-5932-4","10.1109/VTCSpring.2017.8108337","","https://ieeexplore.ieee.org/stamp/stamp.jsp?arnumber=8108337","","Trajectory;Floors;Legged locomotion;Crowdsourcing;Indoor navigation;Algorithm design and analysis","","3","","12","IEEE","16 Nov 2017","","","IEEE","IEEE Conferences"
"A hybrid approach for Thai word segmentation with crowdsourcing feedback system","K. Chaonithi; S. Prom-on","Computer Engineering Department, King Mongkut's University of Technology Thonburi, Bangkok, Thailand; Computer Engineering Department, King Mongkut's University of Technology Thonburi, Bangkok, Thailand","2016 13th International Conference on Electrical Engineering/Electronics, Computer, Telecommunications and Information Technology (ECTI-CON)","8 Sep 2016","2016","","","1","6","This paper proposes a new hybrid method for Thai word segmentation using crowd-sourced dictionary integrated with word bi-gram model. The main dictionary is extracted into basic and compound word dictionaries to improve dictionary based algorithm performance. The word segmentation process begins with heuristic exhaustive matching algorithm using basic word dictionary to generate all possible basic word sequence candidates from an input string. Then, the best candidate is selected by word bi-gram model to solve ambiguity problem. Finally, the sequence of basic words is combined into compound words with compound word dictionary. Another part of this work is applying crowdsourcing paradigm. We implemented a web application for training bi-gram model and dictionary updates from user feedbacks. This process improves the lexical knowledge of the platform over the time. The algorithm was evaluated with two corpora. With InterBEST 2009 corpus, the proposed algorithm yields average precision, recall and f-measure at 97.52%, 97.70%, and 97.63%. With social network corpus, the proposed method yields average precision, recall and f-measure at 98.47%, 98.59%, and 98.54% respectively.","","978-1-4673-9749-0","10.1109/ECTICon.2016.7561298","","https://ieeexplore.ieee.org/stamp/stamp.jsp?arnumber=7561298","word segmentation;hybrid method;crowdsourcing;machine learning;exhaustive matching;bi-gram;web service","Dictionaries;Training;Compounds;Crowdsourcing;Computers;Merging;Heuristic algorithms","","3","","10","IEEE","8 Sep 2016","","","IEEE","IEEE Conferences"
"Enabling a Massive Data Collection for Hotel Receptionist Chatbot Using a Crowdsourcing Information System","R. Levannoza; R. F. Latif; S. I. Nurkafianti; K. Oktriono; Devina; C. K. Wiharja; T. W. Cenggoro","Computer Science Department, School of Computer Science, Bina Nusantara University, Jakarta, Indonesia; Computer Science Department, School of Computer Science, Bina Nusantara University, Jakarta, Indonesia; Computer Science Department, School of Computer Science, Bina Nusantara University, Jakarta, Indonesia; Language Center, Tourism Destination, Faculty of Humanities, Bina Nusantara University, Jakarta, Indonesia; Language Center, Industrial Engineering, Faculty of Humanities, Bina Nusantara University, Jakarta, Indonesia; Language Center, Computer Science Department, Faculty of Humanities, Bina Nusantara University, Jakarta, Indonesia; Computer Science Department, Bioinformatics and Data Science Research Center, School of Computer Science, Bina Nusantara University, Jakarta, Indonesia",2020 International Conference on Information Management and Technology (ICIMTech),"2 Oct 2020","2020","","","213","217","With the heavy utilization of deep learning, modern chatbot systems require massive training dataset to achieve their peak performance. Without exception, the development of chatbot for the hotel receptionist tasks also demands a massive training dataset. Unfortunately, laborious effort and hefty time are needed to manually collect a dataset with that size. Therefore, an information system is needed to assist the dataset collection. In regards to solve the problem, this research contributes in developing the information system that enables a massive data collection for training a hotel receptionist chatbot in a reasonable time. In detail, the contribution of this research are twofold: (1) developing a realiable crowdsourcing information system design to collect and store the dataset for training hotel receptionist chatbot; and (2) developing a user experience that can stimulate the crowdworkers to provide more data.","","978-1-7281-7071-8","10.1109/ICIMTech50083.2020.9211162","","https://ieeexplore.ieee.org/stamp/stamp.jsp?arnumber=9211162","crowdsourcing;data collection;chatbot;hotel receptionist chatbot","Crowdsourcing;Computer science;Training;Task analysis;Natural language processing;Information management","","3","","16","IEEE","2 Oct 2020","","","IEEE","IEEE Conferences"
"Interoperability and Scalability for Worker-Job Matching across Crowdsourcing Platforms","J. Jarrett; M. B. Blake","College of Computing and Informatics, Drexel University, Philadelphia, PA, USA; College of Computing and Informatics, Drexel University, Philadelphia, PA, USA",2017 IEEE 26th International Conference on Enabling Technologies: Infrastructure for Collaborative Enterprises (WETICE),"10 Aug 2017","2017","","","3","8","Crowdsourcing labor market platforms consist of a variety of jobs spanning multiple problem domains and their respective specialized or diverse worker pools. Each platform currently operates independently and isolated from the potential benefits of sharing job and worker pool data across platforms. Previous work introduces infrastructure that optimizes the sharing of both job and worker data collectively, called the open push-pull model. In this paper, to support automated recommendation of workers, we introduce an interoperability standard and computational method that facilitates the aggregation of job data while supporting scalability in response to increasing volumes of data. (i.e. workers and jobs continuously entering the system).","","978-1-5386-1759-5","10.1109/WETICE.2017.8","","https://ieeexplore.ieee.org/stamp/stamp.jsp?arnumber=8003776","crowdsourcing;recommender systems;human computation;scalability;interoperability","Crowdsourcing;Collaboration;Engines;Matrix converters;Scalability;Data models;Adaptation models","","3","","16","IEEE","10 Aug 2017","","","IEEE","IEEE Conferences"
"Crowdsourcing: Dynamic Data Management in Mobile P2P Networks","S. K. Madria; A. Mondal","Missouri University of Science and Technology, Rolla, USA; Indraprastha Institute of Information Technology, Delhi, India",2012 IEEE 13th International Conference on Mobile Data Management,"10 Nov 2012","2012","","","364","367","For realizing such crowdsourcing-related M-P2P applications, dynamic data management becomes a necessity to improve data availability, given the mobility and fragile wireless connections that connect resource-constrained mobile devices. Moreover, unlike in the case of traditional environments such as clusters, free-riding is a major issue for M-P2P environments, thereby implying that economic models may play a better role in incentivizing peers to collaborate for data discovery and management. Furthermore, traditional methods of data management in mobile environments generally consider only single-hop client-server communication. On the other hand,in M-P2P networks, the network communication is multihop and mobile devices can collect real-time data. Finally, privacy issues need to be addressed effectively to prevent location-based service providers from misusing users' location information.","2375-0324","978-0-7695-4713-8","10.1109/MDM.2012.21","","https://ieeexplore.ieee.org/stamp/stamp.jsp?arnumber=6341421","Mobile P2P;crowdsourcing;data replication;caching","Mobile communication;Mobile computing;Peer to peer computing;Mobile handsets;Ad hoc networks;Economics;Privacy","","3","","33","IEEE","10 Nov 2012","","","IEEE","IEEE Conferences"
"Crowdsourcing platform for collaboration management in vulnerability verification","H. -J. Su; J. -Y. Pan","Department of Communications Engineering, National Chung Cheng University, Taiwan, R.O.C.; Department of Communications Engineering, National Chung Cheng University, Taiwan, R.O.C.",2016 18th Asia-Pacific Network Operations and Management Symposium (APNOMS),"10 Nov 2016","2016","","","1","4","In recent years, vulnerability collection platforms become an important part to facilitate development of information security. Usually, platform administrators collect and ratify vulnerability information, which white hat hackers report at first hand, and users hence know which applications have doubts via vulnerability reports published on the platform. However, there are still few reported but unverified vulnerabilities, which may be caused from scarcity of testing targets and limitation of man power. These vulnerabilities might agitate those users who have related applications. This study initiates crowdsourcing to vulnerability collection platforms. The proposed platform collaborates administrators with two new added roles, script writers and target providers, aiming at vulnerability verification. In addition we design two agents, the test scheduler and the log collector, to automatically arrange test cases and collect logs, respectively. With properly scoring on task assignment, these crowd sources can effectively and efficiently collaborate on verification of timely and severe vulnerabilities. Hence this platform can speed up the progress of vulnerability assessment in information security.","","978-4-88552-304-5","10.1109/APNOMS.2016.7737235","","https://ieeexplore.ieee.org/stamp/stamp.jsp?arnumber=7737235","crowdsourcing platform;collaboration management;vulnerability verification","Crowdsourcing;Servers;Collaboration;Computer hacking;Software","","2","1","19","","10 Nov 2016","","","IEEE","IEEE Conferences"
"Data mining of relationship in crowdsourcing projects and social activities of citizens","V. Putrenko","World Data Center for Geoinformatics and Sustainable Development, Igor Sikorsky KPI, Kyiv, Ukraine",2017 IEEE First Ukraine Conference on Electrical and Computer Engineering (UKRCON),"9 Nov 2017","2017","","","1060","1065","This paper considered defining relationships between various the social activity of the population of the region and the quantitative characteristics of its representation in crowdsourcing project OpenStreetMap (OSM). The research of factors that influence to the social activity of the population and creating volunteered geographic information was performed. Assumption about a correlation between social activity of population and OSM data is verified based on constructing spatial data mining models for example of territory of Ukraine. The basic geographical peculiarities of the distribution relationships and the possibility of their use in regional studies were marked.","","978-1-5090-3006-4","10.1109/UKRCON.2017.8100413","","https://ieeexplore.ieee.org/stamp/stamp.jsp?arnumber=8100413","OpenStreetMap;volunteered geographic information;spatial data mining","Sociology;Statistics;Geospatial analysis;Urban areas;Internet;Buildings;Standards","","2","","19","IEEE","9 Nov 2017","","","IEEE","IEEE Conferences"
"Design and implementation the concept of crowdsourcing on a web portal Crime","F. I. Maulana; A. S. Prihatmanto; C. S. Kim","School of Electrical Engineering and Informatics, Bandung Institute of Technology, Indonesia; Centre of ICT Research, Bandung Institute of Technology, Indonesia; Dept. of IT Convergence and Application Engineering, Pukyong National University, Republic of Korea",2016 6th International Annual Engineering Seminar (InAES),"19 Jan 2017","2016","","","51","55","Mutual cooperation is a form of active participation of each individual to engage in value-added or positive to any object, problems or needs of the people around him. Active participation can include information in the form of a report. In addition to active participation to provide the report, the public can also monitor directly related to the security of a location. With advances in information and communication technology at this time, the public can monitor rapid and real time. Indonesia United (IDUN) utilizing virtual community to create a security monitoring system locations nationwide uses the concept of mutual cooperation or crowdsourcing. The society can be provided information about their crime-prone locations using Indonesia United (IDUN) criminal system based website. Users can share information with location-based systems. This system will be use to report any crime where and when it happened. The proposed system will be very useful for users when traveling to unfamiliar areas, where they have little knowledge about the foreign environment.","","978-1-5090-0741-7","10.1109/INAES.2016.7821906","","https://ieeexplore.ieee.org/stamp/stamp.jsp?arnumber=7821906","Web Portal Crime;IDUN;Google Map;LBS;Traveling Areas;Crowdsourcing","Geographic information systems;Google;Games;Business;Security;Seminars;Crowdsourcing","","2","","8","IEEE","19 Jan 2017","","","IEEE","IEEE Conferences"
"Technical evaluation for mashing up crowdsourcing images","Caodong Xie; Zhiehao Zhang; Jie Shan","School of Remote Sensing and Information Engineering, Wuhan University, Wuhan, China; School of Remote Sensing and Information Engineering, Wuhan University, Wuhan, China; Lyles School of Civil Engineering, Purdue University, West Layayette, IN, USA",2015 23rd International Conference on Geoinformatics,"14 Jan 2016","2015","","","1","6","The popularity of smart mobile devices with camera enabled results in a growing number of photos on the Internet. Those with semantic and geographic data can be used to enrich the data source of geographic information system, whereas, the widespread sources of these photos make them difficult to retrieve and utilize. We use a third-parr?"" image search APIs to retrieve the images dynamically and use both keywords and geographic coordinates as queries to implement the mashup service of searching multi-source POIs and web images. We also designed an efficient schema of storing and managing images uploaded from mobile deuce with rich metadata. We developed a prototype framework of searching and managing crowdsourcing images and verified its feasibility.","2161-024X","978-1-4673-7663-1","10.1109/GEOINFORMATICS.2015.7378684","","https://ieeexplore.ieee.org/stamp/stamp.jsp?arnumber=7378684","LBS;crowdsourcing images;social network;web images retrieval;image storage;service mash tips","Mobile communication;Databases;Pattern recognition","","2","","19","IEEE","14 Jan 2016","","","IEEE","IEEE Conferences"
