"DaPanda: Detecting Aggressive Push Notifications in Android Apps","T. Liu; H. Wang; L. Li; G. Bai; Y. Guo; G. Xu","Beijing University of Posts and Telecommunications, Beijing, China; Beijing University of Posts and Telecommunications, Beijing, China; Monash University, Australia; The University of Queensland, Australia; Key Laboratory of High-Confidence Software Technologies (MOE), Peking University, Beijing, China; Beijing University of Posts and Telecommunications, Beijing, China",2019 34th IEEE/ACM International Conference on Automated Software Engineering (ASE),"9 Jan 2020","2019","","","66","78","Mobile push notifications have been widely used in mobile platforms to deliver all sorts of information to app users. Although it offers great convenience for both app developers and mobile users, this feature was frequently reported to serve malicious and aggressive purposes, such as delivering annoying push notification advertisement. However, to the best of our knowledge, this problem has not been studied by our research community so far. To fill the void, this paper presents the first study to detect aggressive push notifications and further characterize them in the global mobile app ecosystem on a large scale. To this end, we first provide a taxonomy of mobile push notifications and identify the aggressive ones using a crowdsourcing-based method. Then we propose sc DaPanda, a novel hybrid approach, aiming at automatically detecting aggressive push notifications in Android apps. sc DaPanda leverages a guided testing approach to systematically trigger and record push notifications. By instrumenting the Android framework, sc DaPanda further collects all notification-relevant runtime information to flag the aggressive ones. Our experimental results show that sc DaPanda is capable of detecting different types of aggressive push notifications effectively in an automated way. By applying sc DaPanda to 20,000 Android apps from different app markets, it yields over 1,000 aggressive notifications, which have been further confirmed as true positives. Our in-depth analysis further reveals that aggressive notifications are prevalent across different markets and could be manifested in all the phases in the lifecycle of push notifications. It is hence urgent for our community to take actions to detect and mitigate apps involving aggressive push notifications.","2643-1572","978-1-7281-2508-4","10.1109/ASE.2019.00017","","https://ieeexplore.ieee.org/stamp/stamp.jsp?arnumber=8952509","Push notification;dynamic analysis;advertisement;Android;mobile app","Taxonomy;Mobile applications;Advertising;Google;Ecosystems;Libraries;Australia","","16","","75","IEEE","9 Jan 2020","","","IEEE","IEEE Conferences"
"Towards a Hybrid Human-Computer Scientific Information Extraction Pipeline","R. B. Tchoua; K. Chard; D. J. Audus; L. T. Ward; J. Lequieu; J. J. De Pablo; I. T. Foster","Department of Computer Science, University of Chicago, Chicago, IL, USA; The Computation Institute, University of Chicago and Argonne, Chicago, IL, USA; Materials Science and Engineering Division, National Institute of Standards and Technology, Gaithersburg, MD, USA; The Computation Institute, University of Chicago and Argonne, Chicago, IL, USA; Institute for Molecular Engineering, University of Chicago, Chicago, IL, USA; Institute for Molecular Engineering, University of Chicago, Chicago, IL, USA; The Computation Institute, University of Chicago and Argonne, Chicago, IL, USA",2017 IEEE 13th International Conference on e-Science (e-Science),"16 Nov 2017","2017","","","109","118","The emerging field of materials informatics has the potential to greatly reduce time-to-market and development costs for new materials. The success of such efforts hinges on access to large, high-quality databases of material properties. However, many such data are only to be found encoded in text within esoteric scientific articles, a situation that makes automated extraction difficult and manual extraction time-consuming and error-prone. To address this challenge, we present a hybrid Information Extraction (IE) pipeline to improve the machine-human partnership with respect to extraction quality and person-hours, through a combination of rule-based, machine learning, and crowdsourcing approaches. Our goal is to leverage computer and human strengths to alleviate the burden on human curators by automating initial extraction tasks before prioritizing and assigning specialized curation tasks to humans with different levels of training: using non-experts for straightforward tasks such as validation of higher accuracy results (e.g., completing partial facts) and domain experts for low-certainty results (e.g., reviewing specialized compound labels). To validate our approaches, we focus on the task of extracting the glass transition temperature of polymers from published articles. Applying our approaches to 6 090 articles, we have so far extracted 259 refined data values. We project that this number will grow considerably as we tune our methods and process more articles, to exceed that found in standard, expert-curated polymer data handbooks while also being easier to keep up-to-date. The freely available data can be found on our Polymer Properties Predictor and Database website at http://pppdb.uchicago.edu.","","978-1-5386-2686-3","10.1109/eScience.2017.23","","https://ieeexplore.ieee.org/stamp/stamp.jsp?arnumber=8109128","Information Extraction;Crowdsourcing;Machine Learning;Polymers;Glass transition","Plastics;Pipelines;Data mining;Databases;Crowdsourcing;Polymers","","16","","51","IEEE","16 Nov 2017","","","IEEE","IEEE Conferences"
"A framework for P2P networking of smart devices using Wi-Fi direct","A. A. Shahin; M. Younis","Department of Computer Science and Electrical Engineering, University of Maryland Baltimore County, Baltimore, MD, USA; Department of Computer Science and Electrical Engineering, University of Maryland Baltimore County, Baltimore, MD, USA","2014 IEEE 25th Annual International Symposium on Personal, Indoor, and Mobile Radio Communication (PIMRC)","29 Jun 2015","2014","","","2082","2087","The use of smart portable devices has become very popular in the society nowadays. Many of these devices are equipped with sensors that can provide a wealth of information about the surroundings once their readings are aggregated. These capabilities have fueled interest in employing these devices in emerging unconventional applications such as crowdsourcing and vehicular networking, where sensors data is shared for better situational awareness, managing road congestion, coordinating disaster recovery, criminals hunting, etc. Internetworking of collocated devices in these applications enables aggregation of sensor readings and decreasing the demand on the carrier's communication resources, which translate to lower cost, better bandwidth utilization and increased user participation. Wi-Fi Direct is one of the most promising peer-to-peer technologies that can enable such local internetworking of devices. Wi-Fi Direct transceivers are available on almost all new smart devices. However, the software support for Wi-Fi Direct is quite limited. This paper highlights limitations in Android based platforms and presents a framework for supporting formation and management of groups of communicating devices. The proposed framework is validated through the implementation of a chat application over multiple Android based devices.","2166-9589","978-1-4799-4912-0","10.1109/PIMRC.2014.7136515","","https://ieeexplore.ieee.org/stamp/stamp.jsp?arnumber=7136515","Wi-Fi direct;Android;Smart devices;Peer-to-peer networks;Group management;Service discovery","Sockets;IEEE 802.11 Standards;Protocols;Peer-to-peer computing;Smart phones;IP networks;Androids","","16","1","10","IEEE","29 Jun 2015","","","IEEE","IEEE Conferences"
"BuildingNet: Learning to Label 3D Buildings","P. Selvaraju; M. Nabail; M. Loizou; M. Maslioukova; M. Averkiou; A. Andreou; S. Chaudhuri; E. Kalogerakis","UMass, Amherst; UMass, Amherst; CYENS CoE, University of Cyprus, Cyprus; CYENS CoE, University of Cyprus, Cyprus; CYENS CoE, University of Cyprus, Cyprus; CYENS CoE, University of Cyprus, Cyprus; Adobe Research, IIT, Bombay; UMass, Amherst",2021 IEEE/CVF International Conference on Computer Vision (ICCV),"28 Feb 2022","2021","","","10377","10387","We introduce BuildingNet: (a) a large-scale dataset of 3D building models whose exteriors are consistently labeled, and (b) a graph neural network that labels building meshes by analyzing spatial and structural relations of their geometric primitives. To create our dataset, we used crowdsourcing combined with expert guidance, resulting in 513K annotated mesh primitives, grouped into 292K semantic part components across 2K building models. The dataset covers several building categories, such as houses, churches, skyscrapers, town halls, libraries, and castles. We include a benchmark for evaluating mesh and point cloud labeling. Buildings have more challenging structural complexity compared to objects in existing benchmarks (e.g., ShapeNet, PartNet), thus, we hope that our dataset can nurture the development of algorithms that are able to cope with such large-scale geometric data for both vision and graphics tasks e.g., 3D semantic segmentation, part-based generative models, correspondences, texturing, and analysis of point cloud data acquired from real-world buildings. Finally, we show that our mesh-based graph neural network significantly improves performance over several baselines for labeling 3D meshes. Our project page www.buildingnet.org includes our dataset and code.","2380-7504","978-1-6654-2812-5","10.1109/ICCV48922.2021.01023","","https://ieeexplore.ieee.org/stamp/stamp.jsp?arnumber=9710008","Datasets and evaluation;Scene analysis and understanding;Segmentation;grouping and shape;Vision applications and systems","Point cloud compression;Solid modeling;Analytical models;Three-dimensional displays;Buildings;Semantics;Benchmark testing","","16","","64","IEEE","28 Feb 2022","","","IEEE","IEEE Conferences"
"Secure crowdsourced radio environment map construction","Y. Hu; R. Zhang","Department of Computer and Information Sciences, University of Delaware Newark; Department of Computer and Information Sciences, University of Delaware Newark",2017 IEEE 25th International Conference on Network Protocols (ICNP),"23 Nov 2017","2017","","","1","10","Database-driven Dynamic Spectrum Sharing (DSS) is the de-facto technical paradigm adopted by Federal Communications Commission (FCC) for increasing spectrum efficiency. In such a system, a geo-location database administrator (DBA) maintains spectrum availability information over its service region whereby to determines whether a secondary user can access a licensed spectrum band at his desired location and time. To maintain spectrum availability in its service region, it is desirable for the DBA to periodically collect spectrum measurements whereby to construct and maintain a Radio Environment Map (REM), where the received signal strength at every location of interest is either directly measured or estimated via proper statistical spatial interpolation techniques. Crowdsourcing-based spectrum sensing is a promising approach for periodically collecting spectrum measurements over a large geographic area, which is, unfortunately, vulnerable to false spectrum measurements. How to construct an accurate REM in the presence of false measurements remains an open challenge. This paper introduces SecREM, a novel scheme for securely constructing a REM in the presence of false spectrum measurements. SecREM relies on a small number of trusted spectrum measurements whereby to evaluate the trustworthiness of the measurements from mobile users and gradually incorporate the most trustworthy ones to construct an accurate REM. Extensive simulation studies based on a real spectrum measurement dataset confirm the efficacy and efficiency of SecREM.","","978-1-5090-6501-1","10.1109/ICNP.2017.8117556","","https://ieeexplore.ieee.org/stamp/stamp.jsp?arnumber=8117556","","Sensors;Interpolation;Mobile communication;Atmospheric measurements;Particle measurements;Databases;Distortion measurement","","16","","44","IEEE","23 Nov 2017","","","IEEE","IEEE Conferences"
"Human and robot perception in large-scale learning from demonstration","C. Crick; S. Osentoski; G. Jay; O. C. Jenkins","Department of Computer Science, Brown University, Providence, RI, USA; Department of Computer Science, Brown University, Providence, RI, USA; Department of Computer Science, Brown University, Providence, RI, USA; Brown University, Providence, RI, US",2011 6th ACM/IEEE International Conference on Human-Robot Interaction (HRI),"27 Aug 2012","2011","","","339","346","We present a study of using a robotic learning from demonstration system capable of collecting large amounts of human-robot interaction data through a web-based interface. We examine the effect of different perceptual mappings between the human teacher and robot on the learning from demonstration. We show that humans are significantly more effective at teaching a robot to navigate a maze when presented with information that is limited to the robot's perception of the world, even though their task performance measurably suffers when contrasted with users provided with a natural and detailed raw video feed. Robots trained on such demonstrations learn more quickly, perform more accurately and generalize better. We also demonstrate a set of software tools for enabling internet-mediated human-robot interaction and gathering the large datasets that such crowdsourcing makes possible.","2167-2148","978-1-4673-4395-4","10.1145/1957656.1957788","","https://ieeexplore.ieee.org/stamp/stamp.jsp?arnumber=6281353","Crowdsourcing;interface design;learning from demonstration","Cameras;Navigation;Abstracts;Robots;Niobium;Humans","","16","","","","27 Aug 2012","","","IEEE","IEEE Conferences"
"COCOON: Crowdsourced Testing Quality Maximization Under Context Coverage Constraint","M. Xie; Q. Wang; G. Yang; M. Li","CSI Euler Department, Huawei, China; Chinese Academy of Sciences, Institute of software; Department of Computer Science, Texas State University, USA; Chinese Academy of Sciences, Institute of software",2017 IEEE 28th International Symposium on Software Reliability Engineering (ISSRE),"16 Nov 2017","2017","","","316","327","Mobile app testing is challenging since each test needs to be executed in a variety of operating contexts including heterogeneous devices, various wireless networks and different locations. Crowdsourcing enables a mobile app test to be distributed as a crowdsourced task to leverage crowd workers to accomplish the test. However, high test quality and expected test context coverage are difficult to achieve in crowdsourced testing. Upon distributing a test task, mobile app providers neither know who to participate nor predict whether all the expected test contexts can be covered in the task. To address this problem, we put forward a novel research problem called Crowdsourced Testing Quality Maximization Under Context Coverage Constraint (Cocoon). Given a mobile app test task, our objective is to recommend a set of workers, from available crowd workers, such that the expected test context coverage and a high test quality can be achieved. We prove that the Cocoon problem is NP-Complete and then introduce two greedy approaches. Based on a real dataset from the largest Chinese crowdsourced testing platform, our evaluation shows the effectiveness and efficiency of the two approaches, which can be potentially used as online services in practice.","2332-6549","978-1-5386-0941-5","10.1109/ISSRE.2017.25","","https://ieeexplore.ieee.org/stamp/stamp.jsp?arnumber=8109097","","Testing;Mobile communication;Computer bugs;Software;Crowdsourcing;Mobile handsets","","15","","31","IEEE","16 Nov 2017","","","IEEE","IEEE Conferences"
"Internet of Things and M2M Communications as Enablers of Smart City Initiatives","S. K. Datta; C. Bonnet","Mobile Communications Department, Eurecom, Biot, France; Mobile Communications Department, Eurecom, Biot, France","2015 9th International Conference on Next Generation Mobile Applications, Services and Technologies","7 Jan 2016","2015","","","393","398","This paper describes Internet of Things (IoT) and Machine-to-Machine (M2M) communications as the enablers of smart city initiatives. The challenges in modern cities are briefly identified. Utilization of IoT based applications and services could mitigate these challenges. The paper then introduces an architecture based on oneM2M standards for smart cities. The key elements of the architecture are described along with the common service functions. The main contributions of the work are -- (i) uniform metadata exchange with things using Sensor Markup Language and its extensions, (ii) uniform description of heterogeneous things for configuration management, (iii) OMA Lightweight M2M based device management framework, (iv) resource discovery framework and (v) Machine-to-Machine Measurement framework based M2M data processing and analytics. The core functionalities of these frameworks are exposed to the consumers through RESTful web services. An application scenario on crowdsourcing in the smart cities is highlighted. Finally the paper concludes with future research directions.","","978-1-4799-8660-6","10.1109/NGMAST.2015.10","","https://ieeexplore.ieee.org/stamp/stamp.jsp?arnumber=7373275","Discovery;Device management;IoT;oneM2M standards;Smart city;Crowdsourcing","Next generation networking;Mobile applications","","15","","25","IEEE","7 Jan 2016","","","IEEE","IEEE Conferences"
"Human-as-a-Service: Growth in Human Service Ecosystem","K. Huang; J. Yao; J. Zhang; Z. Feng","Tianjin Key Laboratory of Cognitive Computing and Application, Tianjin, China; Palo Alto Research Center (PARC), Palo Alto, CA, USA; Carnegie Mellon University Silicon Valley, USA; Tianjin Key Laboratory of Cognitive Computing and Application, Tianjin, China",2016 IEEE International Conference on Services Computing (SCC),"1 Sep 2016","2016","","","90","97","With the sweeping progress of services technology and crowdsourcing, individuals are offering their capability as a service and companies are orchestrating them for problem solving over the web. As a consequence, recent years have witnessed a rapid development of a human service ecosystem. In contrast to web service ecosystem, human service ecosystem is more complicated by the fact that humans grow capability overtime and their collaborations typically imply human involvement. It is thus worthy to understand the modeling of evolution of human capabilities and collaborations for optimization and more effective management. This paper proposes a three-layer time-aware heterogeneous network model, and based on it, a novel method is developed to study how human service providers and consumers develop their service provision and orchestrating capabilities as well as how they collaborate with each other. Exploratory analysis uncovers some evolution patterns which open a gateway for building possible applications such as human service recommendation for consumers, human capability development, and mechanism design for platform management.","","978-1-5090-2628-9","10.1109/SCC.2016.19","","https://ieeexplore.ieee.org/stamp/stamp.jsp?arnumber=7557440","Human as a Service;Heterogeneous Network;Service Provision/Orchestrating Capability;Collaboration Pattern","Ecosystems;Collaboration;Servers;Web services;Heterogeneous networks;Measurement;Crowdsourcing","","15","","22","IEEE","1 Sep 2016","","","IEEE","IEEE Conferences"
"Benchmarking of objective quality metrics for point cloud compression","D. Lazzarotto; E. Alexiou; T. Ebrahimi","Multimedia Signal Processing Group (MMSPG), École Polytechnique Fédérale de Lausanne (EPFL), Lausanne, Switzerland; Multimedia Signal Processing Group (MMSPG), École Polytechnique Fédérale de Lausanne (EPFL), Lausanne, Switzerland; Multimedia Signal Processing Group (MMSPG), École Polytechnique Fédérale de Lausanne (EPFL), Lausanne, Switzerland",2021 IEEE 23rd International Workshop on Multimedia Signal Processing (MMSP),"16 Mar 2022","2021","","","1","6","Point cloud is a promising imaging modality for the representation of 3D media. The vast volume of data associated with it requires efficient compression solutions, with lossy algorithms leading to larger bit-rate savings at the expense of visual impairments. While conventional encoding approaches rely on efficient data structures, recent methods have incorporated deep learning for rate-distortion optimization, while inducing perceptual degradations of different natures. To measure the magnitude of such distortions, subjective or objective quality evaluation methodologies are employed. Lately, a remarkable amount of efforts has been devoted to the development of point cloud objective quality metrics, which have been reported to attain high prediction accuracy. However, their performance and generalization capabilities haven’t been evaluated yet in presence of artifacts from learning-based codecs. In this study, we tackle this matter by conducting the first crowdsourcing experiment for point cloud quality reported in the literature, in order to obtain subjective ratings for point cloud models whose topology and color attributes are encoded by both conventional and data-driven methods. Using the subjective scores as ground truth, the performance of a large pool of state-of-the-art quality metrics is rigorously benchmarked, drawing useful insights regarding their efficacy.","2473-3628","978-1-6654-3288-7","10.1109/MMSP53017.2021.9733538","","https://ieeexplore.ieee.org/stamp/stamp.jsp?arnumber=9733538","Point Cloud;Quality Assessment;Subjective Quality Evaluation;Objective Quality Metrics;Compression","Point cloud compression;Measurement;Crowdsourcing;Correlation;Codecs;Three-dimensional displays;Rate-distortion","","14","","35","IEEE","16 Mar 2022","","","IEEE","IEEE Conferences"
"The Cloud that Runs the Mobile Internet: A Measurement Study of Mobile Cloud Services","F. Michclinakis; H. Doroud; A. Razaghpanah; A. Lutu; N. Vallina-Rodriguez; P. Gill; J. Widmer",IMDEA Networks Institute; Universidad Carlos III de Madrid; Stony Brook University; Simula Research Laboratory; IMDEA Networks Institute; University of Massachusetts; IMDEA Networks Institute,IEEE INFOCOM 2018 - IEEE Conference on Computer Communications,"11 Oct 2018","2018","","","1619","1627","Mobile applications outsource their cloud infrastructure deployment and content delivery to cloud computing services and content delivery networks. Studying how these services, which we collectively denote Cloud Service Providers (CSPs), perform over Mobile Network Operators (MNOs) is crucial to understanding some of the performance limitations of today's mobile apps. To that end, we perform the first empirical study of the complex dynamics between applications, MNOs and CSPs. First, we use real mobile app traffic traces that we gathered through a global crowdsourcing campaign to identify the most prevalent CSPs supporting today's mobile Internet. Then, we investigate how well these services interconnect with major European MNOs at a topological level, and measure their performance over European MNO networks through a month-long measurement campaign on the MONROE mobile broadband testbed. We discover that the top 6 most prevalent CSPs are used by 85 % of apps, and observe significant differences in their performance across different MNOs due to the nature of their services, peering relationships with MNOs, and deployment strategies. We also find that CSP performance in MNOs is affected by inflated path length, roaming, and presence of middleboxes, but not influenced by the choice of DNS resolver.","","978-1-5386-4128-6","10.1109/INFOCOM.2018.8485872","","https://ieeexplore.ieee.org/stamp/stamp.jsp?arnumber=8485872","","Cloud computing;Servers;IP networks;Conferences;Europe;Tools","","14","","42","IEEE","11 Oct 2018","","","IEEE","IEEE Conferences"
