"StackRAG Agent: Improving Developer Answers with Retrieval-Augmented Generation","D. Abrahamyan; F. H. Fard","Department of Computer Science, University of British Columbia, Kelowna, Canada; Department of Computer Science, University of British Columbia, Kelowna, Canada",2024 IEEE International Conference on Software Maintenance and Evolution (ICSME),"19 Dec 2024","2024","","","893","897","Developers spend much time finding information that is relevant to their questions. Stack Overflow has been the leading resource, and with the advent of Large Language Models (LLMs), generative models such as ChatGPT are used frequently. However, there is a catch in using each one separately. Searching for answers is time-consuming and tedious, as shown by the many tools developed by researchers to address this issue. On the other, using LLMs is not reliable, as they might produce irrelevant or unreliable answers (i.e., hallucination). In this work, we present StackRAG, a retrieval-augmented Multiagent generation tool based on LLMs that combines the two worlds: aggregating the knowledge from SO to enhance the reliability of the generated answers. Initial evaluations show that the generated answers are correct, accurate, relevant, and useful. A description video can be found here11Please note that as the tool requires API keys, we are not able to set up a live demo of StackRAG..","2576-3148","979-8-3503-9568-6","10.1109/ICSME58944.2024.00098","Natural Sciences and Engineering Research Council of Canada(grant numbers:RGPIN-2019-05175); ","https://ieeexplore.ieee.org/stamp/stamp.jsp?arnumber=10795043","Multiagent tool;RAG-based tool;LLM;Stack Overflow","Software maintenance;Accuracy;Large language models;Search engines;Chatbots;Software reliability;Software engineering","","","","17","IEEE","19 Dec 2024","","","IEEE","IEEE Conferences"
"Idiomata: Direct manipulation of code through idiomatic views","D. I. Samudio","Department of Computer Science, George Mason University",2017 IEEE Symposium on Visual Languages and Human-Centric Computing (VL/HCC),"13 Nov 2017","2017","","","317","318","Currently, front-end web developers spend countless hours overcoming programming challenges while debugging unexpected asynchronous behaviors, writing code to interact with a framework's API, or fixing faults. Such problems demand rethinking programming tools, and for that, we systematically analyzed 301 posts from Stack Overflow, and sought to identify the programming activities developers struggled with and find information barriers that were the primary cause of their challenges. Our results reveal that developers most commonly post questions to change behavior of existing code. Further, specific discussions or changes in code fragments that conceptually have the same intention (e.g. both document.querySelector(“x”) and $(“x”) retrieve references from the DOM), often presented reoccurring challenges that demanded different reasoning to obtain equivalent runtime information (e.g. check if a DOM reference matches what is intended in the output). Code idioms are those concepts underlying patterns in code and by categorizing them, we were able to associate their challenges to execution information barriers that prevent developers from observing relevant state and behavior at runtime (e.g. mapping a DOM reference in a code fragment to its element in the output), and selection barriers that prevent developers from finding or choosing the correct object, method, or parameter values to achieve a desired behavior (e.g. generating code that references a DOM element).","1943-6106","978-1-5386-0443-4","10.1109/VLHCC.2017.8103488","","https://ieeexplore.ieee.org/stamp/stamp.jsp?arnumber=8103488","","Navigation;Runtime;Tools;Visualization;Programming;Cascading style sheets;Cognition","","","","3","IEEE","13 Nov 2017","","","IEEE","IEEE Conferences"
"Rexstepper: a Reference Debugger for JavaScript Regular Expressions","L. Almeida; M. Gonzaga; J. F. Santos; R. Abreu","Instituto Superior Técnico, Lisbon, Portugal; Instituto Superior Técnico, Lisbon, Portugal; Instituto Superior Técnico, INESC-ID, Lisbon, Portugal; FEUP INESC-ID, Porto, Portugal",2023 IEEE/ACM 45th International Conference on Software Engineering: Companion Proceedings (ICSE-Companion),"12 Jul 2023","2023","","","41","45","Regular expressions are notoriously difficult to get right, with developers often having to resort to trial-and-error approaches. Even so, little attention has been given by the re search community to the development of effective debugging tools for regular expressions. We present RexStepper, a reference debugger for troubleshooting JavaScript regular expressions in the browser. Rexstepper is implemented on top of Rexref, a trusted reference implementation of JavaScript (ECMAScript 5) regular expressions, which works by transpiling the given reg-ular expression to a JavaScript function that recognises its expansions. We demonstrate the usefulness of Rexstepper by successfully using it to troubleshoot a benchmark of 18 faulty regular expressions obtained from the Stack Overflow and Stack Exchange websites.","2574-1934","979-8-3503-2263-7","10.1109/ICSE-Companion58688.2023.00021","Fundacão para a Ciência e a Tecnologia(grant numbers:PTDC/CCI-COM/32378/2017,CMU/TIC/0053/2021); ","https://ieeexplore.ieee.org/stamp/stamp.jsp?arnumber=10172543","JavaScript;regular expressions;debuggers","Debugging;Benchmark testing;Browsers;Software engineering","","","","17","IEEE","12 Jul 2023","","","IEEE","IEEE Conferences"
"A study of code search technology","L. Zhao","School of Computer Science, National University of Defence Technology, Changsha, China",2024 7th International Conference on Computer Information Science and Application Technology (CISAT),"2 Oct 2024","2024","","","603","608","The expansion of open-source communities like Github and Stack Overflow has led to an abundance of high-quality code snippets and engineering projects, driving advancements in the domain of code search. This section specifically examines code search, which involves retrieving code that matches a given natural language query by effectively capturing semantic similarities between the query and the code. Deep learning, known for its ability to extract intricate semantic information, has emerged as a powerful tool in this domain. Recent advancements have seen the application of various deep learning techniques, such as graph neural networks and pre-trained models, to code search, resulting in significant progress. Deep learning has now become the predominant approach in code search. This paper thoroughly investigates code search techniques, akin to model search techniques, and provides a comprehensive overview of deep learning-based code search methodologies.","","979-8-3503-7510-7","10.1109/CISAT62382.2024.10695201","","https://ieeexplore.ieee.org/stamp/stamp.jsp?arnumber=10695201","code search;deep learning;semantics;study","Deep learning;Codes;Attention mechanisms;Source coding;Semantics;Natural languages;Feature extraction;Transformers;Vectors;Software development management","","","","18","IEEE","2 Oct 2024","","","IEEE","IEEE Conferences"
"Farm Book: An Interactive Mobile Application for Smart Farming","R. Pavithra.; C. Padmavathy.; S. Vijayalakshmi; N. Nandhine Shree.","Department of CSE, Sri Ramakrishna Engineering College, Coimbatore, India; Department of CSE, Sri Ramakrishna Engineering College, Coimbatore, India; Department of CSE, Park College of Engineering and Technology, Kaniyur; Department of CSE, Sri Ramakrishna Engineering College, Coimbatore, India",2023 International Conference on Inventive Computation Technologies (ICICT),"1 Jun 2023","2023","","","963","969","Smart farming increase the usage of mobile applications. There are many applications which have been built for clearing farmers doubts. A survey about the hike and fall in price of vegetables and fruits in agriculture gave us a clear vision about the market needs. The agronomists are facing the plant defects and diseases which leads to loss in production of fruits and vegetables which results in the cost variation and demand for agricultural products. The price issue pushed us a step forward into the work which should be rectified for the betterment of agriculture as well as farmers. After that, an environment has been created to overcome the agriculture related issues. The goal is to disseminate knowledge regarding appropriate farming practices through the co-design of an agricultural management application that would maximize the crop productivity of small-scale farmers. This research study has planned to create an atmosphere, where people can gather information about agriculture and provides the relevant solutions. Yes, the concept is interaction between farmers. This research study provides a mini stack overflow like structure in agriculture so that the farmers can interact between themselves and their doubts in farming can be solved easily. Once after getting many users in the app, statistical data will be provided and a concept of marketing so that the scarcity in cultivation can be minimized.","2767-7788","979-8-3503-9849-6","10.1109/ICICT57646.2023.10134494","","https://ieeexplore.ieee.org/stamp/stamp.jsp?arnumber=10134494","Farming;Disease Detection;Farm Products;Mobile Application;Farmers;Statistical Data","Smart agriculture;Irrigation;Crops;Process control;Soil;Agriculture;Mobile applications","","","","17","IEEE","1 Jun 2023","","","IEEE","IEEE Conferences"
"A run-time detector for violated memory access in embedded systems","A. -V. Dinh-Duc; N. Ho","Faculty of Computer Science & Engineering, HCM City University of Technology, Ho Chi Minh, Vietnam; Faculty of Computer Science & Engineering, HCM City University of Technology, Ho Chi Minh, Vietnam",Proceedings of 2010 IEEE/ASME International Conference on Mechatronic and Embedded Systems and Applications,"19 Aug 2010","2010","","","217","223","Recently, application in embedded systems has increasingly become complex. This requires having tools to prevent or detect memory corruption errors during the software development process. Unfortunately, most of embedded processors lack to be equipped a MMU (Memory Management Units), one of hardware components supporting memory protection mechanism in general purpose computer system, because MMU-based memory protection methods cause embedded system incurred hardware cost and performance penalty. In this paper, an off-chip model is proposed to detect violated memory accesses at run-time without incurring hardware cost. It can efficiently detect errors for RTOS-based applications in cases of stack overflow, reading/writing to code/data segments of the other tasks or violated memory access to OS kernel. The hardware component based on FPGA is also built by hooking on memory system bus to monitor memory accesses. Once error detection phase is completed, the hardware prototype can be detached from the system. Some testbeds are used for this model and give good results.","","978-1-4244-7101-0","10.1109/MESA.2010.5552065","","https://ieeexplore.ieee.org/stamp/stamp.jsp?arnumber=5552065","component;MMU;MPU;FPGA;RTOS;SoC;TLB;PLB;MCU","Switches;Kernel","","","","25","IEEE","19 Aug 2010","","","IEEE","IEEE Conferences"
"Identifying Question Intent Similarity Using Computational Techniques","G. Mahajan","Manipal University Jaipur, Jaipur, India",2023 IEEE International Conference on Contemporary Computing and Communications (InC4),"29 Sep 2023","2023","1","","1","5","Paraphrase identification is becoming an important use case in the industry. From a business context, paraphrase identification is significantly helpful to improve the user experience of the platform. It is an active research area by companies like Quora, Stack Overflow, and other question-answering websites. One of the main issues that these companies face is the problem of repeating questions. If one is successfully able to capture and interpret the semantics of the sentence and the intent of the user, this would improve the consumer experience. Quora’s official dataset was used in the present research work. To find a question that was similar, we modeled the dataset of Quora question pairs. It was a Binary classification task and various approaches were explored and experimented with. Bag of Words was used for feature extraction. A traditional machine learning approach was followed and algorithms like XGBoost, RF, and decision tree were used. These models were evaluated based on their F-1 and accuracy scores. Feature engineering was performed that significantly improved the model accuracy. The decision tree model was able to achieve an accuracy of up to 78.8% while Random Forest and XGBoost had an accuracy of 76.2% and 75.4%.","","979-8-3503-3577-4","10.1109/InC457730.2023.10262888","","https://ieeexplore.ieee.org/stamp/stamp.jsp?arnumber=10262888","Paraphrase;semantics;TF-IDF;Information Retrieval;meta-heuristics;corpus","Radio frequency;Industries;Machine learning algorithms;Computational modeling;Semantics;Companies;User experience","","","","14","IEEE","29 Sep 2023","","","IEEE","IEEE Conferences"
"Analysis of CPU Utilisation and Stack Consumption of a Multimedia Embedded System","A. K. N. Ramachandra; A. K. Kannur","Department of Electrical Engineering, Arizona State University, USA; Department of Electrical Engineering, Arizona State University, USA","4th IEEE International Symposium on Electronic Design, Test and Applications (delta 2008)","3 Mar 2008","2008","","","89","94","Due to the time characteristics of audio and video data, the processing of multimedia applications has to be done using real time mechanisms. Scheduling algorithms used in these systems should be chosen to meet system requirements and have the knowledge of the number of tasks and their criticality. In addition it is mandatory to ensure that embedded controllers never run out of the allocated stack space, in other words a safety against stack overflow. This paper deals with the analysis performed on an embedded system to understand the central processing unit (CPU) utilisation and optimisation of the system with respect to memory and time. Stack consumption of individual tasks are also monitored to get the dynamic behaviour of the system under different operating load conditions. The data obtained from our analysis will be extrapolated to work on solutions to improve the existing system response. The profiling of task execution times will help in identifying the areas of optimisation. The analysed data will also help us to gauge the performance of the real time operating system (RTOS).","","978-1-5090-7977-3","10.1109/DELTA.2008.38","","https://ieeexplore.ieee.org/stamp/stamp.jsp?arnumber=4459516","CPU Utilisation;Stack Consumption","Multimedia systems;Embedded system;Central Processing Unit;Performance analysis;Scheduling algorithm;Safety;Condition monitoring;Data analysis;Real time systems;Operating systems","","","","3","IEEE","3 Mar 2008","","","IEEE","IEEE Conferences"
"SMP: A New Mechanism to Mitigate Control-Flow Hijacking Attacks","G. Lu; L. Chen; G. Shi","Chinese Academy of Sciences, University of Chinese Academy of Sciences, Beijing, China; Chinese Academy of Sciences, University of Chinese Academy of Sciences, Beijing, China; Chinese Academy of Sciences, University of Chinese Academy of Sciences, Beijing, China",2018 3rd International Conference on Information Systems Engineering (ICISE),"17 Jan 2019","2018","","","51","55","Software code written in low-level languages like C/C++ have many kinds of memory vulnerabilities (e.g., stack overflow, Use-after-free, etc.). Attackers could exploit these vulnerabilities to hijack control-flow and compromise the program. Existing defense mechanisms' (e.g., ASLR, DEP) security guarantee are incomplete, and widely studied defense mechanisms (e.g., CFI) have high overhead and stronger but also limited security guarantees [1]. In this paper, we introduced SMP (Shadow Memory Protection), a new defense mechanism that protects the program's control-flow from being maliciously tampered by protecting critical data in the program (e.g., indirect jump destination address). SMP has a better security-to-overhead ratio than most existing controlflow hijacking protection mechanisms. Experiments showed that SMP mechanism is effective (prevent all attacks in RIPE benchmark) and efficient (3.5% average overhead for C on SPEC CPU2006).","2160-1291","978-1-5386-6259-5","10.1109/ICISE.2018.00017","","https://ieeexplore.ieee.org/stamp/stamp.jsp?arnumber=8614719","control-flow hijacking? critical data? indirect jump?shadow memory protection","Switched mode power supplies;Instruments;Static analysis;Runtime;Security;Layout;Libraries","","","","21","IEEE","17 Jan 2019","","","IEEE","IEEE Conferences"
"LogExpert: log-based Recommended Resolutions Generation using Large Language Model","J. Wang; G. Chu; J. Wang; H. Sun; Q. Qi; Y. Wang; J. Qi; J. Liao","Beijing University of Posts and Telecommunications, Beijing, China; Beijing University of Posts and Telecommunications, Beijing, China; Beijing University of Posts and Telecommunications, Beijing, China; Beijing University of Posts and Telecommunications, Beijing, China; Beijing University of Posts and Telecommunications, Beijing, China; Beijing University of Posts and Telecommunications, Beijing, China; China Mobile (Suzhou) Software Technology Co., Ltd., Suzhou, China; Beijing University of Posts and Telecommunications, Beijing, China",2024 IEEE/ACM 46th International Conference on Software Engineering: New Ideas and Emerging Results (ICSE-NIER),"29 Oct 2024","2024","","","42","46","Software logs play a vital role in ensuring the reliability and availability of large-scale software systems. In recent years, researchers have made significant efforts to build log analysis approaches to manage software systems. However, these approaches focus on log compression, log parsing and log anomaly detection. In the current context, engineers continue to spend substantial time and effort on resolving errors once anomalous logs have been detected. To achieve truly automated software system management and highlevel Artificial Intelligence for IT Operations (AIOps), it's necessary to bridge the gap between anomalous logs and their resolutions. In this paper, we propose a novel framework LogExpert to automatically generate recommended resolutions for anomalous logs. Specifically, we build a log recognizer to utilize the wealth of software knowledge in technical forums such as Stack Overflow (SO). In addition, LogExpert combines the great power of a Large Language Model (LLM) with domain-specific knowledge to generate the resolution. We conducted a preliminary evaluation of our framework on datasets from SO. Our log recognizer achieves the F1 score of 0.936. Our lexical metrics and human evaluation show the overall LogExpert framework achieves excellent performance in log-based resolution generation.","2832-7632","979-8-4007-0500-7","10.1145/3639476.3639773","National Natural Science Foundation of China(grant numbers:U23B2001,62171057,62101064,62201072,62001054,62071067); Ministry of Education and China Mobile Joint Fund(grant numbers:MCM20200202,MCM20180101); Beijing University of Posts and Telecommunications-China Mobile Research Institute Joint Innovation Center; ","https://ieeexplore.ieee.org/stamp/stamp.jsp?arnumber=10727140","log-based resolution generation;log anomaly detection;large language models;Stack Overflow","Measurement;Large language models;Software systems;Software reliability;Anomaly detection;Software engineering","","","","19","","29 Oct 2024","","","IEEE","IEEE Conferences"
"Dynamics of Team Library Adoptions: An Exploration of GitHub Commit Logs","P. B. Thomas; R. Krohn; T. Weninger",University of Notre Dame; University of Notre Dame; University of Notre Dame,2019 IEEE/ACM International Conference on Advances in Social Networks Analysis and Mining (ASONAM),"23 Apr 2020","2019","","","470","473","When a group of people strives to understand new information, struggle ensues as various ideas compete for attention. Steep learning curves are surmounted as teams learn together. To understand how these team dynamics play out in software development, we explore Git logs, which provide a complete change history of software repositories. In these repositories, we observe code additions, which represent successfully implemented ideas, and code deletions, which represent ideas that have failed or been superseded. By examining the patterns between these commit types, we can begin to understand how teams adopt new information. We specifically study what happens after a software library is adopted by a project, i.e., when a library is used for the first time in the project. We find that a variety of factors, including team size, library popularity, and prevalence on Stack Overflow are associated with how quickly teams learn and successfully adopt new software libraries.","2473-991X","978-1-4503-6868-1","10.1145/3341161.3342928","","https://ieeexplore.ieee.org/stamp/stamp.jsp?arnumber=9073197","information adoption;GitHub;software libraries;innovation","Libraries;Python;Social network services;History;Productivity;Data mining","","","","6","","23 Apr 2020","","","IEEE","IEEE Conferences"
"E-Xplore: Enterprise API Explorer","A. M. Asadullah; M. Basavaraju; N. Jain","Infosys Labs, Infosys Ltd, Bangalore, India; Infosys Labs, Infosys Ltd, Bangalore, India; Infosys Labs, Infosys Ltd, Bangalore, India",2013 IEEE International Conference on Software Maintenance,"2 Dec 2013","2013","","","524","527","Plenty of open source libraries and frameworks are available for developers these days for reuse in their projects. However the difficulty in finding and reusing the correct API among the hundreds of available APIs far outweighs the advantage of saving time. The problem is acute in enterprise code base. Online forums like Stack Overflow are no help for enterprise source code as they are closed in nature. We have developed a tool called E-Xplore that addresses this issue by letting the programmers search in large source code base and browse them effectively. The tool also provides related artifacts in the form of result clustering. We evaluated E-Xplore with other tools via user study with developers working on an enterprise banking system with more than 10 million lines of code. A set of common tasks was given to the developers with and without the tool. We observed that the tool offered appreciable time and effort benefits in large scale software system development and maintenance. In this paper we describe the tool and its features which help develop and maintain source code effectively.","1063-6773","978-0-7695-4981-1","10.1109/ICSM.2013.87","","https://ieeexplore.ieee.org/stamp/stamp.jsp?arnumber=6676948","E-Xplore;API;search;source code;semantic search;API Exploration","Documentation;Servers;Standards;Libraries;Semantics;Conferences","","","","17","IEEE","2 Dec 2013","","","IEEE","IEEE Conferences"
"A fast labeled graph matching algorithm based on edge matching and guided by search route","Yin-Tang Dai; Shi-Yong Zhang","School of Computer Science, Fudan University, Shanghai, China; School of Computer Science, Fudan University, Shanghai, China",2009 International Conference on Wavelet Analysis and Pattern Recognition,"18 Aug 2009","2009","","","1","7","This paper presents a fast labeled graph matching algorithm called Graph Explorer (GE) algorithm, which can be categorized into the tree search based graph matching (TSGM) algorithms of exact graph/subgraph matching. Not like the other node-centric TSGM algorithms, the GE algorithm focuses on edges matching. It constructs search state of partially matched subgraph by edge and edge. It converts graph matching problem into a path search problem in the space of search states. Under the guidance of the search path, it avoided repeated label checking by inheriting state tree structure for caching and fast visiting matched nodes and edge. By a carefully optimized search route and intelligent backtracking, GE algorithm avoided a large amount of the invalid search states and improved performance to be almost linear to the number of edges of pattern graph with low ambiguity. While traditional TSGM are suffering the call stack overflow problem caused by recursive function calls, it overcame this problem by a dynamic state queue. It can handle extra large size of pattern (up to 10,000 nodes). The experiment shows the performance of GE is better than similar algorithms and it is more resistant to ambiguities.","2158-5709","978-1-4244-3728-3","10.1109/ICWAPR.2009.5207466","","https://ieeexplore.ieee.org/stamp/stamp.jsp?arnumber=5207466","Subgraph isomorphism;Tree search","Pattern matching;Tree graphs;Computer science;Wavelet analysis;Pattern analysis;Algorithm design and analysis;Pattern recognition;Electronic mail;Search problems;Tree data structures","","","1","15","IEEE","18 Aug 2009","","","IEEE","IEEE Conferences"
