"Enhanced crowdsourcing for disasters through ham-radio operators","W. Kinsner","Department of Electrical and Computer Engineering, University of Manitoba, Winnipeg, MB, Canada",2014 IEEE Canada International Humanitarian Technology Conference - (IHTC),"6 Jul 2015","2014","","","1","6","This paper describes an enhanced crowdsourcing that may be the only alternative when everything else fails in a disaster. This scheme requires radio operators that can work not only together with other communications media (such as the Internet and wireless phones), but they can also work on their own, if the other media either fail or do not exist in the area. In order to increase the number of such radio operators, a scheme for accelerated radio education and training is required. This paper describes the structure of such a course, its delivery, demonstrations, workshops, and examination that lead to a government-issued Radio Operator's Certificate. The course has evolved over the last 25 years.","","978-1-4799-3996-1","10.1109/IHTC.2014.7147544","","https://ieeexplore.ieee.org/stamp/stamp.jsp?arnumber=7147544","Humanitarian technology for disasters;enhanced crowdsourcing;ham radio education and training","Crowdsourcing;Receiving antennas;Ham radios;Transmission line antennas;Antenna accessories;Antenna measurements;Antenna feeds","","1","","21","IEEE","6 Jul 2015","","","IEEE","IEEE Conferences"
"Maximizing the Total Utility of Requesters in Crowdsourcing","X. Chen","Department of Computer Science, Texas State University, San Marcos, TX",2024 10th IEEE International Conference on High Performance and Smart Computing (HPSC),"19 Jul 2024","2024","","","1","6","Crowdsourcing coordinates a large group of workers online to do small tasks published by requesters on a crowd-sourcing platform. In the literature, the model used by many papers assumes that one task is given to and completed by one worker only. In this paper, we consider a model that extends this model in space and time. Based on our model, we formulate an optimization problem from the perspective of the requesters that maximizes the utility of all the requesters subject to the constraint that the total workload given to a worker should not exceed his capability. We then provide a solution to the problem and design distributed algorithms for the requesters and the workers to interact with each other in multiple rounds. After that, we give a concrete example to explain the solution and the algorithms. Then, we discuss the convergence speed of our algorithms using different methods. Finally, we conduct simulations to compare these convergence methods and draw conclusions.","","979-8-3503-8946-3","10.1109/HPSC62738.2024.00008","","https://ieeexplore.ieee.org/stamp/stamp.jsp?arnumber=10590665","convergence;crowdsourcing;optimization;util-ity;workload","Crowdsourcing;Computational modeling;Task analysis;Distributed algorithms;Optimization;Convergence","","1","","23","IEEE","19 Jul 2024","","","IEEE","IEEE Conferences"
"To Help Without Expectation: Investigating Social Exchanges on a Mobile Crowdsourcing Platform for a Smart City","C. S. Lee; D. H. -L. Goh; H. Osop","Wee Kim Wee School of Communication and Information, Nanyang Technological University, Singapore; Wee Kim Wee School of Communication and Information, Nanyang Technological University, Singapore; School of Computer Science, University of Sydney, Sydney, Australia",2019 ACM/IEEE Joint Conference on Digital Libraries (JCDL),"8 Aug 2019","2019","","","416","417","Drawing from the social exchange theory, this study investigates social exchanges on a mobile crowdsourcing platform (MCP) for a smart city. Specifically, we investigate how users' perceptions of features on a MCP influence their helping behaviors. Preliminary analysis shows that there are three main categories of features (i.e. information, positive emotions and ease of use) and two types of social exchange structures (i.e. reciprocal and productive). Results from regression analyses indicate that positive emotions and ease of use have effects on reciprocal exchange structure while information features have effects on productive exchange structure.","","978-1-7281-1547-4","10.1109/JCDL.2019.00097","","https://ieeexplore.ieee.org/stamp/stamp.jsp?arnumber=8791165","Crowdsourcing, Smart City, Mobile Applications, Social Exchange Theory, Helping","Smart cities;Crowdsourcing;Prototypes;Loading;Regression analysis;Principal component analysis","","1","","5","IEEE","8 Aug 2019","","","IEEE","IEEE Conferences"
"Sifting for Deeper Insights from Public Opinion: Towards Crowdsourcing and Big Data for Project Improvement","J. M. Tshimula; M. Muthoni Njuguna; T. R. Bayala; M. Mukendi Didier; A. Essemlali; H. Kanda; N. S. Ayuni",African Bridge and Research Society; African Bridge and Research Society; African Bridge and Research Society; Groupe de Recherche de Prospection et Valorisation des Données; African Bridge and Research Society; Groupe de Recherche de Prospection et Valorisation des Données; African Bridge and Research Society,2019 IEEE 10th International Conference on Awareness Science and Technology (iCAST),"5 Dec 2019","2019","","","1","5","Over the years, there seems to be a unidirectional top-down approach to decision-making in providing social services to the masses. This has often led to poor uninformed decisions being made with outcomes which do not necessarily match needs. Similarly from the grassroots level, it has been challenging to give opinions that reach the governing authorities (decision-making organs). The government consequently sets targets geared towards addressing societal concerns, but which do not often achieve desired results where such government endeavors are not in harmony with societal needs. With public opinions being heard and given consideration, societal needs can be better known and priorities set to address these concerns. This paper therefore presents a priority-based voting model for governments to collect public opinion data that bring suggestions to boost their endeavors in the right direction using crowdsourcing and big data analytics.","2325-5994","978-1-7281-3821-3","10.1109/ICAwST.2019.8923438","","https://ieeexplore.ieee.org/stamp/stamp.jsp?arnumber=8923438","Business Model;Public Opinion;Public Participation;Big Data","Government;Big Data;Crowdsourcing;Urban areas;Decision making;Data models","","1","","13","IEEE","5 Dec 2019","","","IEEE","IEEE Conferences"
"Rapid Application Development of Ebayanihan Patroller: A Crowdsourcing SMS Service and Web Visualization Disaster Reporting System","M. M. De Leon; M. R. E. Estuar","Department of Information Systems and Computer Science, Ateneo de Manila University, Quezon City, Philippines; Department of Information Systems and Computer Science, Ateneo de Manila University, Quezon City, Philippines",2014 International Conference on IT Convergence and Security (ICITCS),"26 Jan 2015","2014","","","1","4","As a country frequented by natural disasters, it is important for Philippines and its citizens to unite and work together in mitigating the effects of natural disasters. eBayanihan came from the term bayanihan which refers to the widespread Philippine tradition and spirit of communal unity and effort to achieve a common objective. Having information at the most opportune moment is key to saving lives and property during occurrences of natural disasters as well as providing immediate relief to the victims. When regular citizens take part in providing information to authorities that may respond to critical situations, more tragedies may be averted and more needs may be alleviated. Leveraging on the high penetration rate of SMS services in the country, eBayanihan Patroller provides a crowdsourcing SMS service that will allow every Filipino to provide the information needed for informed decision-making.","","978-1-4799-6541-0","10.1109/ICITCS.2014.7021803","","https://ieeexplore.ieee.org/stamp/stamp.jsp?arnumber=7021803","","Mobile communication;Geology;Cities and towns;Tropical cyclones;Companies;Crowdsourcing;Google","","1","","9","IEEE","26 Jan 2015","","","IEEE","IEEE Conferences"
"Crowdsourcing support system for disaster surveillance and response","E. T. . -H. Chu; Y. -L. Chen; J. -Y. Lin; J. W. S. Liu","Department of Electronic and Computer Science Information Engineering, National Yunlin University of Science and Technology, Taiwan; Department of Electronic and Computer Science Information Engineering, National Yunlin University of Science and Technology, Taiwan; Department of Electronic and Computer Science Information Engineering, National Yunlin University of Science and Technology, Taiwan; Institute of Information Science, Academia Sinica, Taiwan",The 15th International Symposium on Wireless Personal Multimedia Communications,"31 Dec 2012","2012","","","21","25","Experiences with past major disasters tell us that people with wireless devices and social network services can be effective mobile human sensors. Eye-witness reports taken at right locations can provide invaluable information and enable a disaster surveillance system to mend blind regions in sensor coverage. In this work, we develop a system, named CROSS, that supports crowdsourcing disaster surveillance data collection by volunteers exploring threatened areas. CROSS first broadcasts a volunteer request to the crowd via social network(s), such as Facebook, Twitter and so on. It then plans exploration routes for the volunteers responded to the request based on their locations.","1882-5621","978-986-03-3407-4","","","https://ieeexplore.ieee.org/stamp/stamp.jsp?arnumber=6398817","Web2.0;Social Network;Crowdsourcing;Disaster Management;Typhoon;Debris flow","Surveillance;Social network services;Sensors;Heuristic algorithms;Routing;Disaster management;Smart phones","","1","2","9","","31 Dec 2012","","","IEEE","IEEE Conferences"
"Sense inventory alignment using lexical substitutions and crowdsourcing","D. Ustalov; S. Igushkin","Ural Federal University, Yekaterinburg, Russia; ITMO University, Saint Petersburg, Russia","2016 International FRUCT Conference on Intelligence, Social Media and Web (ISMW FRUCT)","13 Oct 2016","2016","","","","","Sense inventory induction is a topical problem of deriving a set of synsets representing concepts nsing various automatic or human-assisted methods. There might be, and actually are, mistakes in such synsets. Here we are focused on the problem of eliminating potentially duplicate synsets having exactly two words in common as the broader lntersectlon is known to be successfully addressed by beoristics. We exploit the pbenomena of lexical substitotions and microtaskbased crowdsourcing for aligning the synsets to the individual word senses. We also present an open source mobile application implementing oor approach. Our experiments on the Russian language show that the approach scales well aad dramatically reduces the number of duplicate synsets in the inventory.","","978-952-68397-6-9","10.1109/FRUCT.2016.7584771","","https://ieeexplore.ieee.org/stamp/stamp.jsp?arnumber=7584771","","Crowdsourcing;Servers;Automobiles;Smart phones;Object recognition;Androids;Humanoid robots","","1","","30","","13 Oct 2016","","","IEEE","IEEE Conferences"
"CODECOD: Crowdsourcing Platform for Code Smell Detection","A. J. Paramita; M. Z. Catur Candra","School of Electrical Engineering and Informatics, Institut Teknologi Bandung; School of Electrical Engineering and Informatics, Institut Teknologi Bandung",2018 5th International Conference on Data and Software Engineering (ICoDSE),"6 May 2019","2018","","","1","6","Finding code smells in a program code must be done as soon as possible to improve the software maintainability. Nowadays, various automatic code smell detection tools have been developed. However, to increase the quality, the role of humans who do manual detection is still needed. Therefore, in this work, we develop a platform called CODECEOD, which involves crowd to detect code smells. This platform implements crowdsourcing method by decomposing requested tasks, in the form of uploaded source codes, into microtasks to enable the distribution of tasks to multiple workers. To guarantee the quality of the detection results, we introduced a quality assurance method called Find, Vote, Verify. Based on the evaluation involving software engineers, CODECOD is capable to detect more code smells with high accuracy compared to an automatic tool. Moreover, we also show that the proposed Find, Vote, Verify technique delivers an improved accuracy compared to the traditional output-agreement quality assurance technique.","2640-0227","978-1-5386-7259-4","10.1109/ICODSE.2018.8705923","","https://ieeexplore.ieee.org/stamp/stamp.jsp?arnumber=8705923","crowdsourcing;code smell;task;microtask","Task analysis;Crowdsourcing;Software;Quality control;Software engineering;Quality assurance;Tools","","1","","11","IEEE","6 May 2019","","","IEEE","IEEE Conferences"
"Design and implementation of logistic management system using crowdsourcing: “Indonesia-United logistic”","H. Pradana; A. S. Prihatmanto","School of Electrical Engineering and Informatics, Bandung Institute of Technology, Bandung, Indonesia; School of Electrical Engineering and Informatics, Bandung Institute of Technology, Bandung, Indonesia",2015 4th International Conference on Interactive Digital Media (ICIDM),"21 Jul 2016","2015","","","1","6","Logistics is part of supply chain management in planning, implementing, and controlling the flow and storage of goods, information, and services effectively and efficiently from point of origin to point of destination in accordance with consumer demand. By using information and communication technologies, the public can provide information on the logistics so that the information concerning about logistics in Indonesia knew about the problems that occurred. Indonesia United utilizing virtual communities to create a national information disclosure system that uses the concept of crowdsourcing. This concept is actually not new to Indonesia, because Indonesia has a culture of “gotong-royong” that seems increasingly abandoned. Community of virtual communities can cooperate through mutual exchange and complementary information regarding the logistics. Active participation can include assistance in the form of logistics information systems Indonesia United using Web site.","","978-1-5090-1669-3","10.1109/IDM.2015.7516347","","https://ieeexplore.ieee.org/stamp/stamp.jsp?arnumber=7516347","crowdsourcing;gotong-royong;logistic;Indonesia United;website","Logistics;Portals;Games;Crowdsourcing;Media;Information and communication technology","","1","","14","IEEE","21 Jul 2016","","","IEEE","IEEE Conferences"
"Answering Skyline Queries over Incomplete Data with Crowdsourcing(Extended Abstract)","X. Miao; Y. Gao; S. Guo; L. Chen; J. Yin; Q. Li","Center for Data Science, Zhejiang University, Hangzhou, China; College of Computer Science, Zhejiang University, Hangzhou, China; College of Computer Science, Zhejiang University, Hangzhou, China; Department of Computer Science, Aalborg University, Aalborg, Denmark; Center for Data Science, Zhejiang University, Hangzhou, China; Department of Computer Science, Aalborg University, Aalborg, Denmark",2020 IEEE 36th International Conference on Data Engineering (ICDE),"27 May 2020","2020","","","2032","2033","Due to the pervasiveness of incomplete data, incomplete data queries are vital in a large number of real-life scenarios. Current models and approaches for incomplete data queries mainly rely on the machine power. In this paper, we study the problem of skyline queries over incomplete data with crowdsourcing. We propose a novel query framework, termed as BayesCrowd, on top of Bayesian network and the typical c-table model on incomplete data. Considering budget and latency constraints, we present a suite of effective task selection strategies. In particular, since the probability computation of each object being an answer object is at least as hard as #SAT problem, we propose an adaptive DPLL (i.e., Davis-Putnam-Logemann-Loveland) algorithm to speed up the computation. Extensive experiments using both real and synthetic data sets confirm the superiority of BayesCrowd to the state-of-the-art method.","2375-026X","978-1-7281-2903-7","10.1109/ICDE48307.2020.00235","","https://ieeexplore.ieee.org/stamp/stamp.jsp?arnumber=9101783","","Task analysis;Crowdsourcing;Computational modeling;Data models;Computer science;Bayes methods;Databases","","1","","6","IEEE","27 May 2020","","","IEEE","IEEE Conferences"
"VGI Cooperative Platform for Geo-information Crowdsourcing in Indigenous knowledge of community disaster resilience","H. -L. Lin; K. -L. Pan","Department of Urban Planning, Cheng Kung University, No.1, University Road, Tainan City 701, Taiwan (R.O.C.); Department of Urban Planning, Cheng Kung University, No.1, University Road, Tainan City 701, Taiwan (R.O.C.)",2018 1st IEEE International Conference on Knowledge Innovation and Invention (ICKII),"9 Dec 2018","2018","","","339","342","Indigenous knowledge is important to community disaster resilience because it is the knowledge takes several decades, generations, or even centuries to realize how to avoid natural disaster risks by the lesson learned from interaction with natural environment. Taiwan is high in disaster risks and has been long devoting mass amount of resources in disaster geo-information infrastructures by establishing databases and protocols within government institutions. However, indigenous knowledge for community resilience remains the gap of the disaster information infrastructure. The paper argues disaster resilience communities need geo-information could support the resolution and dynamics of disaster prone communities. Volunteer Geographic Information system (VGI) for crowdsourcing of community disaster information is proposed as an integrated cooperation platform to bridge the gap of official disaster databases..","","978-1-5386-5267-1","10.1109/ICKII.2018.8569095","","https://ieeexplore.ieee.org/stamp/stamp.jsp?arnumber=8569095","VGI;crowd sourcing;disaster resilience","Technological innovation;Geographic information systems;Conferences;Knowledge engineering;Disaster management;Floods;Crowdsourcing","","1","","26","IEEE","9 Dec 2018","","","IEEE","IEEE Conferences"
"Robots-Aided Participatory Crowdsourcing with Limited Task Budget","B. Zhang; C. H. Liu; Z. Zhang; Z. Ren; J. Ma; W. Wang","State Key Lab of Networking and Switching Technology, Beijing University of Posts and Telecom., China; School of Software, Beijing Institute of Technology, China; State Key Lab of Networking and Switching Technology, Beijing University of Posts and Telecom., China; School of Information Science and Technology, Tsinghua University, China; State Key Lab of Networking and Switching Technology, Beijing University of Posts and Telecom., China; State Key Lab of Networking and Switching Technology, Beijing University of Posts and Telecom., China",2016 IEEE 84th Vehicular Technology Conference (VTC-Fall),"20 Mar 2017","2016","","","1","5","Participatory Crowdsourcing System (PCS) is now an important source of information for big data applications. In PCS, required environmental parameters are collected and shared by ordinary citizens. And the limited range of human activities and limited power or capability of smart devices make the PCS facing a lot of problems. But the wide use of robots, such as Unmanned Aerial Vehicle (UAV), can effectively alleviate the current problems in PCS. Lots of precision sensors can be installed into the robots, which makes sensory data collected by robots more trustful. However, the power and data transmission capability of robots are also limited. Meanwhile, it is much more expensive to use robots than recruit human participants. Thus, it will be most useful and necessary to use robots in PCS, let the robots and human participants working together, rather than using robots to replace the human participants. Obviously, the cooperation of robots and human participants will also make PCS facing new challenges, such as how to use the least amount of robots to reduce costs, etc.. In this paper, we analyze the different application scenarios of robots-aided PCS, and propose possible solutions to the existing problems. Finally, we discuss possible future work for robots-aided PCS.","","978-1-5090-1701-0","10.1109/VTCFall.2016.7881203","","https://ieeexplore.ieee.org/stamp/stamp.jsp?arnumber=7881203","","Robot sensing systems;Servers;Smart devices;Data privacy;Robot kinematics","","","","20","IEEE","20 Mar 2017","","","IEEE","IEEE Conferences"
"PETRA: A Crowdsourcing-Based Platform for Rocks Data Collection and Characterization","R. A. Mira; P. L. Suarez; R. E. Rivadeneira; A. D. Sappa","Escuela Superior Politćnica del Litoral, ESPOL, ESPOL Polytechnic University, Guayaquil, Ecuador; Escuela Superior Politćnica del Litoral, ESPOL, ESPOL Polytechnic University, Guayaquil, Ecuador; Escuela Superior Politćnica del Litoral, ESPOL, ESPOL Polytechnic University, Guayaquil, Ecuador; Escuela Superior Politćnica del Litoral, ESPOL, ESPOL Polytechnic University, Guayaquil, Ecuador",2019 IEEE Fourth Ecuador Technical Chapters Meeting (ETCM),"28 Feb 2020","2019","","","1","6","This paper presents details of a distributed platform intended for data acquisition, evaluation, storage and visualization, which is fully implemented under the crowdsourcing paradigm. The proposed platform is the result from collaboration between computer science and petrology researchers and it is intended for academic purposes. The platform is designed within a MTV (Model, Template and View) architecture and also designed for a collaborative data store and managing of rocks from multiple readers and writers, taking advantage of ubiquity of web applications, and neutrality of researchers from different communities to validate the data. The platform is being used and validated by students and academics from our university; in the near future it will be open to other users interested on this topic.","","978-1-7281-3764-3","10.1109/ETCM48019.2019.9014873","","https://ieeexplore.ieee.org/stamp/stamp.jsp?arnumber=9014873","crowdsourcing;collaborative framework;website;characterization in petrology","Rocks;Crowdsourcing;Libraries;Task analysis;Data acquisition;Collaboration;Microscopy","","","","18","IEEE","28 Feb 2020","","","IEEE","IEEE Conferences"
"Improving Urban Accessibility Data Collection through Enhanced User Experience in a Crowdsourcing Web Application","T. Ortiz; V. Tang","Department of Computer Science, The City College of New York, CUNY New York, New York; Magnet School for Science, Mathematics, Technology Union County Vocational-Technical School Scotch Plains, New Jersey",2024 4th International Conference on Information Communication and Software Engineering (ICICSE),"12 Aug 2024","2024","","","55","59","To support people’s independent travel and reduce their stress in travel planning, DoorFront.org was developed to collect large-scale accessibility data of (NYC) storefronts using crowdsourcing, Google Street View (GSV), and artificial intelligence (AI). The collected data includes useful visual knowledge, such as bounding boxes of various storefront objects in GSV images and their corresponding geographical locations. With this data, the development of assistive apps for orientation and mobility training or real-time navigation becomes possible, which greatly facilitates independent travel for people with visual impairment. However, collecting a high-quality large-scale urban accessibility dataset requires numerous volunteers to participate. In this paper, we aim to engage more volunteers and improve their user experience by designing and developing gamification functionalities and user interfaces that showcase volunteer contributions.","","979-8-3503-5169-9","10.1109/ICICSE61805.2024.10625690","","https://ieeexplore.ieee.org/stamp/stamp.jsp?arnumber=10625690","Crowdsourcing;Urban Accessibility;Independent Travel;Visually Impaired;Open-Source Data;Mapathon","Crowdsourcing;Training;Visualization;Visual impairment;Data collection;User interfaces;User experience","","","","11","IEEE","12 Aug 2024","","","IEEE","IEEE Conferences"
