"An endorsement-based reputation system for trustworthy crowdsourcing","C. Wu; T. Luo; F. Wu; G. Chen","Department of Computer Science and Engineering, Shanghai Jiao Tong University, China; A*STAR, Institute for Infocomm Research, Singapore; Department of Computer Science and Engineering, Shanghai Jiao Tong University, China; Department of Computer Science and Engineering, Shanghai Jiao Tong University, China",2015 IEEE Conference on Computer Communications Workshops (INFOCOM WKSHPS),"6 Aug 2015","2015","","","89","90","Crowdsourcing is a new distributed computing paradigm that leverages the wisdom of crowd and the voluntary human effort to solve problems or collect data. In this paradigm of soliciting user contributions, the trustworthiness of contributions becomes a matter of crucial importance to the viability of crowdsourcing. Prior mechanisms either do not consider the trustworthiness of contributions or assess the quality of contributions only after the event, resulting in irreversible effort exertion and distorted player utilities. In this paper, we propose a reputation system to not only assess but also predict the trustworthiness of user contributions. In particular, we explore an inter-worker relationship called endorsement to improve trustworthiness prediction using machine learning methods, while taking into account the heterogeneity of both workers and tasks.","","978-1-4673-7131-5","10.1109/INFCOMW.2015.7179357","","https://ieeexplore.ieee.org/stamp/stamp.jsp?arnumber=7179357","","Crowdsourcing;Collaboration;Sensors;Conferences;Sociology;Statistics;Computers","","6","","5","IEEE","6 Aug 2015","","","IEEE","IEEE Conferences"
"Signal propagation-based outlier reduction technique (SPORT) for crowdsourcing in indoor localization using fingerprints","L. Zhang; S. Valaee; L. Zhang; Y. Xu; L. Ma","Communication Research Center, Harbin Institute of Technology, Harbin, Heilonaiianu, P.R.China; Department of Electrical and Computer Engineering, University of Toronto, Toronto, Ontario, Canada; Department of Electrical and Computer Engineering, University of Toronto, Toronto, Ontario, Canada; Communication Research Center, Harbin Institute of Technology, Harbin, Heilonaiianu, P.R.China; Communication Research Center, Harbin Institute of Technology, Harbin, Heilonaiianu, P.R.China","2015 IEEE 26th Annual International Symposium on Personal, Indoor, and Mobile Radio Communications (PIMRC)","3 Dec 2015","2015","","","2008","2013","Crowdsourcing allows for rapid deployment of indoor localization systems. However, compared to the conventional methods, crowdsourcing might collect fewer received signal strength (RSS) values, hence result in greater influence to outliers in RSS values. In this paper, we propose an algorithm to detect such outliers and to substitute them with more suitable RSS values. In particular, we investigate the relationship of RSS values between adjacent locations using a signal propagation model and show that the outliers can be corrected using a signal propagation model. We propose the Signal Propagation-based Outlier Reduction Technic (SPORT) for identifying and adjusting outlier values in both the offline training phase and the online localization phase. Experimental results show that SPORT greatly smoothens the radio map and improves the location accuracy.","","978-1-4673-6782-0","10.1109/PIMRC.2015.7343628","","https://ieeexplore.ieee.org/stamp/stamp.jsp?arnumber=7343628","","Silicon;Training;Crowdsourcing;Mobile handsets;Land mobile radio;Mobile computing","","5","","16","IEEE","3 Dec 2015","","","IEEE","IEEE Conferences"
"ProCircle: A promotion platform using crowdsourcing and web data scraping technique","L. Junjoewong; S. Sangnapachai; T. Sunetnanta","Faculty of Information and Communication Technology, Mahidol University, Thailand; Faculty of Information and Communication Technology, Mahidol University, Thailand; Faculty of Information and Communication Technology, Mahidol University, Thailand",2018 Seventh ICT International Student Project Conference (ICT-ISPC),"8 Nov 2018","2018","","","1","5","Nowadays there is a lot of marketing promotions published on various websites each day. People often have to search several websites to find the promotions that they want. Our mobile application, `ProCircle', was developed as a platform to collect promotion news into one place. We used web data scraping technique for scraping promotion news from reliable websites. In addition, we also applied crowdsourcing technique to obtain supporting data of promotion news which can be rapidly evolved. Together the scrapped promotion news and the supporting data from crowdsourcing will allow the collective search of promotion information in our ProCircle platform.","","978-1-5386-7805-3","10.1109/ICT-ISPC.2018.8524003","","https://ieeexplore.ieee.org/stamp/stamp.jsp?arnumber=8524003","Web data scraping;Crowdsourcing;Android application;Marketing Promotion Information","Crowdsourcing;Data mining;Companies;Advertising;Reliability","","5","","7","IEEE","8 Nov 2018","","","IEEE","IEEE Conferences"
"Segmenting The Kidney On CT Scans Via Crowdsourcing","P. Mehta; V. Sandfort; D. Gheysens; G. -J. Braeckevelt; J. Berte; R. M. Summers","Imaging Biomarkers and Computer-aided Diagnosis Laboratory, National Institutes of Health Clinical Center, Bethesda, MD, USA; Imaging Biomarkers and Computer-aided Diagnosis Laboratory, National Institutes of Health Clinical Center, Bethesda, MD, USA; Robovision AI, Gent, Belgium; Robovision AI, Gent, Belgium; Robovision AI, Gent, Belgium; Imaging Biomarkers and Computer-aided Diagnosis Laboratory, National Institutes of Health Clinical Center, Bethesda, MD, USA",2019 IEEE 16th International Symposium on Biomedical Imaging (ISBI 2019),"11 Jul 2019","2019","","","829","832","Organ segmentation, or annotation, is an essential step for a variety of radiologic purposes such as automated organ detection, automated lesion detection, and radiotherapy. Convolutional Neural Networks (CNN) are a class of neural network that requires large amounts of training data for sensitive and specific image analysis. Medical image annotation of reference standard training data is costly and time consuming for relevant clinically experienced professionals. Here, we evaluate the feasibility of using crowdsourcing from untrained workers as a viable modality for large-scale data annotation. This pilot study evaluates the accuracy and usage viability of crowdsourced kidney segmentations. 42 CT scans were labeled by 72 users on the Robovision AI platform and their submissions averaged. Primary validation was conducted by comparing the crowd's submissions to reference segmentations. Crowdsourced segmentations and expert-labeled segmentations were then used individually and together as training data for separate CNN models. We found that the performance of the model trained on crowdsourcing data (Dice score = 0.904 ± 0.026) was not significantly different (P = 0.50) compared to the performance of the expert-labeled model (Dice Score = 0.885 ± 0.112). When trained on a combined set, the CNN performance achieved a comparable result (Dice Score = 0.932 ± 0.040). These data suggest that untrained workers can be used as cost-effective alternatives to expert segmentation in radiologic kidney segmentation. This presents a new modality for scalable, medical imaging data generation.","1945-8452","978-1-5386-3641-1","10.1109/ISBI.2019.8759240","","https://ieeexplore.ieee.org/stamp/stamp.jsp?arnumber=8759240","crowdsourcing;organ segmentation;CNN;kidney","Image segmentation;Kidney;Computed tomography;Crowdsourcing;Biomedical imaging;Standards;Training data","","5","","13","IEEE","11 Jul 2019","","","IEEE","IEEE Conferences"
"A Decentralized, Privacy-preserving and Crowdsourcing-based Approach to Medical Research","S. Ghaffaripour; A. Miri","Department of Computer Science, Ryerson University, Toronto, Canada; Department of Computer Science, Ryerson University, Toronto, Canada","2020 IEEE International Conference on Systems, Man, and Cybernetics (SMC)","14 Dec 2020","2020","","","4510","4515","Access to data at large scales expedites the progress of research in medical fields. Nevertheless, accessibility to patients' data faces significant challenges on regulatory, organizational and technical levels. In light of this, we present a novel approach based on the crowdsourcing paradigm to solve this data scarcity problem. Utilizing the infrastructure that blockchain provides, our decentralized platform enables researchers to solicit contributions to their well-defined research study from a large crowd of volunteers. Furthermore, to overcome the challenge of breach of privacy and mutual trust, we employed the cryptographic primitive of Zero-knowledge Argument of Knowledge (zk-SNARK). This not only allows participants to make contributions without exposing their privacy-sensitive health data, but also provides a means for a distributed network of users to verify the validity of the contributions in an efficient manner. Finally, since without an incentive mechanism in place, the crowdsourcing platform would be rendered ineffective, we incorporated smart contracts to ensure a fair reciprocal exchange of data for reward between patients and researchers.","2577-1655","978-1-7281-8526-2","10.1109/SMC42975.2020.9283027","","https://ieeexplore.ieee.org/stamp/stamp.jsp?arnumber=9283027","crowdsourcing;machine learning;zero-knowledge proof;zk-SNARK;commitment schemes;commit-and-prove;verifiable computation","Crowdsourcing;Privacy;Smart contracts;Distributed databases;Cryptography;Faces;Cybernetics","","5","","17","IEEE","14 Dec 2020","","","IEEE","IEEE Conferences"
"CochlScene: Acquisition of acoustic scene data using crowdsourcing","I. -Y. Jeong; J. Park","Cochl, Inc., Seoul, Republic of Korea; Cochl, Inc., Seoul, Republic of Korea",2022 Asia-Pacific Signal and Information Processing Association Annual Summit and Conference (APSIPA ASC),"21 Dec 2022","2022","","","17","21","This paper describes a pipeline for collecting acoustic scene data by using crowdsourcing. The detailed process of crowdsourcing is explained, including planning, validation criteria, and actual user interfaces. As a result of data collection, we present CochlScene, a novel dataset for acoustic scene classification. Our dataset consists of 76k samples collected from 831 participants in 13 acoustic scenes. We also propose a manual data split of training, validation, and test sets to increase the reliability of the evaluation results. Finally, we provide a baseline system for future research.","2640-0103","978-616-590-477-3","10.23919/APSIPAASC55919.2022.9979822","","https://ieeexplore.ieee.org/stamp/stamp.jsp?arnumber=9979822","","Crowdsourcing;Training;Image analysis;Pipelines;Data collection;User interfaces;Acoustics","","5","","15","","21 Dec 2022","","","IEEE","IEEE Conferences"
"Crowdsourcing and Its Application for Traffic Survey Work","T. Koita; S. Suzuki","Faculty of Science and Engineering, Doshisha University, Kyoto, Japan; Faculty of Science and Engineering, Doshisha University, Kyoto, Japan",2019 IEEE 4th International Conference on Big Data Analytics (ICBDA),"13 May 2019","2019","","","375","378","The main current method for obtaining traffic volume data in surveys involves survey personnel using counters. However, at least two persons are required for each lane to obtain a high level of accuracy, because the counting is done in real time. As a result, work cost is high and reducing cost while maintaining the same level of accuracy is a problem. As a cost reduction measure that addresses that problem, the use of crowdsourcing for measuring traffic is proposed and the usefulness of that measure is examined. Specifically, an evaluation of accuracy when data is acquired by an unspecified large number of workers shows that the proposed method can reduce survey cost while maintaining the same accuracy as the existing method by eliminating unproductive time. The results demonstrate the feasibility of applying crowdsourcing, which uses human processing capability as opposed to big data processing.","","978-1-7281-1282-4","10.1109/ICBDA.2019.8712831","","https://ieeexplore.ieee.org/stamp/stamp.jsp?arnumber=8712831","crowd sourcing;Amazon Mechanical Turk;traffic survey","Task analysis;Crowdsourcing;Cameras;Real-time systems;Roads;Computers;Big Data","","4","","10","IEEE","13 May 2019","","","IEEE","IEEE Conferences"
"Project spear: Reporting human trafficking using crowdsourcing","S. Roshan; S. V. Kumar; M. Kumar","Department of Information Technology, National Institute Of Technology, Surathkal, Karnataka, India; National Institute of Technology Karnataka, Surathkal, Karnataka, IN; Department of Information Technology, National Institute Of Technology, Surathkal, Karnataka, India","2017 4th IEEE Uttar Pradesh Section International Conference on Electrical, Computer and Electronics (UPCON)","11 Jan 2018","2017","","","295","299","Human trafficking is a severe crime which is prevailing in the society. It is hard to track and report incidents of human trafficking to the concerned authorities, due to the complex nature of this crime. This paper introduces a crowdsourcing approach to report incidents of human trafficking, using a mobile application. Crowdsourcing is the practice of obtaining information from a large number of people. Information about human trafficking incidents reported using this mobile application is forwarded to the concerned authorities of the country where the crime has been reported. A user can also upload crime scene photos and provide details of the crime location using Global Positioning System. The mobile application introduced in this paper currently focuses on top ten countries which have the highest rates of human trafficking in the world, while very basic support for the rest of the countries. Since the process of reporting human trafficking incidents to the authorities can be complex, time consuming and dangerous, the mobile application allows users to stay anonymous. The aim of this mobile application is to create huge impact in the fight against human trafficking, by using the collective power of the crowd to report incidents of human trafficking. Also, a section of the mobile application is dedicated to educating the user about basic knowledge of human trafficking, its types and measures taken by various governments to fight against it.","","978-1-5386-3004-4","10.1109/UPCON.2017.8251063","","https://ieeexplore.ieee.org/stamp/stamp.jsp?arnumber=8251063","Human Trafficking;Humanitarian Technology;Crowdsourcing;Mobile application","Androids;Humanoid robots;Mobile applications;Portals;Government;Electronic mail;Mobile communication","","4","","18","IEEE","11 Jan 2018","","","IEEE","IEEE Conferences"
"Mobile Services for Enhancing Human Crowdsourcing with Computing Elements","J. Jarrett; I. Saleh; M. B. Blake; S. Thorpe; T. Grandison; R. Malcolm","Department of Computer Science, University of Miami, Coral Gables, Miami, Florida; Department of Computer Science, University of Miami, Coral Gables, Miami, Florida; Department of Computer Science, University of Miami, Coral Gables, Miami, Florida; Computational Sciences Research Group, University of Technology Jamaica, Kingston, Jamaica; Proficiency Labs, Ashland, Oregon, USA; Computational Sciences Research Group, University of Technology Jamaica, Kingston, Jamaica",2014 IEEE International Conference on Mobile Services,"16 Oct 2014","2014","","","149","152","Crowdsourcing enables one to leverage the power of the crowd. Normally, it involves utilizing humans for tasks that machines have difficulty performing. We propose a system, delivered as a mobile service, which dynamically adapts to the application domain and selects a combination of human and machine crowdsourcing components. Our work is towards the design of elastic systems that adaptively optimizes the use of human and automated software resources in order to maximize overall performance. We propose a performance model that predicts both human and machine outcomes for a certain task and then optimizes task assignment accordingly. Our experimentation shows that our proposed system significantly enhances the outcome precision of a crowdsourced task.","2329-6453","978-1-4799-5060-7","10.1109/MobServ.2014.30","","https://ieeexplore.ieee.org/stamp/stamp.jsp?arnumber=6924307","Mobile;Crowdsourcing;Services","Face recognition;Mobile communication;Elasticity;Crowdsourcing;Mobile handsets;Face;Software","","4","","7","IEEE","16 Oct 2014","","","IEEE","IEEE Conferences"
"Ai-Enhanced Incentive Design for Crowdsourcing in Internet of Vehicles","Y. Yue; W. Sun; J. Liu; Y. Jiang","School of Cyber Engineering, Xidian University, Xi'an, China; School of Cybersecurity, Northwestern Polytechnical University, Xi'an, China; School of Cybersecurity, Northwestern Polytechnical University, Xi'an, China; School of Cyber Engineering, Xidian University, Xi'an, China",2019 IEEE 90th Vehicular Technology Conference (VTC2019-Fall),"7 Nov 2019","2019","","","1","5","Crowdsourcing, as an essential part in Internet of Vehicles (IoV), can provide vehicles with various functions such as road condition monitoring and path planning. The prevalence and heterogeneity of crowdsourcing devices, although enabling various emerging applications in IoV, makes it challenging to yield intelligent and flexible incentive and management framework, while ensuring optimal choice for all entities. Note that artificial intelligence (AI) algorithms could automatically select the significant features in the underlying data and globally find optimal solutions even for non-convex object functions. In this paper, we propose an AI-driven incentive scheme using a deep learning based reverse auction scheme, in order to achieve revenue-optimal, dominant-strategy incentive compatible objectives. The effectiveness of the proposed framework has been verified through extensive simulations.","2577-2465","978-1-7281-1220-6","10.1109/VTCFall.2019.8891430","","https://ieeexplore.ieee.org/stamp/stamp.jsp?arnumber=8891430","","Crowdsourcing;Resource management;Sensors;Deep learning;Pricing;Neural networks","","4","","13","IEEE","7 Nov 2019","","","IEEE","IEEE Conferences"
"A Method to Collect Multi-view Images of High Importance Using Disaster Map and Crowdsourcing","K. Kobayashi; H. Shishido; Y. Kameda; I. Kitahara","Master’s Program in Intelligent Interaction Technologies, University of Tsukuba, Tsukuba, Japan; Center for Computational Sciences, University of Tsukuba, Tsukuba, Japan; Center for Computational Sciences, University of Tsukuba, Tsukuba, Japan; Center for Computational Sciences, University of Tsukuba, Tsukuba, Japan",2018 IEEE International Conference on Big Data (Big Data),"24 Jan 2019","2018","","","3510","3512","In recent years, research efforts have enabled using the internet in disaster areas, and information technology (IT) is expected to improve our comprehension and evaluation of disasters. In disaster areas, crowdsourcing can be employed to secure human resources and controlled-task distribution. In crowdsourcing, many workers with publicly defined tasks (also called microtasks) are used. A simplified and more efficient microtask framework is required for disaster areas due to the lack of human resources and facilities. In this paper, we describe a method that incorporates information collection from a disaster area into microtasks with machine processing support.","","978-1-5386-5035-6","10.1109/BigData.2018.8622193","","https://ieeexplore.ieee.org/stamp/stamp.jsp?arnumber=8622193","crowdsourcing;3D reconstruction;multi-view images;grasping damage states;microtask generation","Three-dimensional displays;Crowdsourcing;Buildings;Solid modeling;Drones;Image reconstruction;Middleware","","4","","6","IEEE","24 Jan 2019","","","IEEE","IEEE Conferences"
"Standardizing the Crowdsourcing of Healthcare Data Using Modular Ontologies","H. Hu; L. Kerschberg","Department of Information Sciences and Technology, George Mason University, Fairfax, VA; Department of Computer Science, George Mason University, Fairfax, VA",2017 IEEE 41st Annual Computer Software and Applications Conference (COMPSAC),"11 Sep 2017","2017","2","","107","112","Crowdsourcing data is an essential part of information collection in healthcare. Patient data serves as the foundation for creating healthcare policy, creating new pharmaceuticals, and determining treatment. In this paper, we propose a novel conceptual method of standardizing and classifying the crowdsourcing of healthcare data using modular ontologies, authoritative medical ontologies (AMOs) and other sources. A modular ontology can be constructed to guide data collection for specific aspects of an illness. We will examine this conceptual approach for patients of depression. This will be done by finding association rules in a pre-existing National Institutes of Mental Health (NIMH)'s study on Sequenced Treatment Alternatives to Relieve Depression (STAR*D) patient dataset, and standardized medical terminology found in the Medical Dictionary for Regulatory Activities Terminology (MedDRA) ontology. We will also use classification knowledge from Diagnostic and Statistical Manual of Mental Disorders (DSM-5). Our conceptual method will ensure that newly crowdsourced data can be used to confirm and improve upon the accuracy of previously known symptom associations.","0730-3157","978-1-5386-0367-3","10.1109/COMPSAC.2017.220","","https://ieeexplore.ieee.org/stamp/stamp.jsp?arnumber=8029902","Crowdsourcing;healthcare information technology;patient tracking;modular ontology;ontology;data mining","Ontologies;Itemsets;Crowdsourcing;Medical diagnostic imaging;Diseases;Terminology","","4","","27","IEEE","11 Sep 2017","","","IEEE","IEEE Conferences"
"TMarkov: LBS Trajectory Prediction for Crowdsourcing Recommendation","G. Qiu; K. Cheng; L. Liu; S. Zeng","School of Computer Science and Technology, Xidian University, Xi'an, China; School of Computer Science and Technology, Xidian University, Xi'an, China; School of Computer Science and Technology, Xidian University, Xi'an, China; School of Information Technology, Hebei Normal University, Shijiazhuang, China",2018 International Conference on Networking and Network Applications (NaNA),"24 Feb 2019","2018","","","153","158","With the popularity of modern smart mobile terminals and LBS, crowdsourcing has increasingly become a solution for large-scale real-time tasks. Previous crowdsourcing efforts required participants to provide actual location trajectory information for allocating tasks. Exposure of location information directly threatens the privacy security of the user. Aiming at the problem of privacy leakage of user's personal location in crowdsourced applications, this paper proposes a solution based on improved Markov method. we introduces time partitioning into Markov spatial transition matrix and uses historical trajectory data to learn and predict locations for user with maximum probability at specific times, then forming a user's predicted trajectory. Experimental results show that the proposed method can solve the problem of trajectory prediction well.","","978-1-5386-8303-3","10.1109/NANA.2018.8648773","","https://ieeexplore.ieee.org/stamp/stamp.jsp?arnumber=8648773","Crowdsourcing;Tasks Recommendation;Time Partitioning;Gibbs Sample","Trajectory;Markov processes;Crowdsourcing;Privacy;Task analysis;Data privacy;Training","","4","","20","IEEE","24 Feb 2019","","","IEEE","IEEE Conferences"
"Open data, crowdsourcing, and city planning","M. Mao; Y. Long","Planning information centre Beijing Municipal Institute of City Planning & Design, Beijing, China; Planning information centre Beijing Municipal Institute of City Planning & Design, Beijing, China",2014 22nd International Conference on Geoinformatics,"10 Nov 2014","2014","","","1","4","With the development of information technologies, open data released by central and local governments and crowdsourcing means are emerging in China. In this article, we first address this phenomenon by describing open data source, open data, and crowdsourcing datasets. We secondly address case studies on using open data are elaborated, most of which are developed by a recently-established network city lab Beijing City Lab (BCL, http://longy.jimdo.com). Lastly, we address the potential opportunities for public participation in urban planning and public governance for urban management in detail.","2161-0258","978-1-4799-5714-9","10.1109/GEOINFORMATICS.2014.6950829","","https://ieeexplore.ieee.org/stamp/stamp.jsp?arnumber=6950829","open data;crowdsourcing;public paticipation;city planning;public governance;Beijing City Lab (BCL)","Government;Computational modeling;Cities and towns","","3","","9","IEEE","10 Nov 2014","","","IEEE","IEEE Conferences"
