"Reputation-based incentive protocols in crowdsourcing applications","Y. Zhang; M. van der Schaar","Department of Electrical Engineering, University of California, Los Angeles, Los Angeles, CA, USA; Department of Electrical Engineering, University of California, Los Angeles, Los Angeles, CA, USA",2012 Proceedings IEEE INFOCOM,"10 May 2012","2012","","","2140","2148","Crowdsourcing websites (e.g. Yahoo! Answers, Amazon Mechanical Turk, and etc.) emerged in recent years that allow requesters from all around the world to post tasks and seek help from an equally global pool of workers. However, intrinsic incentive problems reside in crowdsourcing applications as workers and requester are selfish and aim to strategically maximize their own benefit. In this paper, we propose to provide incentives for workers to exert effort using a novel game-theoretic model based on repeated games. As there is always a gap in the social welfare between the non-cooperative equilibria emerging when workers pursue their self-interests and the desirable Pareto efficient outcome, we propose a novel class of incentive protocols based on social norms which integrates reputation mechanisms into the existing pricing schemes currently implemented on crowdsourcing websites, in order to improve the performance of the non-cooperative equilibria emerging in such applications. We first formulate the exchanges on a crowdsourcing website as a two-sided market where requesters and workers are matched and play gift-giving games repeatedly. Subsequently, we study the protocol designer's problem of finding an optimal and sustainable (equilibrium) protocol which achieves the highest social welfare for that website. We prove that the proposed incentives protocol can make the website operate close to Pareto efficiency. Moreover, we also examine an alternative scenario, where the protocol designer aims at maximizing the revenue of the website and evaluate the performance of the optimal protocol.","0743-166X","978-1-4673-0775-8","10.1109/INFCOM.2012.6195597","","https://ieeexplore.ieee.org/stamp/stamp.jsp?arnumber=6195597","","Protocols;Pricing;Games;Analytical models;Electrical engineering;USA Councils;Educational institutions","","213","","17","IEEE","10 May 2012","","","IEEE","IEEE Conferences"
"Truthful incentive mechanisms for crowdsourcing","X. Zhang; G. Xue; R. Yu; D. Yang; J. Tang","Arizona State University, Tempe, AZ; Arizona State University, Tempe, AZ; Arizona State University, Tempe, AZ; Colorado School of Mines, Golden, CO; Syracuse University, Syracuse, NY",2015 IEEE Conference on Computer Communications (INFOCOM),"24 Aug 2015","2015","","","2830","2838","With the prosperity of smart devices, crowdsourcing has emerged as a new computing/networking paradigm. Through the crowdsourcing platform, service requesters can buy service from service providers. An important component of crowdsourcing is its incentive mechanism. We study three models of crowdsourcing, which involve cooperation and competition among the service providers. Our simplest model generalizes the well-known user-centric model studied in a recent Mobicom paper. We design an incentive mechanism for each of the three models, and prove that these incentive mechanisms are individually rational, budget-balanced, computationally efficient, and truthful.","0743-166X","978-1-4799-8381-0","10.1109/INFOCOM.2015.7218676","","https://ieeexplore.ieee.org/stamp/stamp.jsp?arnumber=7218676","","Crowdsourcing;Biological system modeling;Computational modeling;Cost accounting;Monopoly;Conferences;Computers","","150","","28","IEEE","24 Aug 2015","","","IEEE","IEEE Conferences"
"High quality participant recruitment in vehicle-based crowdsourcing using predictable mobility","Z. He; J. Cao; X. Liu","Department of Computing, The Hong Kong Polytechnic University, Hong Kong; Department of Computing, The Hong Kong Polytechnic University, Hong Kong; Department of Computing, The Hong Kong Polytechnic University, Hong Kong",2015 IEEE Conference on Computer Communications (INFOCOM),"24 Aug 2015","2015","","","2542","2550","The potential of crowdsourcing for complex problem solving has been revealed by smartphones. Nowadays, vehicles have also been increasingly adopted as participants in crowd-sourcing applications. Different from smartphones, vehicles have the distinct advantage of predictable mobility, which brings new insight into improving the crowdsourcing quality. Unfortunately, utilizing the predictable mobility in participant recruitment poses a new challenge of considering not only current location but also the future trajectories of participants. Therefore, existing participant recruitment algorithms that only use the current location may not perform well. In this paper, based on the predicted trajectory, we present a new participant recruitment strategy for vehicle-based crowdsourcing. This strategy guarantees that the system can perform well using the currently recruited participants for a period of time in the future. The participant recruitment problem is proven to be NP-complete, and we propose two algorithms, a greedy approximation and a genetic algorithm, to find the solution for different application scenarios. The performance of our algorithms is demonstrated with traffic trace dataset. The results show that our algorithms outperform some existing approaches in terms of the crowdsourcing quality.","0743-166X","978-1-4799-8381-0","10.1109/INFOCOM.2015.7218644","","https://ieeexplore.ieee.org/stamp/stamp.jsp?arnumber=7218644","","Crowdsourcing;Vehicles;Trajectory;Approximation algorithms;Algorithm design and analysis;Recruitment;Monitoring","","138","","23","IEEE","24 Aug 2015","","","IEEE","IEEE Conferences"
"Prediction-Based Task Assignment in Spatial Crowdsourcing","P. Cheng; X. Lian; L. Chen; C. Shahabi","Kent State University, Ohio, USA; Hong Kong University of Science and Technology, Hong Kong, China; University of Southern California, California, USA; Hong Kong University of Science and Technology, Hong Kong, China",2017 IEEE 33rd International Conference on Data Engineering (ICDE),"18 May 2017","2017","","","997","1008","With the rapid advancement of mobile devices and crowdsourcing platforms, spatial crowdsourcing has attracted much attention from various research communities. A spatial crowdsourcing system periodically matches a number of locationbased workers with nearby spatial tasks (e.g., taking photos or videos at some specific locations). Previous studies on spatial crowdsourcing focus on task assignment strategies that maximize an assignment score based solely on the available information about workers/tasks at the time of assignment. These strategies can only achieve local optimality by neglecting the workers/tasks that may join the system in a future time. In contrast, in this paper, we aim to improve the global assignment, by considering both present and future (via predictions) workers/tasks. In particular, we formalize a new optimization problem, namely maximum quality task assignment (MQA). The optimization objective of MQA is to maximize a global assignment quality score, under a traveling budget constraint. To tackle this problem, we design an effective grid-based prediction method to estimate the spatial distributions of workers/tasks in the future, and then utilize the predictions to assign workers to tasks at any given time instance. We prove that the MQA problem is NPhard, and thus intractable. Therefore, we propose efficient heuristics to tackle the MQA problem, including MQA greedy and MQA divide-and-conquer approaches, which can efficiently assign workers to spatial tasks with high quality scores and low budget consumptions. Through extensive experiments, we demonstrate the efficiency and effectiveness of our approaches on both real and synthetic datasets.","2375-026X","978-1-5090-6543-1","10.1109/ICDE.2017.146","","https://ieeexplore.ieee.org/stamp/stamp.jsp?arnumber=7930042","","Crowdsourcing;Optimization;Mobile handsets;Performance evaluation;Conferences;Data engineering;Videos","","87","","26","IEEE","18 May 2017","","","IEEE","IEEE Conferences"
"Cooperation-Aware Task Assignment in Spatial Crowdsourcing","P. Cheng; L. Chen; J. Ye","HKUST, Hong Kong, China; HKUST, Hong Kong, China; AI Labs, DiDi Chuxing, Beijing, China",2019 IEEE 35th International Conference on Data Engineering (ICDE),"6 Jun 2019","2019","","","1442","1453","With the popularity of smart devices and the development of high-speed wireless networks, the spatial crowdsourcing has attracted much attention from both academia and industry (e.g., Uber and TaskRabbit). Specifically, a spatial crowdsourcing platform assigns workers to location-based tasks according to their current positions, then the workers need to physically move to the specified locations to conduct the assigned tasks. In this paper, we consider an important spatial crowdsourcing problem, namely cooperation-aware spatial crowdsourcing (CA-SC), where spatial tasks (e.g., collecting the Wi-Fi signal strength in one building) are time-constrained and require more than one worker to complete thus the cooperation among assigned workers is essential to the result. Our CA-SC problem is to assign workers to spatial tasks such that the overall cooperation quality is maximized. We prove that the CA-SC problem is NP-hard by reducing from the k-set packing problem, thus intractable. To tackle the CA-SC problem, we propose task-priority greedy (TPG) approach and game theoretic (GT) approach with two optimization methods to quickly solve the CA-SC problem and achieve high total cooperation quality scores. Through extensive experiments, we demonstrate the efficiency and effectiveness of our proposed approaches over both real and synthetic datasets.","2375-026X","978-1-5386-7474-1","10.1109/ICDE.2019.00130","","https://ieeexplore.ieee.org/stamp/stamp.jsp?arnumber=8731402","Spatial Crowdsourcing;Game Theoretic Algorithm;Task Assignment","Task analysis;Crowdsourcing;Games;Optimization methods;Mathematical model;Smart devices;Wireless networks","","47","","34","IEEE","6 Jun 2019","","","IEEE","IEEE Conferences"
"Differentially Private Online Task Assignment in Spatial Crowdsourcing: A Tree-based Approach","Q. Tao; Y. Tong; Z. Zhou; Y. Shi; L. Chen; K. Xu","BDBC, SKLSDE Lab and IRI, Beihang University, China; BDBC, SKLSDE Lab and IRI, Beihang University, China; ETH Zurich, Zurich, Switzerland; BDBC, SKLSDE Lab and IRI, Beihang University, China; The Hong Kong University of Science and Technology, Hong Kong SAR, China; BDBC, SKLSDE Lab and IRI, Beihang University, China",2020 IEEE 36th International Conference on Data Engineering (ICDE),"27 May 2020","2020","","","517","528","With spatial crowdsourcing applications such as Uber and Waze deeply penetrated into everyday life, there is a growing concern to protect user privacy in spatial crowdsourcing. Particularly, locations of workers and tasks should be properly processed via certain privacy mechanism before reporting to the untrusted spatial crowdsourcing server for task assignment. Privacy mechanisms typically permute the location information, which tends to make task assignment ineffective. Prior studies only provide guarantees on privacy protection without assuring the effectiveness of task assignment. In this paper, we investigate privacy protection for online task assignment with the objective of minimizing the total distance, an important task assignment formulation in spatial crowdsourcing. We design a novel privacy mechanism based on Hierarchically Well-Separated Trees (HSTs). We prove that the mechanism is ε-Geo-Indistinguishable and show that there is a task assignment algorithm with a competitive ratio of O(ε1/4 log N log2 k), where ε is the privacy budget, N is the number of predefined points on the HST, and k is the matching size. Extensive experiments on synthetic and real datasets show that online task assignment under our privacy mechanism is notably more effective in terms of total distance than under prior differentially private mechanisms.","2375-026X","978-1-7281-2903-7","10.1109/ICDE48307.2020.00051","","https://ieeexplore.ieee.org/stamp/stamp.jsp?arnumber=9101624","","Task analysis;Privacy;Servers;Crowdsourcing;Data privacy;Extraterrestrial measurements","","43","","32","IEEE","27 May 2020","","","IEEE","IEEE Conferences"
"Incentive mechanism and protocol design for crowdsourcing systems","H. Xie; J. C. S. Lui; J. W. Jiang; W. Chen","Department of Computer Science & Engineering, The Chinese University of Hong Kong; Department of Computer Science & Engineering, The Chinese University of Hong Kong; Google; Microsoft Research Asia","2014 52nd Annual Allerton Conference on Communication, Control, and Computing (Allerton)","2 Feb 2015","2014","","","140","147","Crowdsourcing systems such as Amazon Mechanical Turk, Yahoo!Answers, and Google Helpouts have attracted extensive attention over the past few years. In a crowdsourcing system, a large group of “workers” solve the tasks outsourced by “requesters”. To make a crowdsourcing system sustainable, it is vital to attract users (both requesters and workers) to participate, and incentivize high-quality solutions. To achieve this objective, we design an effective incentive mechanism and reputation protocol. Our design incorporates various important elements of a crowdsourcing system such as workers having heterogeneous skill sets (i.e., some are “experts” while others are “novices”), and task assignment process, rating system, etc. Our incentive mechanism is composed of a rating system and a reward dividing scheme, and requires the system administrator to divide the reward based on requesters' rating on the solution quality. We derive the minimum reward needed so that “expert” workers are guaranteed provide high-quality solutions. We show that “novice” workers provide low-quality solutions, and our reputation protocol eliminates this undesirable behavior by tracking a worker's solution history and penalizing him when his reputation is poor. We apply repeated game-theoretic frameworks to quantify the impact of this reputation protocol on requesters' cost in guaranteeing high quality solutions.","","978-1-4799-8009-3","10.1109/ALLERTON.2014.7028448","","https://ieeexplore.ieee.org/stamp/stamp.jsp?arnumber=7028448","","Crowdsourcing;Protocols;Games;Waste materials;Indexes;History;Google","","34","","28","IEEE","2 Feb 2015","","","IEEE","IEEE Conferences"
"Task Allocation in Dependency-aware Spatial Crowdsourcing","W. Ni; P. Cheng; L. Chen; X. Lin","The Hong Kong University of Science and Technology, Hong Kong, China; East China Normal University, Shanghai, China; The Hong Kong University of Science and Technology, Hong Kong, China; The University of New South Wales, Australia",2020 IEEE 36th International Conference on Data Engineering (ICDE),"27 May 2020","2020","","","985","996","Ubiquitous smart devices and high-quality wireless networks enable people to participate in spatial crowdsourcing tasks easily, which require workers to physically move to specific locations to conduct their assigned tasks. Spatial crowdsourcing has attracted much attention from both academia and industry. In this paper, we consider a spatial crowdsourcing scenario, where the tasks may have some dependencies among them. Specifically, one task can only be dispatched when its dependent tasks have already been assigned. In fact, task dependencies are quite common in many real-life applications, such as house repairing and holding sports games. We formally define the dependency-aware spatial crowdsourcing (DA-SC), which focuses on finding an optimal worker-and-task assignment under the constraints of dependencies, skills of workers, moving distances and deadlines to maximize the successfully assigned tasks. We prove that the DA-SC problem is NP-hard and thus intractable. Therefore, we propose two approximation algorithms, including a greedy approach and a game-theoretic approach, which can guarantee the approximate bounds of the results in each batch process. Through extensive experiments on both real and synthetic data sets, we demonstrate the efficiency and effectiveness of our DA-SC approaches.","2375-026X","978-1-7281-2903-7","10.1109/ICDE48307.2020.00090","","https://ieeexplore.ieee.org/stamp/stamp.jsp?arnumber=9101878","Spatial Crowdsourcing;Task Assignment;Approximate Algorithm","Task analysis;Crowdsourcing;Games;Resource management;Approximation algorithms;Nickel","","31","","28","IEEE","27 May 2020","","","IEEE","IEEE Conferences"
"Secure and Deduplicated Spatial Crowdsourcing: A Fog-Based Approach","J. Ni; X. Lin; K. Zhang; Y. Yu","University of Waterloo, Waterloo, ON, CA; University of Ontario Institute of Technology, Canada; University of Waterloo, Canada; University of Electronic Science and Technology of China, China",2016 IEEE Global Communications Conference (GLOBECOM),"6 Feb 2017","2016","","","1","6","With the proliferation of mobile devices, spatial crowdsourcing is rising as a new paradigm that enables individuals to participate in tasks related to some locations in the physical world. Nevertheless, how to allocate these tasks to proper mobile users and improve communication efficiency are critical in spatial crowdsourcing. In this paper, we propose Fo-DSC, a fog-based deduplicated spatial crowdsourcing framework to achieve precise task allocation and secure data deduplication. Specifically, by integrating fog computing, we design a two-step task allocation mechanism to improve the accuracy of tasks allocation in spatial crowdsourcing. The fog nodes can detect and erase the repeated data in crowdsensing reports without learning any information about the reports. Furthermore, Fo-DSC efficiently records the contributions of mobile users whose data are reduplicated and deleted. As a result, these users do not become discouraged. Finally, we demonstrate that Fo-DSC satisfies the properties of fog-based task allocation and secure data deduplication with low computational and communication overheads.","","978-1-5090-1328-9","10.1109/GLOCOM.2016.7842248","","https://ieeexplore.ieee.org/stamp/stamp.jsp?arnumber=7842248","","Mobile communication;Crowdsourcing;Sensors;Resource management;Mobile handsets;Servers;Security","","30","","17","IEEE","6 Feb 2017","","","IEEE","IEEE Conferences"
"Crowdsourcing: Activities, incentives and users' motivations to participate","M. Hossain","Department of Industrial Engineering and Management School of Science, Aalto University, Finland",2012 International Conference on Innovation Management and Technology Research,"12 Jul 2012","2012","","","501","506","Advent of Internet provides growing features for the companies to engage users in online platforms where users share, design, and innovate different ideas. Crowdsourcing is an emerging phenomenon used to get benefits through these online community members who are unknown to companies in general. Crowdsourcing is crucial for the companies to identify consumers' needs and to solve these felt needs. The objective of this study was to explore the key activities performed through crowdsourcing, the incentives structure, geographical origins of platforms. This explorative study reveals the overall view of incentives structure in various online platforms. Collecting and analyzing information from over 400 online platforms, this study provides a phenomenal perspective in global context focusing particularly on prevalent activities, companies' incentives and geographical location etc. in relation with online crowdsourcing platforms.","","978-1-4673-0654-6","10.1109/ICIMTR.2012.6236447","","https://ieeexplore.ieee.org/stamp/stamp.jsp?arnumber=6236447","Crowdsourcing;Incentive;Motivation;Online Communities;Users' Participation","Technological innovation;Companies;Communities;Internet;Open source software;Problem-solving;Educational institutions","","24","","57","IEEE","12 Jul 2012","","","IEEE","IEEE Conferences"
"Hybrid Blockchain Design for Privacy Preserving Crowdsourcing Platform","S. Zhu; H. Hu; Y. Li; W. Li","Department of Computer Science, Georgia State University, Atlanta, GA, USA; Department of Computer Science, Georgia State University, Atlanta, GA, USA; Department of Computer Science, Georgia State University, Atlanta, GA, USA; Department of Computer Science, Georgia State University, Atlanta, GA, USA",2019 IEEE International Conference on Blockchain (Blockchain),"2 Jan 2020","2019","","","26","33","Blockchain has been treated as one of the most promising technologies to promote crowdsourcing by providing new nice features, such as decentralization and accountability. Unfortunately, some inherent limitations of blockchain have been rarely addressed by the most existing works when applying blockchain into crowdsourcing, which becomes the performance bottleneck of crowdsourcing systems. In this paper, we propose a novel hybrid blockchain crowdsourcing platform to achieve decentralization and privacy preservation. Our platform integrates with a hybrid blockchain structure, dual-ledgers, and dual consensus algorithms to ensure secure communication between the requesters and the workers. Moreover, the smart contract and zero-knowledge proof are employed to ensure automatic operation of the tasks and the protection users' privacy, respectively. Finally, we conduct experiments to confirm the efficiency of the adopted consensus algorithm on our platform by comparing it with the state-of-the-art.","","978-1-7281-4693-5","10.1109/Blockchain.2019.00013","","https://ieeexplore.ieee.org/stamp/stamp.jsp?arnumber=8946175","hybrid blockchain;crowdsourcing;smart contract;privacy preservation","Blockchain;Crowdsourcing;Peer-to-peer computing;Smart contracts;Privacy;Task analysis;Energy consumption","","24","","36","IEEE","2 Jan 2020","","","IEEE","IEEE Conferences"
"Effectively crowdsourcing the acquisition and analysis of visual data for disaster response","H. To; S. H. Kim; C. Shahabi","Integrated Media Systems Center, University of Southern California, Los Angeles, CA, US; Integrated Media Systems Center, University of Southern California, Los Angeles, CA, US; Integrated Media Systems Center, University of Southern California, Los Angeles, CA, U.S.A",2015 IEEE International Conference on Big Data (Big Data),"28 Dec 2015","2015","","","697","706","Efficient and thorough data collection and its timely analysis are critical for disaster response and recovery in order to save peoples lives during disasters. However, access to comprehensive data in disaster areas and their quick analysis to transform the data to actionable knowledge are challenging. With the popularity and pervasiveness of mobile devices, crowdsourcing data collection and analysis has emerged as an effective and scalable solution. This paper addresses the problem of crowdsourcing mobile videos for disasters by identifying two unique challenges of 1) prioritizing visualdata collection and transmission under bandwidth scarcity caused by damaged communication networks and 2) analyzing the acquired data in a timely manner. We introduce a new crowdsourcing framework for acquiring and analyzing the mobile videos utilizing fine granularity spatial metadata of videos for a rapidly changing disaster situation. We also develop an analytical model to quantify the visual awareness of a video based on its metadata and propose the visual awareness maximization problem for acquiring the most relevant data under bandwidth constraints. The collected videos are evenly distributed to off-site analysts to collectively minimize crowdsourcing efforts for analysis. Our simulation results demonstrate the effectiveness and feasibility of the proposed framework.","","978-1-4799-9926-2","10.1109/BigData.2015.7363814","","https://ieeexplore.ieee.org/stamp/stamp.jsp?arnumber=7363814","Crowdsourcing;Disaster Response;Geo-tagged Video","Videos;Crowdsourcing;Visualization;Data collection;Bandwidth;Metadata;Data acquisition","","21","","21","IEEE","28 Dec 2015","","","IEEE","IEEE Conferences"
